title,description,genre
piglets big movie,"W tajemniczych okolicznościach zaginął Prosiaczek. Przyjaciele ze Stumilowego Lasu wykorzystując ""Księgę wspomnień"" udają się na poszukiwania.",animation
black butterfly,Cierpiący na brak weny twórczej pisarz zaprasza do swojego domu mężczyznę spotkanego w barze. ,thriller
the secret life of pets,"Gdy ludzie opuszczają dom, zwierzęta prowadzą życie pełne przygód i intryg.&nbsp;",animation
the source," W dokumencie tym ujrzymy życie trzech pisarzy, liderów ruchu artystycznego nazywanego Beat Generation. Od momentu kiedy to Allen Ginsberg i Jack Kerouac poznali się w... ",biography
slugi boze,"Policjant bada sprawę młodej Niemki, członkini chóru gregoriańskiego, która rzuciła się z wieży kościoła we Wrocławiu.",crime
no way out,"W wyniku nieszczęśliwego wypadku wpływowy polityk zabija kochankę. Tuszując sprawę, jego doradca kieruje podejrzenia na domniemanego rosyjskiego szpiega.",thriller
dirty harry,"Szaleniec o pseudonimie Skorpion strzela do ludzi z dachów i szantażuje burmistrza San Francisco. Może go unieszkodliwić jedynie inspektor Callahan, znany ze stosowania brutalnych metod wobec przestępców. ",crime
the spy next door," Opowiedziana z wielkim rozmachem, pełna nieoczekiwanych zwrotów akcji komedia sensacyjna z szalonym Jackie Chanem to doskonała rozrywka dla całej rodziny. ",family
the 39 steps,"W jednym z londyńskich teatrów Richard poznaje tajemniczą dziewczynę. Gdy tej samej nocy zostaje ona zamordowana, mężczyzna postanawia rozwikłać zagadkę zbrodni. ",thriller
rampage,"Prymatolog Davis Okoye nawiązuje więź z inteligentnym gorylem. Nieudany eksperyment naukowy sprawia, że małpa oraz inne zwierzęta zaczynają siać spustoszenie w mieście. ",action
mortdecai,"Brytyjski arystokrata, będąc jednocześnie pracownikiem galerii sztuki oraz złodziejem, ma zamiar odnaleźć i zrabować obraz, który skrywa cenne informacje. ",comedy
dragon ball z 10: kiken na futari! supa senshi wa nemurenai,"Po walce na planecie Todokama, Saiyanin Brolly dociera na Ziemię. Son Gohan i wojownicy muszą przeciwstawić się jego sile.",action
shadow dancer,"Colette McVeigh, wdowa, matka i terrorystka działająca w IRA, dostaje ultimatum od angielskiego agenta - wstąpi w szeregi brytyjskich służb specjalnych albo już nigdy nie zobaczy swojego dziecka.",drama
you dont know jack,Lata 90. XX wieku. Amerykański lekarz toczy walkę o legalizację eutanazji. ,biography
nic smiesznego,Leżący w kostnicy reżyser wspomina swoje niezbyt zabawne życie.,drama
gruppo di famiglia in un interno," W starym rzymskim palazzo żyje w odosobnieniu starzejący się profesor&nbsp;i miłośnik sztuki&nbsp;(Burt Lancaster). Pewnego dnia wbrew jego woli w domu zagnieżdża się, wraz ze... ",drama
beowulf,Wojownik Beowulf staje do walki z potworami nękającymi królestwo Hrothgara. ,fantasy
henry: portrait of a serial killer,"Młoda Becky wprowadza się do brata, u którego mieszka niejaki Henry. Kobieta nie wie, że mężczyzna jest mordercą. ",crime
ostatnie pietro,"Kapitan Wojska Polskiego trafia na ślad afery, która zmieni całe jego życie.",thriller
whiskey tango foxtrot,Niezadowolona ze swojej pracy dziennikarka telewizyjna przyjmuje zlecenie zrobienia reportażu o inwazji na Afganistan.,biography
valiant,Niepozornych rozmiarów gołąb pragnie wstąpić w szeregi armii brytyjskiej. ,animation
sid and nancy,"Sid Vicious jest muzykiem oraz członkiem grupy Sex Pistols. W jego życiu dominują narkotyki i alkohol, które doprowadzają do tragedii.",biography
get smart,"Para tajnych agentów planuje unieszkodliwić członków zbrodniczej organizacji, by ocalić świat przed rządami terroru.",comedy
60 kilo niczego,Krzysztof zostaje kierownikiem w kopalni kruszców. Pierwszego dnia pracy dochodzi do wypadku. ,drama
dear wendy," W małym miasteczku osiemnastoletni Dick po stracie ojca czuje się bezpiecznie jedynie z pistoletem w dłoni. Choć nazywa siebie pacyfistą, razem z kolegami zakłada klub... ",drama
hidden,"Rodzina ukrywa się w schronie przeciwatomowym, aby uniknąć niebezpieczeństwa czyhającego na powierzchni Ziemi. ",horror
iron man 2,"Iron Man stawia czoło Iwanowi Wanko, znanemu jako Whiplash.",action
#sal-a-iss-da,Potworny wirus opanowuje miasto. Samotny mężczyzna zamknięty w mieszkaniu zostaje odcięty od pomocy i musi sam znaleźć wyjście z patowej sytuacji.,thriller
shadowboxer,"Płatna zabójczyni nie wykonuje zlecenia, gdy odkrywa, że jej potencjalna ofiara jest w ciąży. ",drama
birdemic: shock and terror,"Agresywne i bezwzględne orły chore na ptasią grypę mordują ludzi, pustosząc zachodnie wybrzeże Stanów.",horror
the spongebob movie: sponge out of water,"Gdy zostaje wykradziony sekretny przepis na kraboburgery, SpongeBob łączy siły ze swoim wrogiem Planktonem, by pokonać nikczemnego złodzieja. ",animation
rv,"Gdy wyjazd na Hawaje nie dochodzi do skutku, Bob wynajmuje przyczepę i zabiera rodzinę w podróż przez Kolorado. ",family
evita,"Historia życia Evy Peron, kobiety wywodzącej się z biedoty, która została pierwszą damą Argentyny u boku Juana Perona.",biography
gemini man,"Elitarny zabójca zostaje zaatakowany przez młodego mężczyznę, który potrafi przewidzieć każdy jego ruch. ",action
wiedzmin,Wiedźmin Geralt trudni się zwalczaniem niebezpiecznych potworów. Często jednak ludzkie okrucieństwo i żądza władzy są dużo groźniejsze. ,fantasy
cleaner,"Tom Cutler zajmuje się czyszczeniem miejsc zbrodni. Po wykonaniu jednego ze zleceń odkrywa, że został wykorzystany do usunięcia dowodów zabójstwa.",crime
the fast and the furious: tokyo drift,Pasjonat nielegalnych wyścigów samochodowych ucieka przed więzieniem do Tokio. Ale tutaj też organizowane są niebezpieczne rajdy.,action
house,Gorgeous ze swoimi sześcioma przyjaciółkami wybiera się do domu swojej ciotki.,fantasy
in the mouth of madness,Prywatny detektyw pracujący dla firmy ubezpieczeniowej dostaje zlecenie związane z odnalezieniem słynnego pisarza horrorów. W tym celu postanawia przeczytać wszystkie jego książki.,horror
ba-lam-eui pa-i-teo,Choi Baedal wyjeżdża w góry trenować sztuki walki. Po powrocie rzuca wyzwanie wszystkim mistrzom Japonii. ,biography
imagine that," Co by było, gdyby klucz do Twojego sukcesu leżał w wyobraźni Twojej córki? Gdy pewien magnat finansowy (Eddie Murphy) dostrzega, że jego imperium zaczyna się powoli... ",fantasy
the incredible hulk,"Od czasu napromieniowania Bruce szuka antidotum, które pozwoli mu zachować ludzkie ciało. Na jego drodze staje amerykański generał i brytyjski superżołnierz.",action
asterix et le coup du menhir,"Panoramiks traci pamięć i rozum. Asteriks z Obeliksem starają się uzdrowić druida, od niego wszak zależy przyszłość galijskiej wioski.",animation
the lorax,"Dwunastolatek wyrusza w podróż, chcąc znaleźć prawdziwe drzewo Truffula. Na swojej drodze spotyka Loraxa, nieco zrzędliwego obrońcę swojego świata.",animation
puss in boots,"Kot w Butach wraz z kompanami organizuje skok, mający na celu znalezienie i porwanie mitycznej gęsi znoszącej złote jaja.",animation
spectral,Jednostka sił specjalnych stawia czoła nadnaturalnym istotom. ,action
rozmowy kontrolowane,"Ryszard Ochódzki wyjeżdża do Suwałk, by przeniknąć do tamtejszych struktur Solidarności. W wyniku zbiegu okoliczności zmuszony jest uciekać przed milicją.&nbsp;",comedy
demonic,"Policjant i psycholog badają sprawę śmierci piątki osób, którzy zginęli, przywołując duchy.",horror
teenage mutant ninja turtles: out of the shadows,Czterej wojownicy muszą się zmierzyć z cieszącym się bardzo złą sławą Krangiem. ,comedy
das experiment,Oparta na faktach historia zakończonego skandalem makabrycznego badania.,drama
dangerous beauty,"W XVI-wiecznej Wenecji jedynie kurtyzany mogły się kształcić. Tę drogę wybiera Weronika, kiedy jej ukochany poślubia wyznaczoną mu przez rodziców arystokratkę. ",biography
village of the damned,"Po wybudzeniu się z tajemniczej śpiączki mieszkanki angielskiej wioski odkrywają, że są w ciąży. Gdy rodzą się dzieci, przejawiają one niebezpieczne zdolności parapsychologiczne. ",horror
godzilla: king of the monsters,"Po pojawieniu się nowego zagrożenia Król Potworów powraca, by ponownie przywrócić w przyrodzie równowagę. ",action
nightwatching," Akcja filmu rozpoczyna się w 1642, w roku w którym Rembrandt przyjmuje zamówienie na grupowy portret amsterdamskiej kompanii strzeleckiej. Obraz ten nazwany ""Straż... ",biography
the crow,"Erick i jego dziewczyna zostają zamordowani. Rok później mężczyzna powraca z zaświatów, aby przy pomocy kruka pomścić śmierć ukochanej.",fantasy
le petit baigneur,Przemysłowiec zwalnia z pracy młodego konstruktora. Po pewnym czasie zaczyna żałować decyzji i próbuje namówić go do powrotu.,comedy
mr hublot,"Pan Hublot prowadzi uporządkowane życie do momentu, gdy w jego mieszkaniu pojawia się pies. ",animation
the chronicles of narnia: prince caspian,"Rodzeństwo Pevensie powraca do Narnii, aby pomóc księciu Kaspianowi odzyskać należny mu tron i przywrócić w królestwie dawny ład.",family
power rangers,"Uczniowie szkoły średniej wykorzystują swoje unikalne zdolności, by uratować świat. ",action
you will meet a tall dark stranger,"Po tym jak Helena zostaje porzucona przez męża dla młodej dziewczyny, powierza swój los wróżce.",comedy
the visit,"Dokument opowiada o tym, co stałoby się, gdyby na Ziemi wylądowała nieznana i inteligentna forma życia.&nbsp;",documentary
nightcrawler,"Szukający desperacko pracy Lou Bloom wpada na pomysł, by filmować nocne wypadki i zbrodnie, po czym sprzedawać materiały lokalnej telewizji. ",drama
the hills have eyes ii,Podczas poszukiwań zaginionych naukowców grupa kadetów nieświadomie wkracza na terytorium zdeformowanych kanibali.,horror
fotograf,"Historia nieuchwytnego moskiewskiego mordercy, który na miejscu zbrodni pozostawia kartoniki z numerami.",crime
asterix - le secret de la potion magique,"Panoramiks chce przejść na emeryturę, dlatego wyrusza z Asteriksem i Obeliksem, by znaleźć godnego siebie następcę. ",animation
speed racer,"Kierowca wyścigowy odkrywa, że wyniki zawodów są ustawiane przez motoryzacyjną korporację.&nbsp;",family
"dont worry, he wont get far on foot", Po przejściu poważnego wypadku John Callahan próbuje ustabilizować swoje życie i zacząć żyć w trzeźwości. Przy okazji odkrywa uzdrawiające działanie sztuki. Dzięki swoim... ,biography
youve got mail,Kathleen dziedziczy po matce małą księgarnię. Niestety w pobliżu otwiera swój oddział największa nowojorska sieć wydawnicza. ,comedy
arthur,"Przyzwyczajony do luksusu Arthur musi wybrać pomiędzy małżeństwem z rozsądku, dzięki któremu zachowa majątek, a prawdziwą miłością.",comedy
the last airbender,"Pan Ognia podbija cztery krainy, na które podzielony jest świat. Po upływie stu lat pojawia się Aang - potomek jedynej istoty zdolnej przywrócić równowagę. ",fantasy
the weekend away,"Najlepsza przyjaciółka Beth znika podczas wycieczki do&nbsp;Chorwacji. Beth próbuje ustalić, co się z&nbsp;nią stało, ale każdy kolejny trop okazuje się kłamstwem.",thriller
luomo del labirinto,"Nastolatka zostaje porwana i uwięziona na piętnaście lat. Gdy budzi się w szpitalu, niczego nie pamięta. ",thriller
black sheep,Zmutowane owce zaczynają atakować ludzi.&nbsp;,horror
falling down,"Niechcący przegapić przyjęcia urodzinowego swojej córki mężczyzna tkwi w ulicznym korku. Kiedy puszczają mu nerwy, kontynuuje wędrówkę pieszo, wyładowując swoją złość na innych ludziach. ",thriller
shaft,Czarnoskóry detektyw otrzymuje zlecenie odnalezienia porwanej córki wpływowego gangstera.,crime
control,"Historia życia wokalisty zespołu Joy Division - Iana Curtisa, który popełnił samobójstwo w wieku 23 lat.",biography
genius,"Thomas Wolfe pragnie znaleźć oficynę, skłonną wydać jego powieść. Po długich poszukiwaniach trafia na Maxa Perkinsa, doświadczonego korektora, którego głównym celem jest odkrywanie młodych i zdolnych autorów.",biography
wszystkie nasze strachy,"Daniel - artysta, katolik i aktywista - postanawia rozprawić się z homofobią lokalnej społeczności.",drama
dark star,Czworo astronautów przebywa od 20 lat w kosmosie. Ich zadaniem jest unicestwianie przemieszczających się planet mogących zagrozić kolonizacji strefy pozaziemskiej.,comedy
zashchitniki,Grupa superbohaterów staje do walki ze swoim stwórcą posiadającym ogromną moc.,action
valerian and the city of a thousand planets,Kosmiczni agenci Valerian i Laureline zostają wysłani z misją przeprowadzenia śledztwa w międzygalaktycznym Mieście Tysiąca Planet.,action
sami swoi,Zwaśnione od wielu lat rodziny Pawlaków i Kargulów trafiają z Kresów Wschodnich na Ziemie Odzyskane.,comedy
sin city: a dame to kill for,"Dwight, mieszkaniec Basin City - miasta korupcji, przestępstwa i prostytucji, jest poszukiwany przez żądną zemsty kobietę, która niegdyś go porzuciła.",crime
the last witch hunter,Współczesny Nowy Jork. Ostatni łowca czarownic staje do walki przeciwko wiedźmom. ,fantasy
die unendliche geschichte,"Młody chłopiec wchodzi w posiadanie książki, która jest kluczem do świata fantazji.",family
lappartement," Max, młody i dynamiczny urzędnik dużej i prężnie rozwijającej się firmy informatycznej ma niebawem poślubić siostrę swojego szefa, Muriel. Póki co, wybiera się w... ",thriller
dragon: the bruce lee story,"Młody mistrz sztuk walki, Bruce Lee, wyjeżdża do Ameryki, by zdobyć sławę. Nie wszystko jednak idzie po jego myśli.",biography
step brothers,Po ślubie swoich rodziców dwóch mężczyzn w średnim wieku zostaje przyrodnimi braćmi i współlokatorami.,comedy
charlie wilsons war,Amerykański kongresmen stara się zorganizować pomoc dla afgańskich rebeliantów walczących z Sowietami. ,biography
dzieciol,Stefan Waldek pod nieobecność żony szuka przygodnego romansu. ,comedy
percy jackson &amp; the olympians: the lightning thief,"Potomek Posejdona, nastolatek Percy Jackson, wraz ze swoimi przyjaciółmi wyrusza w podróż, aby odnaleźć Piorun Zeusa. ",fantasy
nad zycie,"Gwiazda siatkówki, Agata Mróz jest o krok od zdobycia mistrzostwa świata. Niestety, kilka dni przed finałem dowiaduje się, że jest chora na białaczkę. ",biography
the lodge,"Nowa dziewczyna ojca dwójki dzieci zostaje z nimi sama w niewielkim domku letniskowym podczas śnieżycy. Mimo początkowych nieporozumień znajdują wspólny język, ale wtedy zaczynają dziać się dziwne rzeczy. ",horror
tangled ever after,"Podczas ślubu Roszpunki i Julka koń Max niechcący upuszcza obrączki. Wraz z kameleonem Pascalem stara się je złapać, nim ceremonia osiągnie punkt kulminacyjny. ",animation
"job, czyli ostatnia szara komorka",Trzech przyjaciół-nieudaczników zmaga się z trudnościami życiowymi. Ukojenie w ciężkich chwilach przynosi im oglądanie ulubionych programów TV. ,comedy
mickeys christmas carol,"Ebenezer Scrooge jest chciwym i bezdusznym bankierem, który całe życie poświęcił dla pieniędzy. W Wigilię skąpca odwiedzają trzy duchy.",animation
jin-ro," Akcja filmu rozgrywa się w alternatywnym świecie po tym, jak Japonia przegrała II Wojnę Światową z Niemcami. Po 10 latach od opuszczenia kraju przez wojska okupanta... ",action
v paprscich slunce,Dziewczynka z przeciętnej rodziny zostaje wybrana do północnokoreańskiej spartakiady. ,documentary
der baader meinhof komplex,"Historia działalności Frakcji Czerwonej Armii - niemieckiej organizacji terrorystycznej, która za cel wzięła sobie walkę z ""amerykańskim imperializmem"".",biography
sleepless,"Vincent Downs jest dobrym gliną pracującym pod przykrywką w świecie pełnym mafiosów i gangsterów. Gdy jego syn zostaje porwany, będzie zmuszony wejść głębiej w nieprzyjazne sobie środowisko, by go odnaleźć, a winnych postawić przed sądem.",thriller
frenzy,Z Tamizy zostaje wyłowiona kobieta uduszona krawatem. Posądzony niesłusznie o zabójstwo Richard Blaney musi udowodnić swą niewinność.,crime
push,Dwoje Amerykanów o parapsychologicznych zdolnościach musi znaleźć dziewczynę z Hongkongu. Tropi ją także rządowa agencja prowadzająca badania na osobach posiadających nadprzyrodzone talenty.,thriller
rise," Pewnego dnia, po przebudzeniu, młoda reporterka (Lucy Liu), stwierdza, że znajduje się w kostnicy. Kiedy okazuje się, że naprawdę nie żyje, postanawia zemścić się za... ",horror
riding in cars with boys,Nastoletnia Beverly zachodzi w nieplanowaną ciążę i wychodzi za mąż. Nie porzuca jednak swojego marzenia o karierze pisarki.,biography
de lautre cote du periph,"Dwóch skrajnie różnych policjantów, rozwiązując kryminalną zagadkę, zadziera z wysoko postawionymi ludźmi władzy, którym wydaje się, że są nietykalni. ",action
13,"Vince, licząc na duży zarobek, wchodzi do gry, w której stawką jest ludzkie życie.",thriller
the commuter,"Historia agenta ubezpieczeniowego, który podróżuje codziennie pociągiem do pracy. Pewnego dnia zostaje wciągnięty w kryminalną intrygę przez jedną pasażerkę pociągu.",thriller
psy 3. w imie zasad,"Po 25 latach odsiadki Franz Maurer wkracza w nową Polskę, gdzie nic nie jest takie, jak zapamiętał. Wkrótce ponownie spotyka Nowego.",thriller
crank: high voltage,"Chev Chelios zostaje zoperowany w wyniku czego lekarze wszczepiają mu sztuczne serce. Aby przetrwać, mężczyzna musi doładowywać się prądem. ",action
under siege,"Terroryści opanowują statek z bronią jądrową. Ich plany niweczy kucharz okrętowy, były komandos Ryback.",thriller
harry potter and the half-blood prince,"Harry, by ostatecznie pokonać Voldemorta, musi poznać jego przeszłość. ",family
on deadly ground,"Forrest Taft postanawia udaremnić plany koncernu naftowego, który chce zagospodarować dziewicze tereny Alaski.",thriller
evil angels,Dziewięciotygodniowa córeczka Michaela i Lindy Chamberlain zostaje zabita przez psa Dingo. Z powodu braku dowodów podejrzenie pada na zrozpaczonych rodziców. ,crime
misconduct,"Młody prawnik zostaje wplątany w sieć korupcyjnej intrygi, gdy przyjmuje sprawę przeciwko potężnej firmie farmaceutycznej. ",thriller
cool runnings,"Historia jamajskiej drużyny bobslejowej, która uczestniczy w igrzyskach zimowych.&nbsp;",family
rudy kapitan,Detektyw usiłując rozwikłać zagadkę kryminalną wplątuje się w niebezpieczną grę. ,crime
you get me,"Po nocy spędzonej z nowo poznanym chłopakiem, Tylerem, Holly ogarnia niezdrowa obsesja na jego punkcie. Przenosi się do jego liceum i próbuje kontynuować ich „związek”.",thriller
hell ride,Wódz bezwzględnego gangu motocyklowego poprzysiągł zemstę przywódcy innej bandy.,action
black rain,"Dwaj policjanci eskortują do Japonii więźnia powiązanego z yakuzą. Kiedy podejrzany ucieka, mężczyźni rozpoczynają poszukiwania w obcym dla siebie środowisku. ",crime
madagascar,"Lew, zebra, hipopotam i żyrafa zostają wysłane statkiem z nowojorskiego zoo do Afryki. Pośrodku oceanu ich klatki wypadają za burtę pokładu, w wyniku czego zwierzęta lądują na brzegu egzotycznej wyspy.",animation
le samourai,"Gdy kolejne zlecenie nie przebiega po myśli płatnego zabójcy, rozpoczyna się policyjna nagonka. ",crime
devils due,"Po powrocie z miesiąca miodowego Samantha dowiaduje się, że jest w ciąży. Zmiana jej zachowania i wyglądu budzi podejrzenia męża. ",horror
"bedziesz legenda, czlowieku",Dokument przedstawia polską reprezentację w piłce nożnej podczas Euro 2012.,documentary
saint maud,"Maud przyjeżdża do luksusowej posiadłości ekscentrycznej Amandy. Wkrótce dziewczyna przekonuje się o swojej ważnej misji, która zamieni się w niebezpieczną obsesję... ",horror
petla,"Losy polskiego policjanta przypadkowo łączą się z ukraińskimi braćmi. Wspólnie przejmują dom publiczny, w którym umieszczają kamery, a następnie gromadzą materiały do szantażu. ",thriller
million dollar arm,Agent sportowy próbuje pozyskać utalentowanego gracza krykieta z Azji do klubu w MLB. ,biography
kong: skull island,"Kiedy grupa odkrywców trafia na wyspę zamieszkałą przez mitycznego Konga, ich misja badawcza zamienia się w walkę o przetrwanie.",fantasy
heathers,Należąca do najpopularniejszych uczennic w szkole Veronica nawiązuje znajomość z niebezpiecznym socjopatą.,comedy
deliver us from evil,Policjant z Nowego Jorku bada serię przestępstw. Pomaga mu znający się na egzorcyzmach ksiądz.,horror
the angry birds movie,"Czerwony od dzieciństwa ma problem z gniewem. Gdy na wyspie pojawiają się zielone świnki, jako jedyny pozostaje nieufny.",animation
catfish,"Nev, 24-letni fotograf z Nowego Jorku, nie ma pojęcia, w co się pakuje, gdy kontaktuje się z nim przez Facebooka pewna ośmiolatka, by uzyskać pozwolenie na namalowanie jednego z jego zdjęć.",documentary
the breadwinner,"Jedenastoletnia Afganka przebiera się za chłopca, aby podjąć pracę i pomóc rodzinie.",animation
arsene lupin,Mający powodzenie u kobiet złodziej zakochuje się w tajemniczej hrabinie Cagliostro. Mężczyzna pomaga jej zdobyć trzy krucyfiksy prowadzące do ukrytego skarbu.,crime
monsieur verdoux,"Verdoux, były kasjer bankowy, utrzymuje swoją rodzinę z mordowania bogatych kobiet. ",drama
lassie,"Matt zaprzyjaźnia się z psem, dzięki któremu zaczyna inaczej patrzeć na świat.",family
teen titans go! to the movies,"Młodzi Tytani też chcą mieć film o swoich przygodach, dlatego wyruszają do Tinsel Town, by do pomysłu przekonać znanego reżysera. ",animation
wyrmwood: road of the dead,"Apokalipsa zombie zbiera krwawe żniwo. Mała grupa ludzi podróżuje przez australijski busz, jest wśród nich Barry poszukujący zaginionej siostry Brooke. ",horror
le fidele,Historia miłości między Bibi i Gino wymieszana z brutalnym światem przestępczym i skrywaną tajemnicą.,crime
hotarubi no mori e,"Hotaru spotyka w lesie Gina, chłopca ducha, który - jeśli zostanie dotknięty przez człowieka - zniknie.",fantasy
patton,Generał Patton walczy z Niemcami na wielu frontach II wojny światowej.,biography
conan the destroyer,Mocarny wojownik podejmuje się misji eskortowania księżniczki Jehnny w drodze po magiczny róg. W zamian ma odzyskać zmarłą ukochaną. ,fantasy
time bandits,Uciekające przed swoim panem karły trafiają do mieszkania Kevina.,family
evan almighty,Świeżo wybrany amerykański kongresmen dostaje od Boga zadanie zbudowania Arki. Mimo początkowego sceptycyzmu podejmuje się realizacji powierzonej mu misji. ,fantasy
the way of the gun,"Dwóch mężczyzn porywa dla okupu kobietę w ciąży, która nosi dziecko bogatego przedsiębiorcy ze sztucznego zapłodnienia.",crime
teenage mutant ninja turtles,Cztery żółwie w wyniku kontaktu z tajemniczą substancją uzyskują ludzkie rozmiary i umysł. Ich mentorem oraz opiekunem zostaje szczur Splinter.,family
the limits of control,"Płatny morderca dostaje zlecenie, którego szczegółów dostarczają mu nieznajome osoby.",thriller
super mario bros.,"Bracia Mario, dwaj włoscy hydraulicy z Brooklynu, wyruszają do równoległego świata by uratować Daisy, archeolog porwaną przez króla Koopę.",fantasy
the anomaly,"Były żołnierz Ryan budzi się na tyłach furgonetki obok porwanego chłopca. Mężczyzna ma zaledwie 9 minut i 47 sekund, by odkryć prawdę. ",action
the purge: anarchy,Podczas Nocy Oczyszczenia cztery osoby stają się celami żądnych krwi morderców. W przetrwaniu na ulicach Los Angeles pomaga im tajemniczy mężczyzna pragnący wyrównać własne rachunki za krzywdę z przeszłości. ,thriller
eurotrip,"Absolwent liceum wyrusza z grupą przyjaciół w szaloną podróż do Europy, by spotkać się ze swoją internetową znajomą.",comedy
evil dead ii,Ash i jego dziewczyna podczas pobytu w leśnej chacie budzą złe moce. ,horror
harry potter and the order of the phoenix,"Harry i jego przyjaciele zakładają tajne stowarzyszenie ""Gwardię Dumbledore'a"", aby przygotować się do starcia z Voldemortem.",family
the five-year engagement,"Tom i Violet planują ślub. Przekładają go z roku na rok, poświęcając się karierze.",comedy
che: part one,Rok 1956. Młody Argentyńczyk Ernesto Guevara i kubańscy rewolucjoniści dowodzeni przez Fidela Castro podejmują walkę z dyktatorem Batistą. ,biography
solaris," Świat w niedalekiej przyszłości. Dr Chris Kelvin (George Clooney), psycholog, ma zbadać przyczyny zagadkowych zachowań niewielkiej grupy naukowców na pokładzie stacji... ",drama
in a world...," Lake Bell&nbsp;(""Sex Story"") występuje w zabawnej i szczerej komedii ""Własnym głosem"", o instruktorce emisji głosu, która zmaga się z twardym współzawodnictwem w bezwzględnym... ",comedy
only the brave,Grupa strażaków walczy z pożarem trawiącym las. Ogień zaczyna zagrażać mieszkańcom miasteczka Yarnell w Arizonie.,biography
the taking,"Mia kręci dokument o chorobie Aizheimera w domu, gdzie podczas zdjęć zaczynają dziać się dziwne rzeczy.&nbsp;",horror
rambo: last blood,"John Rambo opuszcza ranczo w Arizonie i udaje się do Meksyku, by ocalić porwaną przez najbardziej bezwzględny kartel przybraną córkę.",action
transformers,Wojna pomiędzy dwoma rasami robotów – Autobotami i Decepticonami przenosi się na Ziemię. W samym środku walki znajdzie się nastolatek Sam Witwicky.,action
vals im bashir,Bohater filmu próbuje sobie przypomnieć traumatyczne przeżycia związane z wojną w Libanie w 1982 roku. O swoich wspomnieniach opowiada staremu znajomemu spotkanemu w barze.,biography
