title,description,genre
australia,Brytyjska arystokratka przybywa do Australii. Wkrótce dziedziczy farmę i walczy o jej utrzymanie. ,drama
waitress,"Nieszanowana przez męża kelnerka spotyka atrakcyjnego lekarza, który otacza ją opieką.",drama
drive me crazy," Nastoletnia Nicole i jej rówieśnik Chase są sąsiadami, ale nie mają ze sobą wiele wspólnego. Nicole interesuje się modą i sportem, natomiast Chase jest spokojnym... ",drama
a wedding," Wesele i ślub Dina Corelli z panną Brenner staje się dla Altmana wspaniałą okazją do wyśmiania amerykańskiego społeczeństwa. Altman wyśmiewa prawie wszystko, od sztucznej... ",drama
tatarak,"Kobieta, która straciła synów na wojnie, odnajduje ukojenie w przyjaźni z młodym mężczyzną. Tymczasem jej mąż skrywa przed nią sekret, który może odmienić jej życie.",drama
todos lo saben,"Laura&nbsp;wraz z dwójką dzieci powraca do rodzinnego miasteczka w Hiszpanii na wesele siostry. Imprezę przerywa zniknięcie Irene, jej nastoletniej córki.",drama
green book,Drobny cwaniaczek z Bronksu zostaje szoferem ekstrawaganckiego muzyka z wyższych sfer i razem wyruszają na wielotygodniowe tournée.,drama
les miserables,"Montfermeil, które pulsuje od napięć, gniewu i niepewności to miejsce, w którym nawet niewinny psikus może okazać początkiem rewolucji. ",drama
the squid and the whale,Bernard i Joan postanawiają się rozstać. Ich dwaj synowie na swój sposób przeżywają separację rodziców. ,drama
romper stomper,"Opowieść o grupie skinheadów, którzy są zaniepokojeni zmianami zachodzącymi w ich okolicy.",drama
i am david," Film opowiada historię dwunastoletniego chłopca, Davida, który ucieka z komunistycznego obozu koncentracyjnego mając przy sobie jedynie kompas, bochenek chleba, list i... ",drama
network,Stacja telewizyjna wykorzystuje rewelacje głoszone przez obłąkanego prezentera wiadomości dla własnych korzyści.,drama
ssa-i-bo-geu-ji-man kwaen-chanh-a,"Young-goon trafia do szpitala psychiatrycznego, myśląc, że jest robotem.",drama
gruppo di famiglia in un interno," W starym rzymskim palazzo żyje w odosobnieniu starzejący się profesor&nbsp;i miłośnik sztuki&nbsp;(Burt Lancaster). Pewnego dnia wbrew jego woli w domu zagnieżdża się, wraz ze... ",drama
the dresser, W czasach powszechnego upadku i rozpadu całego ładu światowego (II wojna światowa) także teatr przeżywa swój kryzys. Większość z młodych aktorów została powołana do... ,drama
take the lead,Pierre Dulane daje bezpłatne lekcje tańca towarzyskiego trudnej młodzieży&nbsp;ze szkoły publicznej. Niechętni nastolatkowie z czasem zmieniają zdanie na temat nowych zajęć.,drama
the humbling,Życie pogrążonego w depresji aktora wywraca się do góry nogami pod wpływem związku z dużo młodszą kobietą.,drama
the good shepherd,"Edward Wilson robi szybką karierę w CIA. Wkrótce rozpoczyna prywatną grę z szefem KGB o kryptonimie ''Ulisses"", gdzie stawką jest dobro jego rodziny.",drama
last christmas,"Kate to pechowa dziewczyna pracująca jako asystentka Świętego Mikołaja w londyńskim domu towarowym. Kiedy poznaje Toma, jej życie zaczyna się zmieniać na lepsze.&nbsp;",drama
frankenstein,"Rok 1794. Ocalały rozbitek opowiada załodze statku mrożącą krew w żyłach historię o potworze, którego stworzył.",drama
subway,Fred kradnie cenne dokumenty z domu zamożnej kobiety. Schronienie znajduje w paryskim metrze.,drama
xxy,"Alex jest hermafrodytą, który właśnie staje przed problemem wyboru płci. Wizyta znajomych wraz z synem staje się tłem do poszukiwania tożsamości seksualnej. ",drama
"hori, ma panenko!",W małej czeskiej miejscowości odbywa się coroczny Bal Strażaków. Pomimo dokładnych przygotowań nie wszystko idzie zgodnie z planem.,drama
tre metri sopra il cielo," Babi (Katy Louise Saunders), dziewczyna z tak zwanego dobrego domu, świetna uczennica i przykładna córka, poznaje Stepa (Riccardo Scamarcio), agresywnego chuligana,... ",drama
non ti muovere,Nad szpitalnym łóżkiem ojciec opowiada nieprzytomnej córce ponurą historię swojego życia i pozamałżeńskiego związku.,drama
trust,Czternastoletnia Annie poznaje na czacie o dwa lata starszego Charliego. Dziewczyna coraz bardziej angażuje się w internetową znajomość. ,drama
gravity,Weteran misji kosmicznych i ambitna pani naukowiec krążą po orbicie Ziemi na uszkodzonym promie.,drama
the wrestler,"Zawał serca zmusza Randy'ego ""The Rama"" Robinsona do porzucenia zapasów. Szara rzeczywistość i przygnębiająca praca w delikatesach sprawiają, że chce jeszcze raz stanąć na ringu.",drama
hold om mig,Kilku chłopców symuluje gwałt na szkolnej koleżance. Jedna z przyglądających się scenie uczennic nagrywa wszystko telefonem komórkowym.,drama
beach rats,"Nastolatek z Brooklynu poszukuje własnej tożsamości, balansując między nieuczciwymi przyjaciółmi, potencjalną dziewczyną i starszymi mężczyznami, których poznaje online. ",drama
ivanovo detstvo,Podczas II wojny światowej osierocony chłopiec uczestniczy w akcjach zwiadowczych.,drama
rules dont apply,"Historia Howarda Hughesa, który w późnych latach swojego życia ma romans z młodszą kobietą.",drama
la vida secreta de las palabras,Samotna Hanna zatrudnia się na platformie wiertniczej do opieki nad ciężko poparzonym Josefem. Rodzi się między nimi nietypowe uczucie.,drama
lion,Pięcioletni chłopiec gubi się na ulicach Kalkuty. 25 lat później wyrusza na poszukiwanie utraconego domu i rodziny.,drama
mississippi grind,"Życiowy pechowiec i sprytny pokerzysta wyruszają w podróż na północ, która zmieni ich życie. ",drama
koe no katachi,"Shouya Ishida w szkole podstawowej dokucza niesłyszącej dziewczynie. Po latach, kiedy sam doświadcza odtrącenia przez rówieśników z powodu swojego dawnego zachowania, postanawia wszystko naprawić.",drama
the giver,"W świecie bez uczuć i emocji nastoletni Jonas zostaje wybrany na Odbiorcę Wspomnień, który strzeże pamięci o przeszłości. Pod wpływem mentora zaczyna dostrzegać wady opresyjnego systemu. ",drama
the party,"Janet organizuje przyjęcie z okazji awansu w świecie brytyjskiej polityki. Jej mąż chce jednak wykorzystać okazję do ogłoszenia wiadomości, która zmieni przebieg spotkania.",drama
mayor,"Sergey, oficer policji, dowiaduje się, że żona rodzi dziecko. Spiesząc do szpitala, potrąca siedmioletniego chłopca. ",drama
a perfect day,Grupa pracowników pomocy humanitarnej próbuje rozwiązać kryzys w strefie konfliktu zbrojnego. ,drama
ma nuit chez maud,"Młody idealista poznaje kobietę, która jest dla niego ucieleśnieniem marzeń. Nie ma jednak odwagi, by się do niej zbliżyć i nawiązuje znajomość z inną dziewczyną. ",drama
71,"Konflikt północnoirlandzki. Młody angielski rekrut zostaje zesłany na wrogie tereny, gdzie przeżywa samotną noc pełną strachu, niepewności i rozpaczy.&nbsp;",drama
yuma,Popeerelowska bieda w Polsce zmusza Zygę do jumy – szabrowania wyrobów luksusowych za zachodnią granicą.,drama
american made,"Historia Barry'ego Seala, człowieka, który jednocześnie pracował dla CIA oraz kartelu.",drama
delivery man,"Anonimowy dawca nasienia dowiaduje się, że spłodził 533 dzieci. Jego potomkowie wnoszą petycję do banku spermy o ujawnienie danych ojca. ",drama
bande a part," Węsząc okazję do zdobycia łatwych pieniędzy, Arthur przekonuje swego przyjaciela, Franza, by przedstawił mu swoją dziewczynę, Odile. Odile bowiem powiedziała Franzowi o... ",drama
intimacy,"Muzyk po przejściach próbuje poznać bliżej tajemniczą nieznajomą, która odwiedza go raz w tygodniu.",drama
a walk in the clouds,"Paul, weteran wojenny, poznaje ciężarną Victorię. Jedzie z nią w rodzinne strony i udaje jej męża. ",drama
die weisse massai,Zakochana w Masaju Szwajcarka postanawia za niego wyjść i zamieszkać w Kenii. &nbsp; ,drama
noi albinoi,"Noi to mieszkający w małym islandzkim miasteczku siedemnastolatek, który marzy, by uciec razem z dziewczyną pracującą na pobliskiej stacji benzynowej.",drama
monsieur verdoux,"Verdoux, były kasjer bankowy, utrzymuje swoją rodzinę z mordowania bogatych kobiet. ",drama
the cincinnati kid,"Młody pokerzysta wyzywa na pojedynek mistrza, który od trzydziestu lat cieszy się tytułem najlepszego gracza w kraju. ",drama
k-19: the widowmaker,Uzbrojony w głowice jądrowe radziecki okręt podwodny zbliża się do wybrzeża USA. Na pełnym morzu następuje awaria reaktora. ,drama
the treasure of the sierra madre,"Trzech mężczyzn wyrusza w góry Sierra Madre, aby odnaleźć złoto.",drama
lebanon,"Czerwiec 1982 roku, wojna libańska. Grupa niedoświadczonych żołnierzy dostaje zadanie rozpoznania terenu wroga. ",drama
the stanford prison experiment,"Dwudziestu czterech studentów zostaje losowo podzielonych na osadzonych i strażników, by wziąć udział w eksperymencie więziennym organizowanym przez wydział psychologii uniwersytetu Stanford. ",drama
southpaw,Pomimo przeciwności losu bokser stara się powrócić na szczyt i odzyskać dobre imię. ,drama
palmeras en la nieve,"Po znalezieniu wskazówki w&nbsp;starym liście młoda kobieta wyrusza na&nbsp;rodzinną plantację w&nbsp;tropikach, aby poznać skrywane od pokoleń sekrety.",drama
"synecdoche, new york","Reżyser teatralny przygotowuje nową sztukę, zmagając się jednocześnie z kobietami swego życia. ",drama
hush," Młoda i ciężarna żona Jacksona (G. Paltrow) staje się obiektem szykan jego matki, Marthy (J. Lange), która nie może pogodzić się z utratą syna na rzecz innej kobiety.... ",drama
lucky them,Dziennikarka rockowa dostaje zlecenie wytropienia swojego byłego chłopaka.,drama
die verlorene zeit,"Dwójka zakochanych więźniów obozu koncentracyjnego organizuje ucieczkę, lecz los i wojna rozdzielają ich. Po wielu latach kobieta, dostrzegając lubego w telewizji, postanawia go odnaleźć.",drama
duze zwierze,"Sawiccy postanawiają zaopiekować się znalezionym wielbłądem. Lokalna społeczność zrobi wszystko, by uniemożliwić im to przedsięwzięcie. ",drama
tsotsi,Młody afrykański gangster kradnie samochód i ku swojemu zaskoczeniu odkrywa na tylnym siedzeniu niemowlę.,drama
orokbefogadas," Kata (Katalin Berek) mieszka na wsi i jest samotną wdową po czterdziestce. Utrzymuje intymne kontakty z żonatym mężczyzną (László Szabó) i pragnie mieć z nim dziecko, by... ",drama
gran torino,"Walt Kowalski to emerytowany weteran żyjący we własnym poukładanym świecie. Jego spokój zostaje zburzony przez nowych sąsiadów z Azji, których syn spróbuje ukraść mu ulubione auto.",drama
a tale of love and darkness,Autobiografia opowiadająca o dzieciństwie wybitnego pisarza Amosa OZa. ,drama
ostatni komers,Grupa młodzieży kończąca naukę w gimnazjum przygotowuje się do ostatniej imprezy.,drama
offret sacrificatio,"Gdy zostaje nadany alarm zwiastujący atak atomowy, ateista zwraca się o pomoc do Boga. Gotów jest poświęcić samego siebie, by zapewnić bliskim bezpieczeństwo. ",drama
"they shoot horses, dont they?",Ofiary kryzysu finansowego tańczą w maratońskim konkursie tanecznym. Główną nagrodą jest duża suma pieniędzy. ,drama
good," Niemcy, lata 30. XX wieku. Profesor akademicki John Halder (Viggo Mortensen) jest uczciwym i porządnym człowiekiem. Jego życie to nie bajka. Opiekuje się neurotyczną... ",drama
"tango, no me dejes nunca"," Utalentowany reżyser zostaje porzucony przez żonę. Aby pokonać rozpacz, rozpoczyna pracę nad filmowym musicalem. Odwiedza lokale, gdzie tańczy się tango. Poznaje... ",drama
rocky v,Rocky traci majątek i ze względów zdrowotnych rezygnuje z boksu. Postanawia zostać trenerem dobrze zapowiadającego się Tommy'ego Gunna. ,drama
gosford park,Beztroską zabawę na przyjęciu w Gosford Park zakłóca nagła śmierć gospodarza. Któryś z gości go zamordował - każdy jest podejrzany. ,drama
its kind of a funny story,"Cierpiący na depresję nastolatek trafia na oddział psychiatryczny, gdzie otrzymuje szansę na nowy początek.",drama
stomp the yard,"Młody i&nbsp;utalentowany tancerz uliczny DJ wplątuje się w&nbsp;strzelaninę i&nbsp;trafia do&nbsp;aresztu. By uniknąć poprawczaka, zgadza się zapisać do&nbsp;college'u dla czarnoskórych.",drama
freier fall,"Kiedy w szkole policyjnej, do której chodzi Marc, pojawia się nowy kadet, ten przekonuje się, co to znaczy uczucie do drugiego mężczyzny. ",drama
empire records," Film przedstawia dzień z życia sklepu muzycznego ""Empire Records"". Jego pracownicy to siódemka ekscentrycznych, młodych ludzi - prawdziwych pasjonatów muzyki. Każde z... ",drama
wesele,"Historia miłości tak mocnej, że przekracza granice, nie mieści się w ramach i jest silniejsza od wszelkich barier. Szczere spojrzenie na współczesny świat, a także dramatyczna podróż w przeszłość, która nikomu nie pozostanie obojętna.",drama
uroki garmonii,Po upokarzającym incydencie młody chłopiec dostaje obsesji na punkcie perfekcji i czystości. Przeciwstawia się panującemu wokół brakowi ładu.,drama
one week,Śmiertelnie chory mężczyzna wyrusza w samotną podróż na zachodnie wybrzeże Kanady.,drama
the babysitters,"Studentka Shirley dorabia jako niania. Gdy idzie do łóżka z ojcem swojego podopiecznego, postanawia zostać dziewczyną na telefon.",drama
deception,"Adwokat wprowadza do sex klubu swojego przyjaciela, który staje się głównym podejrzanym w sprawie zniknięcia pewnej kobiety oraz kradzieży wielu milionów dolarów.",drama
genova,"Joe chciałby rozpocząć nowe życie, dlatego wraz z dwiema córkami wyjeżdża do Genui. Podczas gdy starsza z sióstr jest pod urokiem Włochów, młodsza próbuje odnaleźć się w zupełnie nowym świecie.",drama
tulipany,"Gdy jeden z nich trafi do szpitala, trzech 60-letnich przyjaciół będzie musiało naprawić błędy przeszłości i pogodzić się z przemijaniem.",drama
coach carter,"Nowy trener koszykarskiej drużyny z Richmond zaczyna stosować kontrowersyjne metody, by przywrócić dyscyplinę w zespole. Niektórym zawodnikom wyraźnie się to nie podoba. ",drama
"deux jours, une nuit","Sandra ma jeden weekend, by przekonać kolegów do zrezygnowania z premii i tym samym zachować swoją posadę. ",drama
brokeback mountain,"Historia dwóch mężczyzn, którzy z sentymentem wracają do malowniczego Brokeback, gdzie przed laty połączyła ich wielka miłość. ",drama
"greystoke: the legend of tarzan, lord of the apes",Para angielskich podróżników umiera w środku afrykańskiej dżungli. Ich nowo narodzone dziecko biorą pod opiekę małpy.,drama
zjednoczone stany milosci,Rok po upadku PRL-u. Cztery pozornie szczęśliwe kobiety próbują odmienić swoje życie.,drama
black beauty,"Młody koń wiedzie szczęśliwe życie z przyjaciółmi w wiejskiej rezydencji. Gdy jego właściciel musi wyjechać, sprzedaje zwierzęta, ale nie wszystkie trafiają do dobrych ludzi. ",drama
"jamon, jamon",Życiem młodego chłopaka rządzą dwie obsesje: seks i jedzenie.,drama
mona lisa smile,"Rok 1953. Nauczycielka historii sztuki stara się wyzwolić swoje uczennice, pokazując im, że życie nie kończy się na małżeństwie i dzieciach. ",drama
sansho dayu,Gubernator prefektury ujmuje się za gnębionymi wieśniakami i zostaje zesłany na odległą prowincję. Jego rodzina wyrusza w niebezpieczną drogę do krewnych. ,drama
stardust,"Mur oddziela małe angielskie miasteczko od magicznej krainy Stormhold. Tristan obiecuje swojej ukochanej, że zdobędzie dla niej gwiazdę, która spadła po drugiej stronie. ",fantasy
the forbidden kingdom,"Nastoletni Jason za pomocą tajemniczej laski przenosi się do baśniowej krainy w starożytnych Chinach, gdzie otrzymuje misję ratowania świata. ",fantasy
the brass teapot,"Para odkrywa, że niedawno znaleziony mosiężny czajnik ma magiczne moce - dostarcza pieniędzy za każdym razem, gdy któremuś z małżonków stanie się krzywda.",fantasy
promocion fantasma," Modesto (Raúl Arévalo) jest nauczycielem, który widzi duchy. Ta umiejętność sprawiła, że nie tylko wydał fortuny na psychologów, ale także tracił pracę w każdej kolejnej... ",fantasy
the mummy: tomb of the dragon emperor,Na Dalekim Wschodzie rodzina O'Connellów próbuje powstrzymać wskrzeszonego cesarza Hana i jego armię terakotowych wojowników przed zawładnięciem światem.,fantasy
pirates of the caribbean: at worlds end,"Will Turner i Elizabeth Swan wyruszają w podróż na kraniec świata, by uratować kapitana Jacka Sparrowa z pułapki Davy'ego Jonesa.",fantasy
dragonball evolution,"Osiemnastoletni Goku wyrusza w podróż, by wraz z kompanami zebrać smocze kule i uratować świat przed złym Piccolo oraz demonem Oozaru.",fantasy
1612,Trwa wojna polsko-rosyjska. Po śmierci prawowitego cara hetman Kibowski pragnie objąć władzę na Kremlu poprzez małżeństwo z Ksenią Godunową.,fantasy
gullivers travels,"Początkujący autor przewodników turystycznych, w czasie pierwszej podróży służbowej, trafia do krainy Liliputów.",fantasy
jungle cruise,Charyzmatyczny kapitan łodzi i odważna badaczka dzikiej przyrody wyruszają na wyprawę przez amazońską dżunglę by odnaleźć drzewo życia.,fantasy
inland empire,"Aktorka przejmuję osobowość swojej postaci w filmie. Z czasem świat, w którym żyje, staję się przerażający i surrealistyczny.",fantasy
abraham lincoln: vampire hunter,"Prezydent USA Abraham Lincoln dowiaduje się, że wampiry planują przejąć władzę w kraju. Wypowiada więc im wojnę.",fantasy
fantomas se dechaine,"Fantomas dokonuje zuchwałych&nbsp;porwań znanych francuskich naukowców. Próbują mu w tym przeszkodzić komisarz Juve, dziennikarz Fandor i jego narzeczona, Hélène.",fantasy
les visiteurs: la revolution, Z powodu pomyłki rycerz Godfryd de Montmirail i jego giermek Jacquouille przenoszą się w czasy rewolucji francuskiej.,fantasy
the twilight saga: breaking dawn - part 2,"Edward i Bella postanawiają bronić swojej córki Renesmee przed rodziną Volturi i oskarżeniami, iż pół-wampir pół-człowiek może być śmiertelnie niebezpieczny dla obu ras. ",fantasy
always,"Pete ginie w katastrofie samolotu. Wkrótce powraca jako duch, by pomóc ukochanej, Dorindzie, rozpocząć nowe życie. ",fantasy
oz: the great and powerful,"Iluzjonista Oscar trafia do magicznej krainy Oz, gdzie ma za zadanie przywrócić pokój. ",fantasy
hellboy ii: the golden army,Hellboy musi stawić czoła zbudzonej przez okrutnego księcia armii niepokonanych bestii. Pomogą mu w tym przyjaciele o paranormalnych zdolnościach.&nbsp;,fantasy
thor: love and thunder,nr 1 (polskie napisy),fantasy
the prophecy,"Legion aniołów zstępuje z niebios, aby zdobyć duszę najbardziej niegodziwego człowieka na ziemi.",fantasy
koma,"Młody architekt ulega wypadkowi, gdy odzyskuje przytomność, świat jest jakiś inny. Musi więc poznać rządzące nim reguły i znaleźć drogę do swojej rzeczywistości. ",fantasy
fallen,"Po traumatycznych przeżyciach Lucinda trafia do szkoły z internatem, gdzie poznaje dwóch nietypowych mężczyzn.",fantasy
the spirit," Pewnej księżycowej nocy w Central City, policjant Denny Colt (Gabriel Macht), rusza na kolejną misję. Trop wiedzie go na błotniste nabrzeże, wprost do starego zatopionego... ",fantasy
bakemono no ko,"Samotny chłopiec Ren, przemierzając tokijskie ulice, trafia do świata potworów. Wkrótce poznaje mistrza miecza o imieniu Kumatetsu - bestię, który postanawia szkolić chłopca.",fantasy
mononoke-hime,"Książę małej wioski zostaje przeklęty przez demona. Wyrusza w podróż, by poprosić legendarnego boga zwierząt o zdjęcie uroku. ",fantasy
batman forever,Batman i Robin muszą zmierzyć się z Dwiema Twarzami i Człowiekiem-Zagadką. Pomaga im piękna pani psycholog. ,fantasy
the brothers grimm,"Początek XIX wieku. Kiedy bracia Grimm zostają zdemaskowani jako oszuści podający się za pogromców upiorów, zostają zmuszeni do rozwiązania zagadki znikających w zaczarowanym lesie dziewczynek.",fantasy
shazam!,"Chłopiec otrzymuje moce, dzięki którym&nbsp;staje się dorosłym superbohaterem,&nbsp;wypowiadając jedno magiczne słowo.",fantasy
the warriors way,"Mistrz miecza, chcąc ukryć się przed swoim klanem, wyjeżdża do USA.",fantasy
in the name of the king: a dungeon siege tale,"Gdy syn Farmera ginie z rozkazu złego maga Galliana, mężczyzna wyrusza na wojnę, by stawić czoło wojskom żądnego władzy tyrana. ",fantasy
dracula untold,W obliczu zagrożenia królestwa i rodziny Wład Tepeš zawiera umowę z siłami ciemności.,fantasy
the scorpion king,"Pustynny wojownik walczy przeciwko armii okrutnego Memnona, która niszczy jego ojczyznę. Aby osłabić wroga, Mathayus porywa służącą mu czarodziejkę Kasandrę.",fantasy
the last witch hunter,Współczesny Nowy Jork. Ostatni łowca czarownic staje do walki przeciwko wiedźmom. ,fantasy
clash of the titans,"Perseusz wyrusza na niebezpieczną wyprawę, by ocalić księżniczkę&nbsp;Andromedę. W wykonaniu misji pomagają mu niezwykłe stworzenia.",fantasy
the green knight,"Sir Gawain, lekkomyślny i&nbsp;uparty siostrzeniec króla Artura, podejmuje misję zmierzenia się z Zielonym Rycerzem.",fantasy
sen to chihiro no kamikakushi,"Mała Chihiro wyrusza w pełną niebezpieczeństw podróż, aby ocalić swoich rodziców.",fantasy
doctor strange,"Potężny czarodziej doktor Strange walczy z siłami ciemności, aby ocalić świat.",fantasy
thor: the dark world,"Bóg Thor powraca, by ratować Ziemię, której zagraża starożytna rasa dowodzona przez żądnego zemsty niszczyciela.",fantasy
the company of wolves,"Babcia opowiada swojej wnuczce, Rosaleen, kilka przerażających historii.",fantasy
switch,Zamordowany przez byłe kochanki mężczyzna powraca do życia w ciele kobiety.,fantasy
scott pilgrim vs. the world,"Aby móc spotykać się z wymarzoną dziewczyną, Scott musi pokonać jej siedmiu byłych chłopaków. ",fantasy
solomon kane,"Legendarny zabijaka musi stawić czoła demonom z piekła rodem, aby odkupić swoją przeklętą duszę.",fantasy
shingeki no kyojin: attack on titan,"Postapokaliptyczny świat. Miasta otoczone ogromnymi murami chronią mieszkańców przed Tytanami, potworami żywiącymi się ludźmi. ",fantasy
"i, frankenstein","Adam Frankenstein nosi w sobie tajemnicę, którą posiąść chcą zastępy istot ze świata ciemności. Rozpoczyna się polowanie. ",fantasy
si jetais toi,"W wypadku samochodowym ginie Hannah, której dusza zostaje uwięziona w ciele jej córki.",fantasy
bishojo senshi sailor moon r: the movie,"Fiore, dawny przyjaciel Mamoru powraca na Ziemię wraz z tajemniczym kwiatem pasożytem, który może zniszczyć całą planetę.",fantasy
ella enchanted,"Ella otrzymuje nietypowy urodzinowy prezent - obowiązek posłuszeństwa wobec innych. Kilka lat później dziewczyna wyrusza w podróż, by znaleźć sposób na zdjęcie uroku.",fantasy
the hobbit: an unexpected journey,"Hobbit Bilbo Baggins, przy udziale czarodzieja Gandalfa, dołącza do kompanii krasnoludów pod dowództwem Thorina Dębowej Tarczy. Celem ich wyprawy jest wydarcie Samotnej Góry i jej bogactw spod władzy smoka Smauga. ",fantasy
on - drakon,Podczas swojego wesela księżniczka Mirosława zostaje porwana przez smoka.,fantasy
charlie st. cloud,"Charlie St. Cloud to obiecujący młody żeglarz, który w wyniku tragicznego wypadku traci brata. Nie mogąc się z tym pogodzić, porzuca swoje dawne życie i podejmuje pracę na cmentarzu.",fantasy
just like heaven,"Elizabeth jest zapracowaną lekarką. Po wypadku budzi się w domu i stwierdza, że zamieszkał tam David. ",fantasy
the time travelers wife,Henry cierpi na nietypową chorobę genetyczną powodującą nieoczekiwane podróże w czasie. Podczas jednego z takich epizodów mężczyzna poznaje miłość swojego życia.,fantasy
dark shadows,"Ukarany przez mściwą wiedźmę Barnabas wstaje z grobu po dwustu latach i trafia w szalone lata 70., których zupełnie nie rozumie.",fantasy
hotarubi no mori e,"Hotaru spotyka w lesie Gina, chłopca ducha, który - jeśli zostanie dotknięty przez człowieka - zniknie.",fantasy
the legend of hercules,Oszukany przez ojczyma Herkules zostaje sprzedany w niewolę z powodu zakazanej miłości. ,fantasy
the imaginarium of doctor parnassus,Doktor Parnassus wystawiający w różnych częściach Londynu przedstawienie umożliwiające wnikanie do świata wyobraźni zostaje wezwany przez Diabła do spłaty długu.,fantasy
gods of egypt,"Mściwy Set przejmuje tron, pogrążając Egipt w chaosie. Śmiertelnik Bek sprzymierza się z bogiem Horusem, by uratować ukochaną przed śmiercią oraz przywrócić krajowi pokój. ",fantasy
your highness,"Dwóch królewiczów wyrusza na wyprawę, by uwolnić księżniczkę z rąk złego czarownika. W drodze spotykają piękną wojowniczkę, której przyświeca ten sam cel.",fantasy
vidocq,Znany paryski detektyw ginie podczas prowadzenia śledztwa. Jego młody biograf postanawia doprowadzić sprawę do końca.,fantasy
bruce almighty,"Reporter, który narzekał nadmiernie na Boga, otrzymuje jego moc i przekona się, że nie łatwo jest rządzić światem.",fantasy
les couloirs du temps: les visiteurs 2,"Rycerz Godfryd de Montmirail przenosi się w przyszłość, by odzyskać rodowe klejnoty.",fantasy
saphirblau,"Gwendolyna Shepherd i Gideon de Villiers wspólnie wypełniają misję dla zakonu, do którego przynależą ich rodziny, lecz Gwen zaczyna mieć wątpliwości, komu powinna zaufać.",fantasy
pinocchio,"Stolarz Gepetto, pewnego dnia, z kawałka drewna tworzy postać chłopca. Figurka ożywa, zaczyna ruszać się i mówić. ",fantasy
jonah hex,"Jonah Hex musi odnaleźć i powstrzymać Quentina Turnbulla, który chce wyzwolić konfederackie południe.",fantasy
