title,description,genre
limitless,"Cierpiący na brak weny pisarz, Eddie, zaczyna stosować narkotyk, który zwiększa jego potencjał intelektualny. Dzięki używce mężczyzna odnosi sukcesy. ",thriller
payback,Zdradzony przez wspólnika złodziej planuje srogą zemstę oraz odzyskanie utraconych pieniędzy z napadu. ,thriller
the numbers station,"Po nieudanym zleceniu agent CIA zostaje przeniesiony do ochrony stacji szyfrującej, która zostaje zaatakowana przez terrorystów. ",thriller
poniedzialek,Maniek podejmuje się ściągnięcia długów dla właściciela bankrutującej cukrowni. W sukurs przychodzą mu przyjaciele - Dawid i Romek. ,thriller
na granicy,"W odciętej od cywilizacji bieszczadzkiej chacie dwaj bracia i ojciec spotykają tajemniczego nieznajomego, który sprowadza na nich niebezpieczeństwo. ",thriller
batoru rowaiaru,"Uczniowie losowo wybranej klasy zostają umieszczeni na bezludnej wyspie, gdzie walczą o przeżycie, zabijając się nawzajem.",thriller
the circle,"Młoda kobieta otrzymuje pracę w potężnej firmie informatycznej Krąg, gdzie poznaje tajemniczego mężczyznę.",thriller
wild things,Oskarżony o gwałt uczennicy Sam nie przyznaje się do winy. W czasie śledztwa na jaw wychodzą nowe fakty.,thriller
triangle,"Sztorm wywraca jacht z grupą przyjaciół na pokładzie. Przepływający statek pasażerski, który jest dla nich jedyną szansą schronienia, okazuje się opustoszały.",thriller
the bourne identity,"Jason Bourne w wyniku wypadku traci pamięć. Wszystko wskazuje na to, że był członkiem tajnego programu CIA.",thriller
inside man,"Doświadczony przestępca Dalton napada na bank. Jego doskonale opracowany plan komplikuje się, gdy do akcji wkracza policyjny negocjator i Madeleine White działająca na zlecenie wpływowych osób.",thriller
hardware,"Moses znajduje szczątki robota, które ofiarowuje swojej dziewczynie. Oboje nie wiedzą, że jest to prototyp maszyny wojennej.",thriller
tequila sunrise,"Funkcjonariusz policji bierze pod lupę starego znajomego, który w przeszłości handlował narkotykami. ",thriller
the 39 steps,"W jednym z londyńskich teatrów Richard poznaje tajemniczą dziewczynę. Gdy tej samej nocy zostaje ona zamordowana, mężczyzna postanawia rozwikłać zagadkę zbrodni. ",thriller
perfect stranger,"Reporterka śledcza przenika do struktur świata reklamy, zatrudniając się jako sekretarka Harrisona Hilla - prezesa jednej z największych firm. Chce tym samym odnaleźć mordercę swojej przyjaciółki. ",thriller
enemy of the state,Młody prawnik wchodzi w posiadanie dowodu zbrodni dokonanej przez rządowych agentów i staje się celem szpiegowskich ataków.,thriller
elle,Michèle jest bezwzględną szefową firmy zajmującej się grami wideo. Pewnego dnia we własnym domu zostaje zaatakowana przez nieznanego napastnika.,thriller
the living daylights,"Agent 007 jedzie do Bratysławy celem ochrony radzieckiego generała Koskowa. Gdy przekonuje się o jego prawdziwych planach, podejmuje z nim niebezpieczną grę.",thriller
bad samaritan,Podczas włamania do domu milionera złodziej odnajduje kobietę przetrzymywaną wbrew jej woli. ,thriller
clue,"Sześć osób otrzymuje zaproszenie na uroczystą kolację. Gdy nieoczekiwanie pan domu zostaje zamordowany, goście łączą siły, by rozwiązać zagadkę. ",thriller
jennifer eight,"Policjant z Los Angeles przenosi się do małego miasteczka, gdzie trafia na sprawę seryjnego mordercy, który atakuje niewidome kobiety.",thriller
chain reaction,"Grupa naukowców dokonuje odkrycia w dziedzinie alternatywnych źródeł energii. Tego samego dnia większość zespołu zostaje zamordowana, a dwoje pozostałych badaczy oskarżonych o zabójstwo i zdradę.",thriller
obitaemyy ostrov,"Maksym ląduje awaryjnie na nieznanej planecie, którą rządzą autorytarni władcy. Zaskoczony panującą niesprawiedliwością staje w obronie dyskryminowanych mieszkańców. ",adventure
skammerens datter,"Dziewczynka umiejąca rozpoznawać zamiary innych ludzi zostaje uwięziona przez żądnego władzy Drakana. By uciec z zamku, musi przejść przez legowisko smoków. ",adventure
logans run,Strażnik Logan 5 otrzymuje polecenie odnalezienia i zniszczenia tajemniczego sanktuarium. ,adventure
the time machine,"Na podstawie powieści H.G. Wellsa. Dziewiętnastowieczny naukowiec buduje maszynę czasu i przenosi się 800 tys. lat w przyszłość, gdzie odkrywa, że ludzkość została podzielona na dwie wrogie sobie rasy.",adventure
the time machine,"Rok 1900, angielski wynalazca buduje wehikuł czasu i podróżuje do dalekiej przyszłości, gdzie odkrywa, że ludzkość podzieliła się na dwa wrogie gatunki.",adventure
after earth,Tysiąc lat po globalnej katastrofie statek generała Raige'a i jego syna rozbija się na Ziemi. Chłopiec będzie musiał samotnie stawić czoła dzikiej planecie. ,adventure
white squall,"Kapitan ćwiczebnego żaglowca ""Albatros"" zabiera trzynastu kadetów ze szkoły morskiej w kilkumiesięczny rejs szkoleniowy. Podczas podróży łódź dopada potężny sztorm. ",adventure
uncharted,Nathan Drake wraz ze swoim przyjacielem Victorem Sullivanem i dziennikarką Eleną Fisher wyrusza na poszukiwania El Dorado.,adventure
podroz za jeden usmiech,Dwaj kuzyni udają się w wakacyjną podróż autostopem. ,adventure
mutiny on the bounty,Oburzona surową dyscypliną załoga okrętu Bounty postanawia się zbuntować.,adventure
robin hood: prince of thieves,"Po powrocie do Anglii Robin odkrywa, że stracił rodzinny majątek. Przyłącza się do bandy rzezimieszków z lasu&nbsp; Sherwood, wypowiadając wojnę bezwzględnemu szeryfowi Nottingham. ",adventure
jurassic world: dominion,nr 2,adventure
the lone ranger,Zamaskowany mściciel wytacza wojnę przestępcom na Dzikim Zachodzie. Towarzyszą mu odważny Indianin i jednonoga kobieta.,adventure
mowgli: legend of the jungle,Osierocony chłopiec wychowuje się w dziczy.,adventure
hundraaringen som klev ut genom fonstret och forsvann,"Historia Allana Karlssona, który ucieka z domu opieki w setne urodziny, wierząc, że nigdy nie jest za późno, by zacząć wszystko od nowa. ",adventure
tomb raider,"Lara Croft wyrusza w swoją pierwszą ekspedycję, aby odnaleźć zaginionego ojca na niezbadanej wyspie u wybrzeży Japonii.",adventure
escape from the planet of the apes," Cornelius, szympans-naukowiec, i jego ukochana budują statek kosmiczny z odnalezionych na Planecie Małp szczątków. Ich podróż kończy się we współczesnym Los Angeles, gdzie trafiają do ogrodu zoologicznego. ",adventure
star trek: the motion picture,W kierunku Ziemi zmierza tajemniczy obiekt. Powstrzymać go próbuje załoga statku Enterprise pod dowództwem kapitana Kirka. ,adventure
sky captain and the world of tomorrow," Polly Perkins - dziennikarka ""Chronicle"" i Sky Kapitan - as lotnictwa Stanów Zjednoczonych nie widzieli się od trzech lat. Teraz przewrotny los za pomocą tajemniczego... ",adventure
star wars: the last jedi,"Rey odnajduje Luke'a Skywalkera, by namówić go na powrót i walkę z Najwyższym Porządkiem. Tymczasem Rebelianci próbują uciec przed flotą wroga. ",adventure
race to witch mountain,Taksówkarz z Las Vegas pomaga dwójce pasażerów obdarzonych paranormalnymi zdolnościami w odkryciu sekretu tajemniczej góry. ,adventure
indiana jones and the temple of doom,Nieustraszony łowca przygód wyrusza na poszukiwanie świętego kamienia i mierzy się z członkami niebezpiecznej sekty. ,adventure
star wars: episode ii - attack of the clones,Demokratyczne rządy Republiki są zagrożone przez podstępnego hrabiego Dooku. Tymczasem Anakin Skywalker łamie reguły zakonu Jedi i zakochuje się.,adventure
national treasure,Ben Gates trafia na trop największego skarbu w dziejach ludzkości. ,adventure
solo: a star wars story,Han Solo podróżuje przez galaktykę. Podczas śmiałych eskapad w głąb przestępczego półświatka poznaje Chewbaccę i Lando Calrissiana.,adventure
dragonball: saikyo e no michi," Goku żyje sobie spokojnie w chatce swojego dziadka, do czasu, gdy poznaje Bulmę - dziewczynę, która, pragnąc zdobyć jego smoczą kule, postanawia zabrać go ze sobą na... ",adventure
the three musketeers,"Do siedemnastowiecznego Paryża przybywa szlachcic D'Artagnan, którego marzeniem jest zostać królewskim muszkieterem. Wkrótce poznaje trzech: Atosa, Portosa i Aramisa.",adventure
robin hood,"Robin z Loxley wraca z wyprawy krzyżowej i zastaje majątek splądrowany, a ukochaną Marion zamężną. Żądny zemsty postanawia stanąć w obronie uciśnionych mieszkańców Nottingham.",adventure
nicholas nickleby,"Nicholas Nickleby po śmierci ojca musi zapewnić byt matce i siostrze. Zwraca się o pomoc do stryja Ralfa, który choć załatwia mu posadę nauczyciela, nie ma względem bratanka dobrych zamiarów.",adventure
the ghost and the darkness,"Afryka pod koniec XIX wieku, dwa lwy terroryzują budowniczych mostu. Inżynier John Patterson i myśliwy Charles Remington próbują zapobiec atakom. ",adventure
star trek iii: the search for spock,Kapitan Kirk decyduje się uprowadzić okręt i odszukać ciało przyjaciela. ,adventure
alpha,"Ranny myśliwy, pozostawiony na śmierć przez towarzyszy, próbuje przeżyć w puszczy i powrócić do domu.",adventure
journey to the center of the earth,"Sean Anderson wraz z wujkiem wyrusza w podróż, aby odnaleźć zaginionego ojca. ",adventure
dragon ball z: chikyu marugoto cho kessen,"Goku i Wojownicy Z przeciwstawiają się Tullecowi oraz jego poplecznikom mającym zamiar zasadzić na Ziemi Drzewo Śmierci, które pustoszy planety. ",adventure
star wars: episode v - the empire strikes back,"Imperator rozkazuje swojemu uczniowi Darthowi Vaderowi odnalezienie Luke'a Skywalkera, by zmusić go do przejścia na ciemną stronę Mocy.",adventure
aliens in the attic,"Grupka nastolatków odkrywa, że strych ich letniskowego domku oblegany jest przez przybyszy z kosmosu. Chcąc ukryć to przed rodzicami - jednoczą siły, by pokonać obcych.",adventure
hercules,"Herkules, grecki półbóg, razem z towarzyszami zostaje wynajęty przez króla Tracji, aby szkolił jego armię. ",adventure
stargate,"U podnóża piramidy w Gizie ekipa archeologów znajduje tajemniczy metalowy pierścień. Egiptolog Daniel Jackson odkrywa, że jest on bramą do innego miejsca we wszechświecie. ",adventure
last knights,"Upadły wojownik staje do walki przeciwko skorumpowanemu oraz sadystycznemu władcy, by pomścić i przywrócić dobre imię swojego pana.",adventure
the jewel of the nile,"Joan i&nbsp;Jack przeżywają kryzys w związku. Podczas gdy pisarka przyjmuje zaproszenie od szejka, jej partner spotyka dawnego znajomego, Ralpha.",adventure
john carter,"Weteran wojny secesyjnej zostaje przeniesiony na Marsa. Chce wrócić do domu, jednak staje się uczestnikiem konfliktu między dwiema zamieszkującymi planetę rasami.",adventure
wong fei hung,"Mistrz Wong Fei-Hung zyskuje licznych wrogów z powodu prowadzenia mediacji między Europejczykami i Chińczykami, a także miłości do Yee, która wychowywała się według zachodnich standardów. ",adventure
sonic the hedgehog,"Tom Wachowski, oficer policji w San Francisco oraz Sonic - antropomorficzny pozaziemski jeż, łączą siły, by pokonać Doktora Robotnika.",adventure
vertical limit,"Gdy grupa alpinistów grzęźnie w lodowej szczelinie, brat jednej z uczestniczek organizuje akcję ratunkową.",adventure
beneath the planet of the apes," Brent wyrusza w podróż, by odnaleźć komandora Taylora, który ukrywa się z buntownikami na Planecie Małp. ",adventure
lara croft tomb raider: the cradle of life,"Nieustraszona podróżniczka wyrusza na wyprawę, by odnaleźć starożytny artefakt. Od tej misji zależą losy ludzkości.",adventure
the quest,Uliczny złodziejaszek staje przed niepowtarzalną szansą zdobycia cennej nagrody w międzynarodowym turnieju walk.,adventure
indiana jones and the kingdom of the crystal skull,Słynny archeolog i miłośnik przygód Indiana Jones oraz&nbsp;Mutt Williams poszukują legendarnego artefaktu.,adventure
the blood of heroes,Po wojnie atomowej rozrywkę stanowi brutalny sport przypominający amerykański futbol. Drużyna Juggerów stawia wyzwanie mistrzowi ligi.,adventure
11 settembre 1683,12 września 1683 roku dochodzi do decydującej bitwy między armią Imperium Osmańskiego pod wodzą Wielkiego Wezyra a obrońcami Wiednia. Na pomoc Austriakom przybywa polskie wojsko z Janem III Sobieskim na czele.,adventure
lost in space,"Rodzina Robinsonów wyrusza w przestrzeń kosmiczną, by rozpocząć kolonizację nowej planety. Na skutek sabotażu misji trafiają do odległych, nieznanych rejonów wszechświata. ",adventure
jumper,"Młody chłopak odkrywa, że posiada nadnaturalne zdolności - może siłą woli przenosić się w dowolne miejsce na świecie.",adventure
serenity,"Kapitan Malcolm Reynolds zarabia wynajmując swój statek transportowy ""Serenity"". Przyjęcie na pokład młodego lekarza z siostrą okazuje się być kluczem do wielkiej tajemnicy. ",adventure
the bounty,"Kapitan Bligh relacjonuje przed sądem okoliczności utraty okrętu, którym dowodził. Statek został przejęty przez zbuntowanych marynarzy, nieskorych do wypełniania jego despotycznych rozkazów.",adventure
star wars: episode i - the phantom menace,"Dwaj rycerze Jedi wyruszają z misją ocalenia planety Naboo przed inwazją wojsk Federacji Handlowej. Trafiają na pustynny glob, gdzie pomoże im mały Anakin Skywalker.",adventure
star wars: the rise of skywalker,"Członkowie Ruchu Oporu stawiają czoła nowej organizacji militarnej zwanej Ostatecznym Porządkiem, dowodzonej przez odrodzonego Imperatora Palpatine'a. ",adventure
le salaire de la peur,Grupa śmiałków wyrusza w podróż po bezdrożach Ameryki Południowej ze śmiertelnie niebezpiecznym ładunkiem nitrogliceryny. ,adventure
dragon ball z: tobikkiri no saikyo tai saikyo,"Na Ziemię przybywa Cooler, który pragnie pomścić swojego brata, Freezera.",adventure
congo,"Członkowie ekspedycji naukowej giną bez śladu w Kongo. Grupa ludzi wyrusza na ratunek nie wiedząc, z czym przyjdzie im się zmierzyć. ",adventure
the mask of zorro,"Gubernator w Meksyku, Montero, morduje żonę Zorro, porywa córkę, a jego samego wtrąca do więzienia. Po latach Don Diego szuka następcy, który zemści się na wrogu.",adventure
raiders of the lost ark,"Rok 1936. Na zlecenie służb specjalnych amerykański archeolog, Indiana Jones, wyrusza do Egiptu, by odnaleźć legendarną Arkę Przymierza. ",adventure
star trek: insurrection,"Kapitan Picard wraz z dzielną załogą postanawia stanąć w obronie garstki mieszkańców planety Ba'ku, co oznacza wystąpienie przeciwko Federacji Planet. ",adventure
waterworld,"Wizja przyszłości, w której po stopnieniu lodowców Ziemia zamieniła się w wielki ocean. Troje bohaterów wyrusza na poszukiwanie legendarnego stałego lądu.",adventure
star trek: the wrath of khan,Dzielna załoga Enterprise musi stawić czoło szukającemu zemsty tyranowi - Khanowi. ,adventure
timeline,"Przy pomocy prototypowej maszyny grupa studentów wyrusza w przeszłość do średniowiecznej Francji, by uratować swojego zaginionego profesora. Trafiają na niebezpieczny okres wojny feudalnej. ",adventure
cliffhanger,Profesjonalni alpiniści i ratownicy górscy trafiają na grupę terrorystów w wysokich górach Skalistych.,adventure
passengers,"Jeden z pasażerów międzygwiezdnego liniowca zostaje wybudzony kilkadziesiąt lat przed terminem. Świadomy swojego położenia, decyduje się na krok, który będzie miał nieodwracalne konsekwencje.",adventure
around the world in eighty days,"Anglik zakłada się, że wraz ze swoim kamerdynerem okrąży Ziemię w osiemdziesiąt dni.",adventure
mutant chronicles," Jest rok 2707. Zasoby naturalne ziemi wyczerpują się, a świat pogrążony jest w wojnie pomiędzy czterema Korporacjami: Kapitolem, Bahaus, Mishimą i Imperialem. Mitch... ",adventure
star wars,"Obi-Wan opowiada młodemu Luke'owi, że jego ojcem był potężny rycerz Jedi, który walczył w wojnach klonów.",adventure
flash gordon,Okrutny Imperator Ming postanawia zniszczyć Ziemię. Flash Gordon wraz z towarzyszami rusza na ratunek.,adventure
les fils du vent,"Yamakasi wyjeżdżają do Bangkoku, gdzie spotykają konkurencyjną grupę, z którą popadają w konflikt.",adventure
monte carlo,"Wakacje w Paryżu dla trzech przyjaciółek stają się przepustką na salony Monte Carlo, gdy jedna z nich zostaje omyłkowo uznana za brytyjską spadkobierczynię ogromnej fortuny.",adventure
jurassic park iii,"Paleontolog Alan Grant pomaga w poszukiwaniach nastolatka zagubionego na wyspie, którą opanowały dinozaury.",adventure
the call of the wild," Buck to pies o wielkim sercu, którego świat staje na głowie, gdy wprost z sielskiego domu w Kalifornii trafia na egzotyczne pustynie śnieżne Alaski podczas gorączki złota lat 90-tych XIX wieku.",adventure
lara croft: tomb raider,"Lara Croft szuka tajemniczego artefaktu, aby uchronić świat przed organizacją Illuminati, która chce wykorzystać moc przedmiotu.",adventure
planet of the apes,"Astronauta trafia na planetę, gdzie władzę sprawują inteligentne małpy. Wkrótce mężczyzna przyłącza się do buntowników walczących o wolność.",adventure
against the ice,"Duński kapitan Ejnar Mikkelsen w 1909 roku wyrusza na polarną ekspedycję, by udowodnić, że Grenlandia jest jedną wyspą, do której nie ma praw USA.&nbsp; &nbsp; &nbsp; &nbsp; &nbsp; &nbsp; &nbsp;",adventure
national treasure: book of secrets,"Ben Gates podąża za wskazówkami z dziennika Johna Wilkesa Bootha, by udowodnić, że jego przodek nie uczestniczył w zamordowaniu Abrahama Lincolna.",adventure
ready player one,"W 2045 roku ludzie znajdują ukojenie w wirtualnej rzeczywistości. Jej twórca przed śmiercią postanawia cały majątek przekazać pierwszej osobie, która znajdzie ukryty w niej cyfrowy ""easter egg"". ",adventure
cerro torre: schrei aus stein," Najczęściej areną górskich filmów są najwyższe góry świata Himalaje. Herzog w swoim filmie pokazał równie piękny i nieprzystępny zakątek Ziemi, jakim jest Patagonia w... ",adventure
tron,"Haker zostaje przeniesiony do wnętrza systemu komputerowego i zmuszony, by walczyć o życie. Jego jedyną nadzieją jest program Tron. ",adventure
fantastic four,"Na skutek promieniowania kosmicznego załoga promu nabywa supermoce, których używa w walce z wrogiem, Victorem von Doomem.",adventure
far and away,"Joseph i Shannon uciekają z Irlandii do Ameryki, by rozpocząć lepsze życie. ",adventure
the man who would be king,"Indie, XIX wiek. Dwóch brytyjskich żołnierzy dezerteruje i udaje się w podróż do Kafiristanu, afgańskiego regionu z mitycznym miastem Aleksandra Wielkiego.",adventure
max steel,"Zwyczajny szesnastolatek odkrywa, że jego ciało wytwarza bardzo silną energię. Wkrótce jako Max Steel dostaje zadanie uratowania Ziemi. ",adventure
the three musketeers,Kardynał Richelieu spiskuje przeciwko królowej Francji. Pokrzyżować jego plany mogą tylko trzej muszkieterowie i młody Gaskończyk D' Artagnan.,adventure
dune,"Młody książę przybywa na pustynną planetę Arrakis będącą jedynym źródłem cennego melanżu. Wkrótce ucieka w głąb pustyni, by uchronić się przed śmiercią z rąk zamachowców. ",adventure
star trek: generations,"Kapitan Picard, dowódca Enterprise, trafia na ślad spisku, przez który wiele lat wcześniej flota straciła okręt wraz z załogą. ",adventure
"10,000 bc",Grupa tajemniczych wojowników porywa ukochaną D'Leha. Młody myśliwy wyrusza na ratunek dziewczynie. ,adventure
hidalgo,"Legendarny jeździec, Frank T. Hopkins, bierze udział w wyścigu konnym nazywanym Oceanem Ognia. Dosiadając dzielnego mustanga Hidalgo, mężczyzna musi pokonać 3000 mil pustynnych piasków Arabii Saudyjskiej, Iraku i Syrii.",adventure
jurassic world: fallen kingdom,"Kiedy uśpiony wulkan budzi się do życia, Owen i Claire podejmują próbę ocalenia zagrożonych dinozaurów. ",adventure
black sea,"Nieposkromiony kapitan okrętu podwodnego udaje się w morze, aby odnaleźć zagubione złoto. Powodzenie misji jest jednak niepewne z powodu chciwości szemranej załogi. ",adventure
blue crush,"Anne Marie rozpoczyna przygotowania do wymagających zawodów surfingowych. Sprawy komplikują się, gdy spotyka przystojnego futbolistę. ",adventure
ostwind 3: aufbruch nach ora,"Mika razem z przyjaciółmi próbuje uratować ziemię, na której znajduje się tajemnicza oaza. W tym celu planuje wskrzesić dawną tradycję - wyścigi dzikich koni.",adventure
into the blue,"Grupa nurków, odkrywając zatopiony wrak samolotu, zdaje sobie sprawę, że ściągnęła na siebie jedynie kłopoty. ",adventure
dragon ball: makafushigi daiboken, Kuririn i Goku wybierają się z Genialnym Żółwiem do miasta Miifan na Turniej Sztuk Walki. W tym mieście imperatorem jest młodziutki Chaotzu. Jak się okazuje za jego... ,adventure
star trek v: the final frontier,"Okręt Enterprise zostaje uprowadzony, a porywacz zmusza załogę do obrania kursu na miejsce w galaktyce zwane ""ostateczną granicą"". ",adventure
doragon boru z 4: super saiyajin da son goku, Ziemia zostaje znowu zaatakowana. Tym razem najeżdza na nią Lord Slug i jego kosmiczni piraci. Lord Slug podbija kolejne planety i przemienia je w... olbrzymie statki... ,adventure
the legend of zorro,"Zorro staje do walki z tajną organizacją&nbsp;Rycerzy&nbsp;Aragonii, których celem jest zapobiegnięcie wejściu Kalifornii w skład Unii.&nbsp;",adventure
star wars: episode vii - the force awakens,"Imperium zostaje zastąpione przez Najwyższy Porządek, który dąży do zdobycia władzy nad galaktyką. Plany złowrogiej organizacji może pokrzyżować tylko Ruch Oporu.",adventure
heavy metal,"Będąca wcieleniem wszelkiego zła zielona kula - Loc-Nar - opowiada o swojej potędze dziewczynce, w której drzemie obrończyni świata. ",adventure
dragon ball z 13: ryuken bakuhatsu!! goku ga yaraneba dare ga yaru," Podczas lekcji w szkole Son Gohan i Videl dowiadują się, że mag o imieniu Hoi chce popełnić samobójstwo, gdyż nie może otworzyć szkatułki, w której zamknięty jest wielki... ",adventure
doragon boru z: kono yo de ichiban tsuyoi yatsu,"Son Goku walczy z wysłannikami doktora Wheelo, który chce przenieść swój mózg do ciała mężczyzny i zapanować nad światem. ",adventure
4: rise of the silver surfer,"Fantastyczna Czwórka musi pokonać Srebrnego Surfera, sługę potężnego Galactusa, który chce zniszczyć Ziemię.",adventure
the lost world: jurassic park,"Na wyspę zamieszkałą przez dinozaury ponownie zostaje wysłana grupa naukowców. Prócz niebezpiecznych gadów bohaterowie spotykają zawziętych najemników, którzy chcą wywieźć kilka okazów. ",adventure
the new world,"Oparta na prawdziwych wydarzeniach opowieść o miłości europejskiego odkrywcy Johna Smitha i indiańskiej księżniczki, rozgrywająca się w burzliwych pierwszych dniach Nowej Ameryki. ",adventure
love and monsters,"Młody człowiek uczy się, jak przetrwać apokalipsę potworów z pomocą doświadczonego łowcy.",adventure
the legend of tarzan,"Kapitan Rom podstępem zwabia&nbsp;Lorda Greystoke do Konga. Na Czarnym Lądzie angielski dżentelmen powraca w przeszłość, by stać się postacią, którą niegdyś był, a także uratować ukochaną&nbsp;oraz pokonać starego wroga.",adventure
master and commander: the far side of the world,Czasy wojen napoleońskich. Komandor brytyjskiej marynarki wojennej Jack Aubrey ściga francuski okręt korsarski płynący na Ocean Spokojny. ,adventure
indiana jones and the last crusade,"Poszukiwacz przygód rusza tropem bezcennej relikwii, która według legendy zapewnia nieśmiertelność. W wyprawie towarzyszy mu ojciec. ",adventure
the three musketeers,Młody D'Artagnan zaprzyjaźnia się z trójką legendarnych muszkieterów. Razem muszą zapobiec wojnie w Europie.,adventure
le voyage dans la lune,Grupa naukowców udaje się na Księżyc. Po wylądowaniu tamtejsi mieszkańcy biorą ich do niewoli.,adventure
fanfan la tulipe,"Młody awanturnik i kobieciarz, by uniknąć niechcianego ożenku, wstępuje do wojska.",adventure
star trek: nemesis,Załoga Enterprise udaje się do Romulan chcących negocjować traktat pokojowy. ,adventure
chaos walking,"Dystopijny świat, w którym nie ma kobiet, a wszystkie żywe stworzenia mogą słyszeć swoje myśli w strumieniu obrazów, słów i dźwięków zwanym ""Hałasem"".",adventure
ironclad,Mała grupa templariuszy broni zamku Rochester przed armią króla Jana. ,adventure
mutiny on the bounty,Na łajbie dowodzonej przez autorytarnego kapitana dochodzi do buntu. Niezadowoleni członkowie załogi decydują o zmianie kursu statku.,adventure
dragon ball z: gekitotsu!! hyaku oku power no senshi-tachi,Dande wraz z siłami specjalnymi walczy o Nowe Namek.,adventure
love wrecked,Jenny jest zakochana po uszy w gwieździe rocka Jasonie. Podczas wycieczki jachtem oboje trafiają na bezludną wyspę. ,adventure
star wars: episode iii - revenge of the sith,Dwóch rycerzy Jedi - Obi-Wan Kenobi i Anakin Skywalker - wyrusza na pomoc porwanemu kanclerzowi Palpatine'owi.,adventure
battlefield earth: a saga of the year 3000,Ziemia znajduje się we władaniu kosmitów. Grupa ludzi zamierza wzniecić rebelię przeciw najeźdźcom. ,adventure
everest,Rok 1996. Podczas wspinaczki na najwyższy szczyt świata członkowie ekspedycji stawiają czoło potężnej burzy śnieżnej. ,adventure
planet of the apes,"Grupa astronautów trafia na nieznaną planetę, która przypomina Ziemię. Okazuje się, że jest ona zamieszkiwana przez inteligentne małpy.",adventure
star trek vi: the undiscovered country,Kapitan Kirk zostaje obarczony winą za atak na poselstwo Klingonów. Z pomocą przyjaciół musi oczyścić swoje imię i odnaleźć prawdziwego zdrajcę. ,adventure
