title,description,genre
den skyldige,"Dyspozytor linii 112 odbiera telefon od porwanej kobiety. Połączenie zostaje przerwane i zaczyna się walka z czasem, by odnaleźć dzwoniącą oraz jej porywacza.",thriller
a quiet place,"Pięcioosobowa rodzina stara się przetrwać w świecie pełnym potworów, które stanowią śmiertelne niebezpieczeństwo, a zwabia je najmniejszy hałas.",horror
tightrope,Prowadzący śledztwo policjant wdaje się w niebezpieczną grę psychologiczną z przestępcą. ,crime
proceder,"Historia Tomasza Chady - rapera, który ginie niespodziewanie w 2018 roku. Śmierć muzyka szokuje wszystkich wokół. ",biography
ammonite,"Zbieraczka skamielin Mary i kobieta wysłana na rekonwalescencję nad morze rozwijają namiętną znajomość, która zmieni ich życie na zawsze. ",drama
amok,"Architekt Roszewski zostaje zamordowany. Kilka lat później inspektor Jacek Sokolski odnajduje dowody, które wiążą się z motywem opisanym w powieści kryminalnej pod tytułem ""Amok"". ",crime
triumph des willens,"Propagandowy dokument opowiadający o&nbsp;szóstym zjeździe NSDAP w Norymberdze, który odbył się jesienią 1934 roku.",documentary
belle et sebastien,"Alpejska wioska, rok 1943. Kiedy bezpański pies zabija owce, lokalny chłopiec postanawia ochronić zwierzaka przed zemstą mieszkańców. ",family
fire down below,"Agent ochrony środowiska bada sprawę śmierci przyjaciela, powiązanej z firmą nielegalnie składującą toksyczne odpady.",thriller
naboer,John nawiązuje nietypową relację z dwiema atrakcyjnymi sąsiadkami. ,thriller
awantura o basie,"Piętnastolatka dowiaduje się, że państwo Olszowscy nie są jej prawdziwymi rodzicami. Postanawia poznać swoją przeszłość. ",family
12 rounds,"Przestępca zamierza wyrównać rachunki z policjantem, którego wini za śmierć bliskiej osoby. Wplątuje funkcjonariusza w makabryczną grę.",action
colectiv,"Dziennikarze śledczy odkrywają masowe oszustwa w rumuńskim systemie opieki zdrowotnej, ujawniając tym samym skalę istniejącej korupcji.",documentary
hop,"Zając Zet, dziedzic fabryki słodyczy na Wyspie Wielkanocnej, nie ma ochoty przejmować schedy po ojcu. Ucieka więc z domu, aby zostać perkusistą rockowego zespołu.",animation
bill &amp; teds bogus journey," Roboty sobowtóry wysłane z przyszłości zabijają Billa i Teda, aby zmienić przyszłość i nie dopuścić do stworzenia ich muzyki. Przyjaciele trafiają do piekła, ale... ",fantasy
on - drakon,Podczas swojego wesela księżniczka Mirosława zostaje porwana przez smoka.,fantasy
loving pablo,"Historia związku najpotężniejszego barona narkotykowego, Pablo Escobara i kolumbijskiej prezenterki, Virginii Valejo.",biography
over the top,"Lincoln Hawk, próbując odbudować relacje z synem, którego porzucił 10 lat temu, zabiera go w trasę swoją ciężarówką. ",drama
show,"Uczestnicy reality show zostają sprowadzeni na niezamieszkałą wyspę. Gdy w tajemniczych okolicznościach ginie kilku z nich, pozostali uświadamiają sobie, że nie mają dokąd uciec.&nbsp;",comedy
the open house,"Po przeżytej tragedii matka przenosi się ze swoim nastoletnim synem do należącego do rodziny domu wakacyjnego, gdzie sprzysięgają się przeciw nim upiorne, nieznane moce.",thriller
guardians of the galaxy,"Po kradzieży potężnego artefaktu niezdarny awanturnik, Peter Quill, staje się celem Ronana, który pragnie wywołać wojnę w galaktyce. Aby przeżyć, łączy swoje siły z czterema innymi autsajderami. ",action
yves saint laurent,"Paryż, rok 1957. 21-letni Yves Saint Laurent projektuje swoją pierwszą kolekcję dla domu mody Diora. Na pokazie poznaje miłość swojego życia. ",biography
the boondock saints ii: all saints day,"Bracia&nbsp;McManus, dowiedziawszy się o śmierci przyjaciela księdza, opuszczają bezpieczną farmę, by zemścić się na jego zabójcach.",crime
the visit,"Dokument opowiada o tym, co stałoby się, gdyby na Ziemi wylądowała nieznana i inteligentna forma życia.&nbsp;",documentary
inherent vice,"Los Angeles, rok 1970. U detektywa Larry'ego ""Doc"" Sportello pojawia się dawna ukochana z historią o porwaniu jej obecnego chłopaka miliardera. ",crime
last minute,"Matka Tomka, wygrywając wycieczkę do Egiptu, zabiera całą rodzinę ze sobą. Na miejscu dochodzi do wielu niefortunnych zdarzeń. ",comedy
fast &amp; furious presents: hobbs &amp; shaw,Stróż prawa Luke Hobbs i wyrzutek Deckard Shaw łączą swoje siły przeciwko cybernetycznie zmodyfikowanemu przestępcy zagrażającemu całej ludzkości. ,action
watership down,"Zaniepokojona wizją zbliżającego się niebezpieczeństwa grupa królików opuszcza stado i wyrusza w niebezpieczną podróż, aby znaleźć spokojne miejsce do życia.",animation
all is true,"Po tym, jak Globe Theatre spłonął podczas przedstawienia ""Henryka VIII"", Szekspir wraca do&nbsp;żony Anne Hathaway. W Stratford spędza swoje ostatnie dni.",biography
australia,Brytyjska arystokratka przybywa do Australii. Wkrótce dziedziczy farmę i walczy o jej utrzymanie. ,drama
contratiempo,"Po przebudzeniu się w pokoju hotelowym obok martwej kochanki młody biznesmen zatrudnia wybitną adwokat, aby ustalić, do czego tak naprawdę doszło.",crime
gravity,Weteran misji kosmicznych i ambitna pani naukowiec krążą po orbicie Ziemi na uszkodzonym promie.,drama
now you see me,Arcymistrzowie estradowych sztuczek wykorzystują iluzję do rabowania banków.,crime
bird,Saksofonista Charlie zaczyna tracić kontrolę nad swoim życiem oraz karierą wskutek uzależnienia od alkoholu i narkotyków.,biography
brokeback mountain,"Historia dwóch mężczyzn, którzy z sentymentem wracają do malowniczego Brokeback, gdzie przed laty połączyła ich wielka miłość. ",drama
the lord of the rings: the fellowship of the ring,"Podróż hobbita z Shire i jego ośmiu towarzyszy, której celem jest zniszczenie potężnego pierścienia pożądanego przez Czarnego Władcę - Saurona. ",fantasy
the dictator,"Historia dyktatora Aladeena, który podczas wizyty w Ameryce na własnej skórze doświadczy, co znaczy demokracja.",comedy
saint maud,"Maud przyjeżdża do luksusowej posiadłości ekscentrycznej Amandy. Wkrótce dziewczyna przekonuje się o swojej ważnej misji, która zamieni się w niebezpieczną obsesję... ",horror
the hunger games: catching fire,"Po powrocie z obowiązkowego Tournée Zwycięzców Katniss Everdeen i Peeta Mellark wracają na arenę Głodowych Igrzysk, gdzie stawiają czoła mistrzom poprzednich edycji.",action
adam resurrected,Mężczyzna ocalały z Holocaustu próbuje nauczyć się normalnie żyć. ,drama
grind,"Grupa amatorskich deskorolkarzy wyrusza w podróż po Ameryce, by zyskać sławę i rozgłos.",comedy
riding in cars with boys,Nastoletnia Beverly zachodzi w nieplanowaną ciążę i wychodzi za mąż. Nie porzuca jednak swojego marzenia o karierze pisarki.,biography
cloverfield,Nowy Jork zostaje zaatakowany przez ogromnych rozmiarów monstrum. Grupa młodych ludzi próbuje wydostać się z pogrążonego w chaosie miasta.,action
gods and monsters,W ostatnich dniach życia reżyser James Whale zaprzyjaźnia się ze swoim ogrodnikiem.,biography
miracle on 34th street,"Święty Mikołaj z centrum handlowego sprawia, że mała Susan znów zaczyna wierzyć w magię świąt.",family
escobar: paradise lost,"Młody surfer wyjeżdża wraz z bratem do Kolumbii, gdzie zakochuje się w pięknej Marii. Wkrótce poznaje jej wuja Pablo Escobara, handlarza kokainy.",thriller
v paprscich slunce,Dziewczynka z przeciętnej rodziny zostaje wybrana do północnokoreańskiej spartakiady. ,documentary
hotel transylvania 4, Po jednym z eksperymentów Johnny zmienia się w potwora a cała reszta w ludzi. Muszą teraz znaleźć sposób by to odwrócić.,animation
sweet girl,"Mąż przysięga wymierzyć sprawiedliwość ludziom odpowiedzialnym za&nbsp;śmierć jego żony. Musi przy tym chronić córkę - jedyną bliską osobę, która mu pozostała.",action
the brass teapot,"Para odkrywa, że niedawno znaleziony mosiężny czajnik ma magiczne moce - dostarcza pieniędzy za każdym razem, gdy któremuś z małżonków stanie się krzywda.",fantasy
solaris," Świat w niedalekiej przyszłości. Dr Chris Kelvin (George Clooney), psycholog, ma zbadać przyczyny zagadkowych zachowań niewielkiej grupy naukowców na pokładzie stacji... ",drama
miss americana,"Szczery do&nbsp;bólu dokument o&nbsp;Taylor Swift — autorce piosenek i&nbsp;artystce, ale przede wszystkim kobiecie wykorzystującej pełnię możliwości swojego głosu.",documentary
dr. jekyll and mr. hyde,"Doktor Jekyll odkrywa, że każdy człowiek ma swoją ciemną stronę. Wynajduje eliksir, za sprawą którego stopniowo traci kontrolę nad własną osobowością. ",horror
willow,Karzeł Willow wyrusza z misją mającą na celu ochronę niemowlęcia przed złą królową. ,fantasy
the haunting,"Grupa osób cierpiących na bezsenność zgłasza się do badań prowadzonych w oddalonym od cywilizacji domu. Nie wiedzą, że grozi im śmiertelne niebezpieczeństwo.",horror
resident evil: the final chapter,"Alice wraz z innymi wyrusza do Ula, aby zniszczyć Czerwoną Królową, która ma na celu wyeliminowanie rasy ludzkiej. ",horror
microcosmos: le peuple de lherbe,Dokument ukazuje jeden dzień z życia najmniejszych mieszkańców łąki. ,documentary
imagine that," Co by było, gdyby klucz do Twojego sukcesu leżał w wyobraźni Twojej córki? Gdy pewien magnat finansowy (Eddie Murphy) dostrzega, że jego imperium zaczyna się powoli... ",fantasy
the emoji movie," Miasto Tekstopolis zamieszkują&nbsp; emotki, gdzie każda z nich wyraża jedną konkretną emocję. Z wyjątkiem Minka, co może doprowadzić do katastrofy. ",animation
"synecdoche, new york","Reżyser teatralny przygotowuje nową sztukę, zmagając się jednocześnie z kobietami swego życia. ",drama
faust - eine deutsche volkssage," Doktor Faust zostaje nawiedzony przez Mefisto, który oferuje mu młodość, w zamian za oddanie duszy. Starszy mężczyzna podpisuje cyrograf z diabłem i ma okazję przeżyć to, czego dawniej sobie odmawiał, w tym nawiązuje romans z młodą Małgorzatką. ",fantasy
star trek,"Początki załogi USS Enterprise. James Kirk i Spock łączą siły, by ocalić swoich przyjaciół przed śmiertelnym niebezpieczeństwem.",action
halloween kills,"Laurie wierzy że pokonała swojego prześladowcę. Okazuje się jednak, że jej gehenna wcale się nie skończyła. ",horror
lillusionniste,"Francuski iluzjonista wyjeżdża do Edynburga, próbując ratować podupadającą karierę. Zaprzyjaźnia się z młodą dziewczyną, która wierzy, że jego sztuczki to prawdziwa magia.",animation
ninja: shadow of a tear,"Kiedy zamordowana zostaje ciężarna żona Caseya, mistrz ninjitsu poprzysięga zemstę i wyrusza do Tajlandii, by wytropić zabójcę ukochanej. ",action
the baytown outlaws,Braci Oodie otrzymują zlecenie odzyskania syna klientki.,action
its kind of a funny story,"Cierpiący na depresję nastolatek trafia na oddział psychiatryczny, gdzie otrzymuje szansę na nowy początek.",drama
the jungle book,"Mały chłopiec zostaje wychowany w dżungli przez dzikie zwierzęta. Gdy dorasta, postanawia odszukać Kitty, miłość z dzieciństwa. ",family
fallen,"Po traumatycznych przeżyciach Lucinda trafia do szkoły z internatem, gdzie poznaje dwóch nietypowych mężczyzn.",fantasy
quest for camelot,"Kayley, córka jednego z Rycerzy Okrągłego Stołu, wyrusza na poszukiwanie skradzionego Excalibura. Towarzyszą jej niewidomy giermek i dwugłowy smok.",animation
karigurashi no arrietty,"Japońska adaptacja ""Pożyczalskich"", którzy starają się spokojnie żyć pod podłogą ludzkiego domu.",family
the incredible hulk,"Od czasu napromieniowania Bruce szuka antidotum, które pozwoli mu zachować ludzkie ciało. Na jego drodze staje amerykański generał i brytyjski superżołnierz.",action
february,Dwóm uczennicom przydarza się seria niewytłumaczalnych i niebezpiecznych zdarzeń.,horror
problem child,"Bezdzietne małżeństwo adoptuje chłopca, który jest wyjątkowo nieznośnym rozrabiaką. ",family
muppets most wanted,Podczas światowego tournée Muppety zostają wplątane w międzynarodową aferę kryminalną. Stoi za nią Constantine – znany złodziej diamentów i sobowtór Kermita.,family
rambo: first blood part ii,"John Rambo, w zamian za wyjście z więzienia, zgadza się na odszukanie amerykańskich jeńców wojennych przetrzymywanych na terenie Wietnamu.",action
barnyard," Animacja w sposób zabawny opowiada o tym, co dzieje się w gospodarstwie wiejskim, gdy nie ma farmera. Nie zdajemy sobie sprawy, że zwierzęta potrafią chodzić, mówić i... ",animation
blast from the past,"Pan Webber, przekonany, że słyszy eksplozję bomby atomowej, schodzi z żoną do schronu, gdzie wkrótce rodzi się im syn. Po trzydziestu pięciu latach Adam wychodzi na powierzchnię, by uzupełnić zapasy i znaleźć sobie dziewczynę.",comedy
martyrs,"Skatowana Lucie trafia do szpitala, gdzie poznaje dziewczynę, która doświadczyła przemocy z rąk najbliższych osób.",drama
chopper,"Bezwzględny i brutalny recydywista Mark ""Chopper"" Read stara się zostać najsłynniejszym kryminalistą poprzez wymierzanie sprawiedliwości innym.",biography
stormbreaker,Wychowywany przez wuja nastolatek rozpoczyna współpracę z tajną organizacją szpiegowską. ,family
now you see me 2,Czterej Jeźdźcy zostają zwerbowani przez geniusza technologicznego i zmuszeni do dokonania najbardziej niewiarygodnego skoku rabunkowego w ich karierze.,crime
skyscraper,"Były antyterrorysta pełni funkcję konsultanta ds. bezpieczeństwa wieżowców. Gdy wybucha ogień w najwyższym chińskim budynku, musi uratować swoją rodzinę z rąk terrorystów i udowodnić, że to nie on jest odpowiedzialny za pożar. ",action
the three burials of melquiades estrada,Podstarzały ranczer z pomocą strażnika granicznego postanawia przetransportować zwłoki przyjaciela do jego rodzinnego miasteczka w Meksyku. ,drama
love the coopers,"Cztery pokolenia rodziny Cooperów zjeżdżają się, by jak co roku świętować Boże Narodzenie. Niespodziewani goście oraz wydarzenia wywrócą wieczór do góry nogami. ",comedy
within the whirlwind," Jest rok 1937. Eugenia Ginzburg, ideowa komunistka, wykłada literaturę rosyjską na uniwersytecie w Kazaniu. Jej mąż jest członkiem lokalnego komitetu WKP(b). Rodzina... ",biography
waiting...,W jednym z amerykańskich barów zostaje zatrudniony nowy pracownik. Pozostała część załogi prowadzi żółtodzioba przez tajniki i sekrety ich zawodu. ,comedy
the blind side,Bezdomny nastolatek zostaje otoczony opieką przez bogatą rodzinę. Dzięki niej wyrasta na gwiazdę amerykańskiego futbolu.,biography
finding nemo,"Błazenek Marlin rusza na pomoc swojemu synkowi Nemo, który został wyłowiony z rafy koralowej. W poszukiwaniach towarzyszy mu zapominalska rybka Dory.",animation
the wizard of oz,"Gdzieś za kolorową tęczą mieści się magiczna kraina Oz, w której Dorotka rozpoczyna swoją niezwykłą przygodę. ",family
moana,Nastoletnia córka przywódcy plemienia chcąc ocalić swoją wyspę przed zagładą wyrusza na niebezpieczną wyprawę po oceanie.,animation
king kong,"Lata 30. XX wieku. Bankrutujący reżyser i głodująca aktorka wyruszają na tajemniczą Wyspę Czaszki, by nagrać film swojego życia, ponieważ w Nowym Jorku panuje wielki kryzys. ",fantasy
la panthere des neiges,"Kojąca wędrówka po magicznym królestwie, którego największych tajemnic strzeże prawdziwa bogini – majestatyczna i nieuchwytna pantera śnieżna.",documentary
lassie,"Matt zaprzyjaźnia się z psem, dzięki któremu zaczyna inaczej patrzeć na świat.",family
minority report,"W 2054 roku można przewidzieć przyszłość, a winnych ukarać, zanim popełnią zbrodnię. Komisarz John Anderton zostaje oskarżony o morderstwo, do którego jeszcze nie doszło.",thriller
resident evil,"Na terenie tajnego kompleksu badawczego zostaje uwolniony wirus, zamieniający żywe istoty w zombie. Grupa ocalałych stara się wydostać z wrogiego miejsca. ",horror
moznosti dialogu,"Głowy i figury nawiązują komunikację poprzez wzajemne pożeranie się, uprawianie miłości czy współpracę. ",fantasy
videodrome,"Właściciel stacji kablowej ogląda&nbsp;filmy&nbsp;pełne realistycznego okrucieństwa, po czym bez względu na konsekwencje poszukuje źródła tych nagrań.",thriller
the green knight,"Sir Gawain, lekkomyślny i&nbsp;uparty siostrzeniec króla Artura, podejmuje misję zmierzenia się z Zielonym Rycerzem.",fantasy
the highwaymen,"Dwaj policjanci wracają z emerytury, aby pomóc w ujęciu Bonnie i Clyde'a.",crime
grey gardens," ""Szare ogrody"" to film dokumentalny, prezentujący codzienność dwóch przedstawicielek byłej elity społecznej, wiodących pustelnicze życie matki i córki o tym samym... ",documentary
maleficent: mistress of evil,Aurora postanawia wyjść za mąż i zamieszkać w zamku przyszłego męża. ,family
tampopo,"Kierowca ciężarówki zatrzymuje się w małym, rodzinnym barze makaronowym i decyduje się pomóc jego właścicielom.",comedy
fyre,"Festiwal Fyre był reklamowany jako luksusowe wydarzenie muzyczne na prywatnej wyspie, ale zbytnia pewność siebie organizatora doprowadziła do wielkiego fiaska.",documentary
clash of the titans,"Perseusz wyrusza na niebezpieczną wyprawę, by ocalić księżniczkę&nbsp;Andromedę. W wykonaniu misji pomagają mu niezwykłe stworzenia.",fantasy
split,"Mężczyzna o mnogiej osobowości porywa trzy nastolatki. Okazuje się, że jedna z jaźni zaczyna dominować nad innymi.",thriller
le ballon rouge,Chłopiec i balonik zostają nierozłączną parą przyjaciół. ,family
wir sind die nacht,"Zbuntowana nastolatka, Lena, zostaje przemieniona w wampira. Z czasem odkrywa, że jej nowe, nocne życie nie jest takie cudowne, jak się początkowo wydawało.",horror
hamilton,"Historia Alexandra Hamiltona - osieroconego imigranta, który przybywa do Nowego Jorku, by w przyszłości zostać jednym z ojców założycieli Stanów Zjednoczonych Ameryki.&nbsp;",biography
witness for the prosecution,"Stary, doświadczony adwokat mimo kłopotów zdrowotnych przyjmuje kolejną sprawę. Nie wie, że ma do czynienia z niezwykle zawiłą intrygą.",crime
hotel transylvania,Hrabia Drakula i jego 118-letnia córka prowadzą hotel w Transylwanii. Przyjaźń dziewczynki z ludzkim chłopcem wpędza rodzinę w kłopoty.,animation
black widow,"Natasha Romanoff / Czarna Wdowa, po wydarzeniach z filmu Kapitan Ameryka: Wojna bohaterów zmuszona jest do walki ze złoczyńcą nazywanym Taskmaster.",action
trespass against us, Chad jest rozdarty pomiędzy lojalnością wobec ojca a pragnieniem zapewnienia swoim dzieciom uporządkowanej przyszłości. Mężczyzna nie chce kontynuować kryminalnych tradycji rodzinnych. ,drama
captain america: civil war,"ONZ wprowadza przymusowy rejestr bohaterów, który doprowadza do konfliktu pomiędzy Kapitanem Ameryką a Iron Manem. Sytuację komplikuje zamach na króla Wakandy.",action
jestem morderca,Młody milicjant otrzymuje zadanie schwytania seryjnego zabójcy kobiet. ,thriller
dear zachary: a letter to a son about his father," W dniu 5 listopada 2001 roku, dr Andrew Bagby został zamordowany na parkingu w zachodniej Pensylwanii. Główna podejrzana, która jest jego byłą dziewczyną dr Shirley... ",documentary
justice league,"Jedni z największych superbohaterów na świecie tworzą Ligę Sprawiedliwości. Jej celem jest zwalczanie zagrożeń, które wykraczają poza ludzkie możliwości. ",action
meet the robinsons,"Młody geniusz wyrusza w podróż do przyszłości, aby odzyskać swój wynalazek.",animation
ghost recon: alpha,Oddział duchów dostaje nie lada zadanie. Ich misją jest wytropienie i zabicie największych zbrodniarzy wojennych. ,action
tu veux ou tu veux pas,"Lambert, seksoholik starający się zerwać z nałogiem, zatrudnia wiecznie niezaspokojoną nimfomankę.",comedy
si jetais toi,"W wypadku samochodowym ginie Hannah, której dusza zostaje uwięziona w ciele jej córki.",fantasy
a walk in the clouds,"Paul, weteran wojenny, poznaje ciężarną Victorię. Jedzie z nią w rodzinne strony i udaje jej męża. ",drama
american wedding,Grupa najlepszych przyjaciół z czasów liceum pomaga Jimowi w przygotowaniach do jego wesela. ,comedy
brake,"Agent specjalny, Jeremy Reins, budzi się w słabo oświetlonej, szklanej skrzyni. Zdaje sobie sprawę, że ma do czynienia z terrorystami.",crime
madagascar: escape 2 africa,"Czwórka przyjaciół próbuje wrócić do Nowego Jorku. Gdy ich samolot ulega awarii i rozbija się na terenie Afryki, Alex poznaje swoich rodziców.",animation
spider-man 3,"Kostium Spider-Mana łączy się z substancją z kosmosu i zmienia kolor na czarny. Nowy strój daje Parkerowi olbrzymią siłę, ale też odkrywa mroczną stronę jego osobowości.",action
one more time with feeling,Proces powstawania najnowszego wydawnictwa Nick Cave &amp; The Bad Seeds ''Skeleton Tree'' oraz zwraca szczególną uwagę na rodzinną tragedię lidera zespołu.,documentary
woodstock,"Dokument opowiadający o legendarnym festiwalu Woodstock, który odbył się w 1969 roku.&nbsp;",documentary
toy story 4,"Kowboj Chudy wraz z przyjaciółmi wyruszają na poszukiwania zaginionej nowej zabawki, Sztućka. ",animation
pawn sacrifice,Amerykański mistrz szachowy&nbsp;Bobby Fischer przygotowuje się do pojedynku&nbsp;z Rosjaninem Borisem Spasskim.,biography
over the limit,"Dokument opowiada o psychicznych kosztach, jakie niesie ze sobą uprawianie wyczynowego sportu. ",documentary
blackfish,Orka Tilikum&nbsp;jest odpowiedzialna za śmierć trzech osób. Dokument pokazuje skutki zamknięcia w niewoli tak inteligentnych i wrażliwych stworzeń.,documentary
corpse bride,"Victor przypadkiem oświadcza się nieżyjącej dziewczynie. Nieboszczka zabiera młodzieńca ze sobą do świata zmarłych, by go poślubić. ",animation
kalifornia,"Brian i Carrie wyruszają w podróż do Kalifornii, zabierając ze sobą Earla oraz jego dziewczynę, Adele. Nie wiedzą, że ich nowy znajomy to niebezpieczny przestępca. ",thriller
magiczne drzewo,"Trójka rodzeństwa znajduje krzesło spełniające życzenia. Korzystając z właściwości przedmiotu, dzieci rozpoczynają poszukiwania swoich rodziców. ",fantasy
slither,"Na małe amerykańskie miasteczko spada meteor z tajemniczym, agresywnym pasożytem.",horror
the disappeared,"Brat zaginionego chłopca próbuje wrócić do normalnego życia, jednak przeszłość nie daje mu spokoju. ",horror
man down,Były żołnierz i weteran misji w Afganistanie zaczyna zmagać się zespołem stresu pourazowego. ,thriller
overlord,"Przeddzień operacji D-Day, amerykańscy spadochroniarze w nazistowskiej wieży odkrywają niebezpieczne eksperymenty, które mają Hitlerowi pomóc wygrać II wojnę światową. ",horror
beats of freedom - zew wolnosci,"Historia rocka w Polsce w latach 80., którą przedstawiają gwiazdy tamtego okresu.&nbsp;",documentary
dolittle,"Dr Dolittle wyrusza na mityczną wyspę, by z pomocą zwierząt,&nbsp; zdobyć lekarstwo na chorobę królowej Anglii. ",family
from hell,"Londyn, rok 1888. Inspektor Frederick Abberline prowadzi śledztwo w sprawie Kuby Rozpruwacza.",crime
cinderella man,"Historia legendarnego boksera z czasów Wielkiego Kryzysu, Jima Braddocka, który po latach wraca na ring.",biography
the limits of control,"Płatny morderca dostaje zlecenie, którego szczegółów dostarczają mu nieznajome osoby.",thriller
"i, daniel blake","Stolarz, po tym jak uległ wypadkowi, potrzebuje opieki społecznej. Kiedy poznaje samotną matkę w podobnej sytuacji, postanawia jej pomóc.",drama
the forger,"Fałszerz, aby zostać zwolnionym z więzienia, decyduje się na skok życia: podrobienie obrazu Moneta i kradzież oryginału. W przekręcie pomaga mu ojciec oraz syn.",crime
a metamorfose dos passaros,"Opowieść będąca wędrówką przez losy trzech pokoleń, w centrum której znajduje się figura matki zapewniającej korzenie, ale i gałęzie, od których można się odbić, by odfrunąć.",documentary
american made,"Historia Barry'ego Seala, człowieka, który jednocześnie pracował dla CIA oraz kartelu.",drama
it,Opowieść o bestii karmiącej się dziecięcym strachem.,horror
a fei zheng chuan,"Yuddy dowiaduje się, że kobieta, która go wychowała, nie jest jego prawdziwą matką. Szuka pocieszenia w jednonocnych przygodach miłosnych.",crime
8mm,"Tom Welles otrzymuje zlecenie od żony zmarłego milionera. Ma odnaleźć zamordowaną dziewczynę, której zabójstwo zarejestrowano na taśmie odnalezionej w sejfie męża. ",thriller
heat,Zawodowy przestępca Neil McCauley organizuje zbrojny napad na opancerzoną furgonetkę. Śledztwo w tej sprawie prowadzi Vincent Hanna.,thriller
fantasy island,"Enigmatyczny pan Roarke spełnia najgłębiej skrywane marzenia gości ustronnego tropikalnego hotelu. Kiedy jednak fantazje zmieniają się koszmary, goście – aby przeżyć – zmuszeni są rozwiązać zagadkę tajemniczej wyspy.",horror
saw ii,"FBI znajduje kryjówkę Jigsawa, jednak nowa gra już się rozpoczęła.",horror
my super ex-girlfriend," Bycie superbohaterką ma swoje zalety, ale również wady. Trzeba nosić te absurdalnie obcisłe stroje, pomagać ludziom w potrzebie i ukrywać swoją prawdziwą tożsamość. To... ",fantasy
grace of monaco,"Ikona kina poślubia księcia&nbsp;Rainiera III i porzuca karierę, by pełnić obowiązki księżnej Monako.",biography
psycho ii," Norman Bates opuszcza mury szpitala psychiatrycznego, w którym spędził ponad 20 lat. Powrót do społeczeństwa staje się jednak dla niego trudniejszy niż przypuszczał. ",thriller
