title,description,genre
london has fallen,Terroryści planują największy w historii zamach. O losach zachodniej cywilizacji mogą zadecydować umiejętności jednego człowieka. ,thriller
meet the spartans,Leonidas prowadzi grupę trzynastu Spartan do walki przeciwko Persom.,comedy
thumbelina,"Kobieta otrzymuje od wróżki&nbsp; nasionka kwiatu, z którego wnętrza wychodzi dziewczynka. ",animation
nineteen eighty-four,"Winston Smith jest funkcjonariuszem reżimu Oceanii. Z czasem mężczyzna zaczyna buntować się przeciwko totalitarnemu państwu, na którego czele stoi Wielki Brat. ",drama
alex cross,Detektyw zajmujący się tropieniem seryjnych morderców otrzymuje makabryczną wiadomość od jednego z nich. ,crime
a wrinkle in time,"Po zniknięciu naukowca trzy osobliwe istoty wysyłają dziewczynę, jej brata i przyjaciółkę w kosmos, aby go odnaleźć.",family
shes out of my league,"Nieśmiały Kirk poznaje dziewczynę swoich marzeń. Chłopak musi pokonać własne kompleksy, by utrzymać związek. ",comedy
the last days on mars,Podczas zbierania próbek na Marsie członek załogi bazy Tantalus odkrywa dowód bakteryjnego życia. ,horror
terminator 2: judgment day,"Terminator T-800 ma za zadanie uchronić od śmierci Johna Connora, który w przyszłości poprowadzi ludzi do walki przeciwko maszynom.",action
bride of chucky,"Tiffany wskrzesza do życia lalkę, w której znajduje się dusza psychopatycznego mordercy.",horror
transporter 3,Transporter Frank dostaje kolejne zadanie; musi przewieźć córkę urzędnika z Marsylii do Odessy. ,action
john wick,"Były płatny morderca ściga gangsterów, którzy wtargnęli do jego domu, dokonując brutalnej napaści i kradzieży.",thriller
ghost recon: alpha,Oddział duchów dostaje nie lada zadanie. Ich misją jest wytropienie i zabicie największych zbrodniarzy wojennych. ,action
trading places,"Dwaj przypadkowi ludzie, padając ofiarą intrygi znudzonych bogaczy, układają plan wyrafinowanej zemsty.",comedy
enter the dragon,"Agent Lee decyduje się wziąć udział w&nbsp;turnieju sztuk walki, by znaleźć dowody nielegalnej działalności organizatora imprezy. ",action
the starving games,"Kantmiss Evershot walczy na śmierć i życie w głodowych igrzyskach, których nagrodą jest stara szynka, kupon do Subwaya oraz nadgryziony ogórek. ",comedy
cinderella,"Kopciuszek wybiera się na bal, chcąc urzec księcia. W spełnieniu marzenia pomaga jej dobra wróżka, która wyczarowuje jej nową suknie oraz buty ze szkła.",family
the cardinal,"Młody katolicki ksiądz z Bostonu wspomina swoje życie w dzień kardynalskich święceń. Opowiada nie tylko o sprawach osobistych, ale również nietolerancji oraz nazizmie podczas II wojny światowej.",drama
citizenfour,Dokument o Edwardzie Snowdenie. Rozmowy z nim odbywają się w Hongkongu. ,documentary
reminiscence,"Nick Bannister, samotny weteran mieszkający w Miami, oferuje klientom możliwość ponownego przeżycia każdego wspomnienia, jakiego zapragną. Jego życie zmienia się, gdy poznaje Mae.",thriller
kapringen," Statek towarowy MV Rozen zmierza do portu, gdy zostaje porwany przez somalijskich piratów na Oceanie Indyjskim. Wśród załogi statku znajduje się kucharz Mikkel oraz... ",drama
soul surfer,"Oparta na faktach historia trzynastoletniej surferki, która traci rękę w wyniku ataku rekina.&nbsp; ",biography
bronenosets potyomkin,Na pancerniku Potiomkin dochodzi do buntu marynarzy przeciwko oficerom.,drama
gullivers travels,"Początkujący autor przewodników turystycznych, w czasie pierwszej podróży służbowej, trafia do krainy Liliputów.",fantasy
man som hatar kvinnor,"Doświadczony dziennikarz śledczy i młoda hakerka starają się rozwikłać zagadkę zaginięcia 16-letniej dziewczyny, do którego doszło czterdzieści lat wcześniej. ",crime
blackfish,Orka Tilikum&nbsp;jest odpowiedzialna za śmierć trzech osób. Dokument pokazuje skutki zamknięcia w niewoli tak inteligentnych i wrażliwych stworzeń.,documentary
death on the nile,W czasie wakacji spędzanych nad Nilem Hercules Poirot będzie musiał rozwiązać sprawę morderstwa młodej milionerki.,crime
my big fat greek wedding,"30-letnia Toula wreszcie się zakochuje. On jest Amerykaninem, a ona pochodzi z konserwatywnej greckiej rodziny. ",comedy
danton,"Czasy Wielkiej Rewolucji Francuskiej. Jeden z jej przywódców, Danton, zostaje oskarżony o zdradę i spisek przeciwko krajowi.",biography
shi," Cierpiąca na chorobę Alzheimera kobieta bierze udział w kursie poezji po tym, jak odkrywa, że wnuczek doprowadził do samobójstwa szkolnej koleżanki. ",drama
glee: the 3d concert movie," Zajmij miejsce w pierwszym rzędzie na ekscytującym koncercie fenomenalnie utalentowanej obsady ""Glee"". Zobacz jak ulubione gwiazdy popularnego serialu śpiewają... ",documentary
phantom,"Kapitan sowieckiego okrętu podwodnego wyrusza na tajną misję, która może przesądzić o losach świata. ",thriller
the tall man,"Historia matki uprowadzonego chłopca, której przychodzi zmierzyć się z przerażającą legendą. ",thriller
drive,Bezimienny kierowca postanawia pomóc mężowi swojej sąsiadki w anulowaniu długu u groźnych bandytów.,action
2 fast 2 furious,Jedyną szansą na schwytanie piorącego brudne pieniądze biznesmena jest infiltracja środowiska nielegalnych wyścigów samochodowych. Zadania podejmuje się były policjant.,action
tenki no ko,"Hodaka po przeprowadzce do Tokio spotyka Hinę, która ma tajemniczą zdolność kontrolowania pogody.",fantasy
ant-man and the wasp,Ant-Man i Osa próbują odkryć tajemnice przeszłości doktora Hanka Pyma i Hope van Dyne.,action
tinker bell and the legend of the neverbeast,"Jelonka, beztroska i utalentowana wróżka świata zwierząt, zaprzyjaźnia się z ogromną bestią i sprowadza ją do Przystani Elfów. Nie wszystkim ten pomysł się podoba. ",animation
the purge,"Niedaleka przyszłość. W eksperymentalnej walce z przestępczością raz do roku przez 12 godzin każde naruszenie prawa, również morderstwo, jest całkowicie legalne. ",thriller
miracle on 34th street,"Święty Mikołaj z centrum handlowego sprawia, że mała Susan znów zaczyna wierzyć w magię świąt.",family
scream 4,"Kiedy w ramach promocji książki Sidney Prescott przybywa do rodzinnej miejscowości, rozpoczyna się seria niewyjaśnionych morderstw.",horror
the punisher,"Policjant, który stracił rodzinę w zamachu przygotowanym przez mafię, prowadzi prywatną wojnę z całym półświatkiem przestępczym. ",thriller
bang gang (une histoire damour moderne),"Grupa przyjaciół wymyśla odważną zabawę, którą nazywa Bang Gang. Jeśli w nią nie grasz, jesteś nikim. ",drama
the emperors new groove,"Młody król zostaje zmieniony w lamę i wyrzucony z pałacu. Zrozpaczony władca poznaje wieśniaka, który pomaga mu ponownie zasiąść na tronie. ",animation
"lock, stock and two smoking barrels",Czterech przyjaciół postanawia ograć w karty potężnego gangstera&nbsp;i zgarnąć jego pieniądze. ,comedy
all about steve,"Mary i Steven zostają umówieni przez rodziców na randkę w ciemno. Ona jest pewna, że spotkała mężczyznę swojego życia, on jest przekonany, że ma do czynienia z wariatką.",comedy
tmnt," Wojownicze Żółwie Ninja powracają po latach nieobecności na dużym ekranie. Po pokonaniu starego wroga, Shreddera, rodzina żółwi zaczyna się rozpadać. Niepokój Splintera... ",animation
the shining,Jack podejmuje pracę stróża odciętego od świata hotelu Overlook. Wkrótce idylla zamienia się w koszmar. ,horror
snow white and the seven dwarfs,Zazdrosna zła królowa zleca myśliwemu zabicie swojej pasierbicy. Dziewczyna ucieka oprawcy i znajduje schronienie w chatce siedmiu krasnoludków.,animation
avengers: infinity war,Potężny Thanos zbiera Kamienie Nieskończoności w celu narzucenia swojej woli wszystkim istnieniom we wszechświecie. Tylko drużyna superbohaterów znanych jako Avengers może go powstrzymać.,action
paddington,Niedźwiadek szuka szczęścia w wielkim mieście.,family
limonadovy joe aneb konska opera,"W zdeprawowanym miasteczku na Dzikim Zachodzie pojawia się kowboj o blond włosach, który zamiast alkoholu pije lemoniadę. ",comedy
bambi ii,"Po śmierci matki opiekę nad Bambim przejmuje ojciec. Wielki Książę Lasu uczy swego syna wszystkiego, co jeleń powinien wiedzieć.",animation
bullets over broadway,"Ambitny dramaturg bezskutecznie poszukuje funduszy na realizację swojej sztuki. Trafia do gangstera, który oferuje mu pomoc.",comedy
gierek,"Historia życia Edwarda Gierka, I sekretarza KC PZPR w latach 1970–1980.",biography
the open house,"Po przeżytej tragedii matka przenosi się ze swoim nastoletnim synem do należącego do rodziny domu wakacyjnego, gdzie sprzysięgają się przeciw nim upiorne, nieznane moce.",thriller
dirty grandpa,Mający niebawem się ożenić Jason zabiera swojego dziadka na przejażdżkę po Florydzie. ,comedy
doctor sleep,Dorosły Dan Torrance błąkając się po Ameryce spotyka małą dziewczynkę o takich samych zdolnościach jak on i stara się ją uchronić przed kultem Prawdziwy Węzeł.,horror
goosebumps,"Zacha i Hannę łączy tajemnicza więź. Gdy chłopak poznaje ojca dziewczyny, który jest pisarzem, uwalnia potwory pochodzące z jego książki.",horror
date and switch,Michael i Matty pragną stać się mężczyznami jeszcze przed studniówką. Jednak w oczach koleżanek nie są atrakcyjni. ,comedy
born into brothels: calcuttas red light kids,Historia dzieci mieszkających w dzielnicy Czerwonych Latarni w Kalkucie.,documentary
gedo senki," Ged, potężny mag, wyrusza w niebezpieczną podróż. Jego&nbsp;celem jest&nbsp;ocalenie świata ludzi przed katastrofą, którą zwiastują pojawiające się nad Archipelagiem smoki. ",fantasy
the outsider,"Historia byłego amerykańskiego żołnierza, który po II wojnie światowej wstępuje do japońskiej yakuzy.",thriller
the nun,"Ojciec Burke i Siostra Irene zostają wysłani przez Watykan do klasztoru w Rumunii, aby zbadać przyczyny&nbsp;tajemniczej śmierci zakonnicy.",horror
insidious,"Po upadku z drabiny chłopiec traci przytomność. Będąc w śpiączce, wchodzi do świata umarłych.",horror
the fifth element,"Nowy Jork w XXIII w., były komandos Korben Dallas wplątany zostaje w misję ratowania świata przed siłami zła absolutnego objawiającymi się raz na pięć tysięcy lat.",action
mortal kombat,"Wojownicy podróżują do świątyni boga Raidena, aby przygotować się do krwawego turnieju zwanego jako Mortal Kombat.",fantasy
horton hears a who!,"Słoń Horton jako jedyny słyszy mieszkańców mikroskopijnego miasta Ktosiowa. Jego przyjaciele są przekonani, że zwariował. ",animation
dolor y gloria,"Salvador Mallo, kultowy hiszpański reżyser filmowy, który stroni od mediów i usilnie strzeże swojej prywatności, przeżywa na nowo najważniejsze momenty swojego życia.",drama
"as above, so below",Dwójka archeologów poszukuje zaginionego skarbu w katakumbach pod Paryżem.,horror
le jeu,Starzy przyjaciele postanawiają dodać pikanterii wspólnej kolacji i&nbsp;dzielą się wszystkimi wiadomościami przychodzącymi na&nbsp;ich telefony.,comedy
grand piano,"Po kilkuletniej przerwie utalentowany pianista, Tom Selznick, pojawia się na długo oczekiwanym koncercie chicagowskim. Tuż przed występem odnajduje tajemniczą wiadomość w zeszycie z nutami.",thriller
x-men: apocalypse,"Kiedy jeden z najniebezpieczniejszych i najpotężniejszych mutantów, Apocalypse, chce zniszczyć całą planetę, powstrzymać go mogą tylko X-Meni.",action
kapitan bomba - zemsta faraona,Kapitan Bomba musi ocalić ludzkość przed starożytnymi wojownikami.&nbsp;,animation
the twilight saga: eclipse,Bella będzie musiała ostatecznie wybrać pomiędzy miłością do wampira Edwarda a przyjaźnią z wilkołakiem Jacobem.,horror
chopin. pragnienie milosci,"Początkujący kompozytor, Fryderyk Chopin, spotyka bogatą francuską pisarkę, z którą nawiązuje namiętny romans. ",biography
love the coopers,"Cztery pokolenia rodziny Cooperów zjeżdżają się, by jak co roku świętować Boże Narodzenie. Niespodziewani goście oraz wydarzenia wywrócą wieczór do góry nogami. ",comedy
the iron lady,"Margaret Thatcher jest zmęczoną życiem kobietą, dręczoną marami przeszłości. Była premier Wielkiej Brytanii rozmawia z nieżyjącym mężem i wspomina błyskotliwą karierę polityczną.",biography
flee,"Prawdziwa historia Amina, który u progu małżeństwa jest zmuszony ujawnić swoją przeszłość. ",animation
cats &amp; dogs: the revenge of kitty galore,"Koty i psy łączą siły, aby nie dopuścić do zagłady swoich gatunków.&nbsp;",family
the lady in the van,"Historia niezwykłej przyjaźni pomiędzy mężczyzną a ekscentryczną staruszką, która mieszka w samochodzie na jego podjeździe.",biography
stretch,"Kierowca podejmuje pracę u miliardera, który zmienia jego życie w piekło.",comedy
the wolf of wall street,"Historia Jordana Belforta, brokera, którego błyskawiczna droga na szczyt i rozrzutny styl życia wzbudziły zainteresowanie FBI.",biography
the three burials of melquiades estrada,Podstarzały ranczer z pomocą strażnika granicznego postanawia przetransportować zwłoki przyjaciela do jego rodzinnego miasteczka w Meksyku. ,drama
les couloirs du temps: les visiteurs 2,"Rycerz Godfryd de Montmirail przenosi się w przyszłość, by odzyskać rodowe klejnoty.",fantasy
ghost rider: spirit of vengeance,"Ghost Rider staje do walki z ciemnymi mocami, aby ocalić chłopca, którego ciało pragnie przejąć szatan.",fantasy
raging bull,"Życiorys Jake'a La Motty, zawodowego mistrza wagi średniej w boksie, który na ringu odznaczał się wyjątkową brutalnością i wolą walki. ",biography
pitch perfect,"Beca, studentka pierwszego roku na Barden University, dołącza do damskiego chóru szkolnego, The Bellas, który startuje w zawodach a capella. ",comedy
le magasin des suicides,"Interes Mishimy i Lukrecji – sklep z artykułami dla samobójców – kwitnie do czasu narodzin ich trzeciego dziecka. Malec się uśmiecha, zarażając optymizmem. ",animation
offret sacrificatio,"Gdy zostaje nadany alarm zwiastujący atak atomowy, ateista zwraca się o pomoc do Boga. Gotów jest poświęcić samego siebie, by zapewnić bliskim bezpieczeństwo. ",drama
safe,"Były nowojorski gliniarz ratuje małą dziewczynkę z rąk gangsterów, którzy zmienili jego życie w koszmar.",crime
about a girl," Charleen niedługo przed swoimi szesnastymi urodzinami jest jedną z tych nastolatek, które zdają się dźwigać problemy całego świata na własnych barkach. Być może to... ",comedy
independence day: resurgence,Dwadzieścia lat od inwazji obcych w Dzień Niepodległości ludzkość znów&nbsp;zostaje zmuszona do&nbsp;obrony Ziemi przed atakiem z kosmosu. ,action
father of the bride,"Życie Georga zostaje zdezorganizowane, kiedy dowiaduje się o rychłym ślubie córki, która ukończyła studia w Europie. ",family
the bfg,"Cierpiąca na bezsenność sierota Sophie pewnej nocy zauważa olbrzyma. Ten, dla bezpieczeństwa swojej rasy, postanawia ją porwać.",family
winter on fire,Ukraińska demonstracja studencka dotycząca integracji europejskiej przeistacza się w rewolucję wzywającą do dymisji prezydenta Janukowycza. ,documentary
trash,"Ubodzy brazylijscy chłopcy znajdują portfel na lokalnym wysypisku śmieci. Kiedy stają się celem policji, postanawiają uciec i odkryć tajemnice, które kryje ich znalezisko. ",crime
the walk,"Historia francuskiego artysty Philippe'a Petita, który w 1974 roku przeszedł po linie między wieżami World Trade Center.",biography
popieluszko. wolnosc jest w nas,"Historia życia księdza Jerzego Popiełuszki, który angażuje się we wsparcie związku zawodowego „Solidarność”.",biography
sophies choice,"Niedługo po II wojnie światowej młody pisarz przeprowadza się do Nowego Jorku. Jego sąsiadami są Żyd mający obsesję na punkcie zbrodni przeciwko swojemu narodowi i Polka, która w Auschwitz straciła rodzinę. ",drama
nattevagten," Student prawa, Martin, znajduje pracę na stanowisku nocnego strażnika w instytucie medycznym. Noce ma zamiar spędzić na nauce, ale jedno miejsce nie daje mu spokoju... ",horror
oscar,"Gangster Angelo Provolone przyrzeka swojemu umierającemu ojcu, że rozpocznie uczciwe życie. ",comedy
frozen fever,Elsa przygotowuje imprezę urodzinową dla swojej siostry Anny.,animation
megamind,"Po unicestwieniu swojego jedynego wroga Metro Mena, Megamocny tworzy jeszcze silniejszego przeciwnika, który wymyka mu się spod kontroli.",animation
it takes two,"Córka bogatych rodziców Alyssa i sierota Amanda są do siebie bardzo podobne. Wpadają na pomysł, by zamienić się na jakiś czas miejscami.",family
aliens,Po 57 latach hibernacji Ellen Ripley zostaje odnaleziona. Zgadza się wziąć udział w misji mającej na celu likwidację obcych istot zagrażających kolonizatorom. ,horror
a nightmare on elm street 4: the dream master,Kristen posiada niezwykłą umiejętność: potrafi wciągać do swoich snów inne osoby. Freddy Krueger chce to wykorzystać. ,horror
ak-ma-leul bo-ass-da,Młody agent koreańskich służb specjalnych postanawia sam wymierzyć sprawiedliwość mordercy swojej narzeczonej. ,crime
jessabelle,Po stracie chłopaka Jessabelle wprowadza się do ojca. W nowym miejscu odkrywa mroczną tajemnicę związaną ze zmarłą matką.,horror
indignation," Zrealizowany na podstawie słynnej powieści Philipa Rotha film ""Wzburzenie - opowieść o dojrzewaniu"" ukazuje losy Marcusa Messnera (Logan Lerman), wzorowego ucznia i... ",drama
anna and the king,Na dwór króla Syjamu przybywa angielska guwernantka. ,biography
ray,"Historia legendy jazzu i bluesa, Raya Charlesa, który pomimo niepełnosprawności zdobywa sławę. ",biography
excalibur,Artur zostaje królem Brytanii i staje na czele Rycerzy Okrągłego Stołu. Intrygi przeciwko nowemu władcy knuje jego własna siostra Morgana.,fantasy
planeta singli,Romantyczna Ania bierze udział w reality show ukazującym prawdziwą twarz facetów flirtujących w sieci i wyśmiewającym naiwność kobiet szukających tam ideału.,comedy
thor: ragnarok,"Thor mierzy się w walce bogów, podczas gdy Asgard jest zagrożony Ragnarokiem, nordycką apokalipsą. ",fantasy
palimpsest,"Marek, inspektor policji, usiłuje rozwiązać sprawę zabójstwa swojego kolegi z wydziału. ",thriller
self/less,"Zamożny mężczyzna chorujący na raka korzysta z udogodnień ówczesnej medycyny, która umożliwia mu przeniesienie świadomości do zdrowego i młodego ciała.",thriller
cloudy with a chance of meatballs 2,Maszyna zmieniająca wodę w żywność z poprzedniej części wciąż działa i produkuje niebezpieczne jedzeniowo-zwierzęce hybrydy. Flint musi ją unieszkodliwić.,animation
kret,"Paweł rozkręca wraz z ojcem wspólny interes. Wszystko&nbsp;układa się pomyślnie do momentu, kiedy powstaje artykuł godzący w dobre&nbsp;imię rodziny.",thriller
excision,"Historia siedemnastoletniej Pauline, nieakceptowanej przez społeczeństwo. Nieprzystosowana do licealnego życia realizuje swoje chore fantazje oraz pragnienie bycia chirurgiem.&nbsp;",horror
hangman,"Doświadczeni policjanci dostają zadanie, którym jest złapanie groźnego seryjnego mordercy. Zostają wplątani w wisielczą grę. ",crime
heat,Zawodowy przestępca Neil McCauley organizuje zbrojny napad na opancerzoną furgonetkę. Śledztwo w tej sprawie prowadzi Vincent Hanna.,thriller
saving mr. banks,"Oparta na prawdziwych wydarzeniach opowieść o powstawaniu ""Mary Poppins"" i burzliwych relacjach Walta Disneya z autorką P.L. Travers, które niemal doprowadziły do klęski tej produkcji.",biography
vehicle 19,"Michael Woods podróżuje do RPA, by spotkać się z byłą żoną. Nieświadomy niczego wypożycza trefny samochód. ",thriller
naked lunch,"Bill Lee jest dezynsektatorem, który przez przypadek zabija swoją żonę uzależnioną od środka owadobójczego. Po tym zdarzeniu mężczyzna zatraca się w nałogu narkotykowym, mając przedziwne wizje.",thriller
the patriot,Wiodący spokojne życie Wesley postanawia powstrzymać terrorystów przed rozpowszechnieniem śmiercionośnego wirusa.,thriller
kite,"Po brutalnym morderstwie rodziny Sawa zostaje przygarnięta przez kolegę ojca, który szkoli ją na zawodową zabójczynię. ",action
oceans,"Dokument ukazuje piękno życia w oceanach, oraz zwraca uwagę na zagrażające Ziemi niebezpieczeństwa.",documentary
barnyard," Animacja w sposób zabawny opowiada o tym, co dzieje się w gospodarstwie wiejskim, gdy nie ma farmera. Nie zdajemy sobie sprawy, że zwierzęta potrafią chodzić, mówić i... ",animation
death race 2000, Akcja filmu toczy się w niedalekiej przyszłości. Świat zafascynowany jest krwawymi i niebezpiecznymi wyścigami samochodowymi. Cieszą się one wielką popularnością. Ważnym... ,action
the croods,"Do prehistorycznego świata przybywa geniusz z rewolucyjnym wynalazkiem, jakim jest... ogień.",animation
asterix chez les bretons,Asterix i Obelix zamierzają pomóc Brytom w walce z Rzymianami. Wieziony przez nich magiczny napój ma zmienić oblicze wojny. ,animation
asterix et cleopatre,"Kleopatra przyjmuje zakład z Juliuszem Cezarem, że jej rodacy&nbsp;zbudują&nbsp;pałac w trzy miesiące. Egipcjanie zwracają się o pomoc do Asterixa i Obelixa.",animation
baby boy,"Jody jest wiecznym chłopcem. Nie ma pracy, ma za&nbsp;to&nbsp;dwójkę dzieci i&nbsp;coraz więcej zobowiązań. Do tego matka wraz z&nbsp;nowym facetem chcą, żeby się wreszcie wyprowadził.",drama
the young and prodigious t.s. spivet,Dziesięcioletni kartograf potajemnie opuszcza swoje rodzinne ranczo w Montanie. Pociągiem towarowym udaje się po obiecaną nagrodę. ,drama
death note: the last name,Light przyłącza się do grupy&nbsp;próbującej wyśledzić zabójcę Kirę.,horror
us,"Matka i ojciec spędzają czas z dziećmi w domku na plaży. Wkrótce ich spokój zakłócają nieproszeni goście, którzy nie mają dobrych intencji.",horror
shadow of the vampire,"Friedrich W. Murnau zatrudnia do głównej roli w ""Nosferatu"" prawdziwego wampira.",horror
lucky them,Dziennikarka rockowa dostaje zlecenie wytropienia swojego byłego chłopaka.,drama
bad boy,"Właściciel klubu piłkarskiego nie cofa się przed niczym, by&nbsp;zbudować drużynę mistrzów. Na szokujące skutki jego działań nie trzeba długo czekać.",thriller
trolls,"Księżniczka Poppy wyrusza w pełną niebezpieczeństw przygodę, żeby uratować przyjaciół i pomóc towarzyszowi odnaleźć radość. ",animation
bak-jwi,"Podczas badań nad śmiertelnym wirusem ksiądz zostaje zarażony wampiryzmem, co też budzi w nim ludzkie pragnienia. Wkrótce duchowny spotyka piękną mężatkę, która sprowadza go na drogę grzechu. ",drama
inside out,"Życiem Riley kieruje pięć emocji: Radość, Strach, Gniew, Odraza i Smutek. Pozostałe próbują zakłócić pierwszą, gdy dziewczyna przeprowadza się z rodzicami do San Francisco. ",animation
the absinthe drinkers," Akcja filmu rozgrywa się w Paryżu w 1889 roku. Czasy, w których styl impresjonizmu przewrócił świat do góry nogami. Jest to historia młodej utalentowanej, niemieckiej... ",drama
tom &amp; jerry,"Mysz Jerry zamieszkuje w luksusowym nowojorskim hotelu. Aby się go pozbyć, pracownica angażuje kota Toma.",animation
the numbers station,"Po nieudanym zleceniu agent CIA zostaje przeniesiony do ochrony stacji szyfrującej, która zostaje zaatakowana przez terrorystów. ",thriller
snezhnaya koroleva,"Królowa Śniegu, planująca zamrożenie serc wszystkich ludzi na świecie, porywa Kaia, syna słynnego mistrza wyrobów ze szkła. Siostra chłopca, Gerda, rusza mu na pomoc.&nbsp; ",animation
appleseed," Superprodukcja 3D, pierwsza część trylogii SF. Wyjątkowa i przełomowa produkcja pod względem animacji (bardzo realistycznej). Akcja rozgrywa się po trzeciej wojnie... ",action
king richard,"Losy Venus i&nbsp;Sereny Williams, które dzięki ojcu stały się najlepszymi tenisistkami w&nbsp;historii tego sportu.",biography
the hunt for gollum,"Aragorn podejmuje się misji schwytania Golluma, który stanowi zagrożenie dla losów Śródziemia. ",fantasy
blood and chocolate,Młoda Vivian pochodzi z rodu wilkołaków i jest rozdarta między obowiązkami wobec własnego klanu a miłością do zwykłego człowieka. ,fantasy
lasky jedne plavovlasky,"Podczas potańcówki na czeskiej prowincji Andula poznaje Mildę, pianistę z Pragi, i przeżywa miłość od pierwszego wejrzenia.",drama
buena vista social club,Dokument przedstawia tętniącą życiem scenę muzyczną Kuby.,documentary
to stay alive: a method,Dokument rejestruje pierwsze spotkanie pisarza z Iggy Popem. ,documentary
la panthere des neiges,"Kojąca wędrówka po magicznym królestwie, którego największych tajemnic strzeże prawdziwa bogini – majestatyczna i nieuchwytna pantera śnieżna.",documentary
haute tension,Marie przyjeżdża do swej przyjaciółki mieszkającej na odludziu. W nocy u ich drzwi pojawia się uzbrojony w skalpel zabójca.,horror
bleed for this,"Młody bokser&nbsp;walczy o powrót&nbsp;na ring po wypadku samochodowym, w którym jego kręgosłup został poważnie uszkodzony. ",biography
el silencio del pantano,"Gdy dziennikarz, który został autorem kryminałów, przygląda się korupcji w&nbsp;ramach pisania nowej książki, granice między fikcją a&nbsp;rzeczywistością szybko się zacierają.",thriller
101 dalmatians,"Para dalmatyńczyków rusza na ratunek swoim szczeniętom. Pieski zostały porwane przez kobietę, która chce&nbsp;zrobić z nich&nbsp;futro.",family
confessions of pain,"Detektyw pomaga w dochodzeniu, które ma wyjawić okoliczności tajemniczej śmierci ojca jego przyjaciela.",thriller
