title,description,genre
te wu mi cheng,"Buck Yuen odkrywa, że jest zaginionym synem biznesmena. Próbując go poznać, mężczyzna wpada w serię nieprawdopodobnych zdarzeń.",comedy
psy 3. w imie zasad,"Po 25 latach odsiadki Franz Maurer wkracza w nową Polskę, gdzie nic nie jest takie, jak zapamiętał. Wkrótce ponownie spotyka Nowego.",thriller
running with scissors,"Neurotyczna poetka oddaje syna na wychowanie swojemu psychiatrze. Chłopcu trudno jest odnaleźć się w pozbawionym zasad domu, którego dziwaczni mieszkańcy nie tłumią emocji, prezentując cały wachlarz absurdalnych zachowań.",biography
"lo and behold, reveries of the connected world","Podróż przez Internet, sztuczną inteligencję, robotykę oraz sposób, w jaki wpływają na nasze życia.",documentary
all good things,"David i Katie zakochują się w sobie, lecz kiedy coraz więcej sekretów wychodzi na jaw, kobieta znika.",drama
our family wedding,Dwaj skłóceni ze sobą ojcowie zmuszeni są zorganizować wesele swoim dzieciom. ,comedy
pride and prejudice and zombies,"Siostry Bennett przeżywają miłosne perypetie, gdy w Hertfordshire wylęgają się zombie.",horror
lifted,Młody kosmita przechodzi kurs porwania Ziemianina podczas snu.,animation
breakdown,Żona Jeffa znika w niewyjaśnionych okolicznościach. Zdezorientowany mężczyzna rozpoczyna poszukiwania.,thriller
katyn,17 września 1939 roku ZSRR napada na Polskę. Dowódcy i oficerowie Wojska Polskiego zostają pojmani przez Armię Czerwoną. ,war
ella enchanted,"Ella otrzymuje nietypowy urodzinowy prezent - obowiązek posłuszeństwa wobec innych. Kilka lat później dziewczyna wyrusza w podróż, by znaleźć sposób na zdjęcie uroku.",fantasy
all is true,"Po tym, jak Globe Theatre spłonął podczas przedstawienia ""Henryka VIII"", Szekspir wraca do&nbsp;żony Anne Hathaway. W Stratford spędza swoje ostatnie dni.",biography
jobs,"Biografia jednego z największych wizjonerów XX w. – Steve'a Jobsa, i historia wczesnych lat Apple.",biography
no good deed,Była pani prokurator i jej dzieci zostają porwani przez uciekiniera z więzienia. ,thriller
faust - eine deutsche volkssage," Doktor Faust zostaje nawiedzony przez Mefisto, który oferuje mu młodość, w zamian za oddanie duszy. Starszy mężczyzna podpisuje cyrograf z diabłem i ma okazję przeżyć to, czego dawniej sobie odmawiał, w tym nawiązuje romans z młodą Małgorzatką. ",fantasy
ballerina,"Jedenastoletnia sierota Felicja ucieka do Paryża, by zostać baleriną w operze. Tam trafia pod opiekę byłej gwiazdy baletu. ",animation
what lies beneath,Po wyjeździe córki na studia Norman i Claire wyprowadzają się z miasta. Wkrótce w nowym domu zaczyna straszyć. ,thriller
vampire in brooklyn,"Do Nowego Jorku przybywa wampir Maximillian. Pragnie on odszukać kobietę, z którą wiążą go więzy krwi.",horror
siu lam juk kau,"Sześciu wychowanków klasztoru Shaolin, mistrzów kung-fu, postanawia wziąć udział w turnieju piłki nożnej. W wygranej mają im pomóc umiejętności wschodnich sztuk walki. ",comedy
stop! or my mom will shoot,W życie prywatne i zawodowe detektywa Joe'a Bomowskiego wkracza jego&nbsp;nadopiekuńcza&nbsp;matka.,comedy
the fifth estate,"Julian Assange i Daniel Domscheit-Berg zakładają WikiLeaks, ujawniając skrywane sekrety rządowe oraz przestępstwa wielkich korporacji. ",biography
spies like us,"Dwóch nieudolnych amerykańskich szpiegów zostaje wysłanych do ZSRR, aby odwrócić uwagę służb radzieckich od prawdziwych agentów.",comedy
deep blue sea,"Grupa naukowców prowadzi kontrowersyjne eksperymenty w stacji badawczej, poprawiając kod genetyczny rekinów. Zwierzęta jednak wymykają się spod kontroli. ",thriller
moskva slezam ne verit,"Katerina, Ludmiła i Antonina przybywają do Moskwy. Każda z nich inaczej planuje swoją przyszłość.",romance
everly,Ukrywająca się w swoim apartamencie kobieta stawia czoła licznej grupie morderców nasłanych przez jej byłego chłopaka - szefa mafii.,action
fierce creatures,"Pracownicy londyńskiego zoo zmagają się z nowym właścicielem, dla którego liczy się tylko zysk. ",comedy
coffee and cigarettes,Jedenaście krótkich epizodów przedstawiających rozmowy przy kawie i papierosach.&nbsp;,drama
wiedzmin,Wiedźmin Geralt trudni się zwalczaniem niebezpiecznych potworów. Często jednak ludzkie okrucieństwo i żądza władzy są dużo groźniejsze. ,fantasy
solomon kane,"Legendarny zabijaka musi stawić czoła demonom z piekła rodem, aby odkupić swoją przeklętą duszę.",fantasy
kapringen," Statek towarowy MV Rozen zmierza do portu, gdy zostaje porwany przez somalijskich piratów na Oceanie Indyjskim. Wśród załogi statku znajduje się kucharz Mikkel oraz... ",drama
1922,"Rolnik przyznaje się do zabójstwa żony, jednak ta śmierć stanowi raptem początek makabrycznej historii. Film na podstawie opowiadania Stephena Kinga.",horror
superman ii,"Na Ziemię przybywa troje złowrogo nastawionych Kryptonian, których celem jest podbój planety. Ich plany próbuje pokrzyżować Superman.",action
into the mind,"Narciarze ryzykują życiem, podejmując sportowe i mentalne wyzwanie, jakie stawia im natura, strach oraz własne ograniczenia.",documentary
little manhattan,"Kiedy 11-letni Gabe zakochuje się w byłej koleżance z przedszkola, musi nie tylko poradzić sobie z nieznanym dotąd uczuciem, ale i rozwodem rodziców. ",family
rabbits," David Lynch jest pierwszym szeroko znanym twórcą kinowym, który rozpoczął realizację filmów prezentowanych tylko w Internecie. Pierwszym był ""Dumblandu"". ""Rabbits""&nbsp;to... ",drama
around the world in 80 days,Ekscentryczny angielski gentleman podejmuje zakład okrążenia świata w 80 dni. ,comedy
asterix: le domaine des dieux,Juliusz Cezar decyduje się na budowę dzielnicy mieszkaniowej dla właścicieli rzymskich i nazywa ją Osiedlem Bogów.,animation
inside out,"Życiem Riley kieruje pięć emocji: Radość, Strach, Gniew, Odraza i Smutek. Pozostałe próbują zakłócić pierwszą, gdy dziewczyna przeprowadza się z rodzicami do San Francisco. ",animation
how the west was won,"USA, 1839 rok. Rodzina Prescottów wyrusza z Nowego Jorku na Dziki Zachód w poszukiwaniu lepszego życia. ",western
i am not your negro,Historia rasizmu w USA na podstawie morderstw trzech znanych Afroamerykanów.,documentary
in time,"W społeczeństwie przyszłości walutą jest czas. Najbogatsi, czyli młodzi, zdrowi i piękni mogą żyć tysiące lat, podczas gdy biedota budzi się co rano, mając do dyspozycji kilkanaście godzin.",thriller
the light between oceans,"Żyjący u wybrzeży zachodniej Australii latarnik i jego żona wychowują dziecko, które uratowali z dryfującej łodzi. Wkrótce spotykają jego matkę. ",drama
hierro,Podczas wakacji na odludnej wyspie znika syn Marii. Pozostawiona sama sobie kobieta rozpoczyna własne śledztwo. ,thriller
the maker,"Dziwne stworzenie rozpoczyna wyścig z czasem, aby stworzyć najważniejsze i najpiękniejsze dzieło swojego życia.",animation
looney tunes: back in action,Bezrobotny Kaczor Daffy razem z ochroniarzem DJ Drake’m wyrusza na poszukiwania jego uprowadzonego ojca. ,family
the order,"Młody ksiądz zostaje wysłany do Rzymu, gdzie bada tajemniczą śmierć zwierzchnika swojego zakonu. ",horror
the one,"Przemierzając różne wymiary czasoprzestrzenne i zabijając swoje alter ego, Gabriel trafia na godnego siebie przeciwnika, policjanta Gabe'a. ",action
get on up,"Droga na szczyt sławy Jamesa Browna, który pomimo ubóstwa i przeciwności losu staje się jednym z najbardziej wpływowych muzyków w historii. ",biography
ikar. legenda mietka kosza,Wbrew wszelkim przeciwnościom losu i własnym ograniczeniom Mietek Kosz zostaje wirtuozem fortepianu. Jednak okrzykniętemu geniuszem chłopakowi oszałamiająca kariera nie daje szczęścia.,biography
voksne mennesker," Daniel jest zwariowanym artystą, żyjącym z dnia na dzień, nie przejmującym się problemami i nie do końca przystosowanym do życia w społeczeństwie... Jednak, gdy poznaje... ",drama
blackkklansman,"Dwóch detektywów przenika do struktur Ku Klux Klanu, aby uniemożliwić jej członkom przejęcie władzy w Colorado Springs.",biography
copycat,Specjalistka zajmująca się psychiką seryjnych morderców pomaga policjantce w śledztwie. ,thriller
i saw the light,"Historia życia i kariera przedwcześnie zmarłego gwiazdora muzyki country, który tłumi rozmaitymi używkami ból kręgosłupa.",biography
the negotiator,"Policyjny negocjator zostaje oskarżony o zabójstwo kolegi. Mężczyzna chcąc dowieść swojej niewinności, sam bierze zakładników. ",crime
robin hood,"Robin z Loxley wraca z wyprawy krzyżowej i zastaje majątek splądrowany, a ukochaną Marion zamężną. Żądny zemsty postanawia stanąć w obronie uciśnionych mieszkańców Nottingham.",adventure
fun size,W trakcie imprezy Halloween nastolatka gubi młodszego brata. Musi go odnaleźć nim o zaginięciu dowie się matka. ,comedy
kret,"Paweł rozkręca wraz z ojcem wspólny interes. Wszystko&nbsp;układa się pomyślnie do momentu, kiedy powstaje artykuł godzący w dobre&nbsp;imię rodziny.",thriller
savages,"Kiedy Ben i Chon – plantatorzy marihuany – odmawiają współpracy z członkami meksykańskiego kartelu, ci porywają ich wspólną dziewczynę, Ophelię.",crime
les fils du vent,"Yamakasi wyjeżdżają do Bangkoku, gdzie spotykają konkurencyjną grupę, z którą popadają w konflikt.",adventure
puss in boots: the last wish,"Kot w Butach wyrusza w podróż, aby odnaleźć mityczne ""Ostatnie Życzenie"", dzięki któremu odzyska swoje dziewięć żyć.",animation
the son of bigfoot,"Nastoletni Adam wyrusza w poszukiwaniu swojego ojca. Podczas swojej wyprawy dowiaduje się, że jest potomkiem Yeti.",animation
more,"Szary pracownik fabryki tworzy okulary, dzięki którym świat wydaje się piękniejszy. ",short
liu lang di qiu,"Słońce w ciągu 20 lat zamieni się w czerwonego olbrzyma, co doprowadzi do unicestwienia Układu Słonecznego.&nbsp;Ludzkość przygotowuje się do podróży Ziemi do układu Alfa Centauri.",sci-fi
kochaj,"Sawa wkrótce bierze ślub z Jurkiem. Sytuacja się komplikuje, gdy poznaje przystojnego aktora - Krzysztofa.",comedy
jackass: number two, Ostrzeżenie: Ukazane w filmie pokazy i sztuczki kaskaderskie zostały wykonane przez profesjonalistów. Nie próbujcie naśladować ich w domu i na zewnątrz. Zapomnijcie o... ,documentary
thumbelina,"Kobieta otrzymuje od wróżki&nbsp; nasionka kwiatu, z którego wnętrza wychodzi dziewczynka. ",animation
traitor,Agenci FBI prowadzą śledztwo w sprawie ataków terrorystycznych. Wszystkie ślady prowadzą do byłego agenta służb specjalnych. ,thriller
venom: let there be carnage,"Eddie Brock próbuje zrobić karierę przeprowadzając wywiad z seryjnym mordercą, który nieoczekiwanie zdobywa moce symbionta. ",action
paranormal activity: the ghost dimension,"Po przeprowadzce do nowego domu, rodzina odnajduje kasety wideo i kamerę nagrywającą zjawiska paranormalne.",horror
maniac,Mark - cichy i niepozorny konserwator manekinów oferuje pomoc artystce przygotowującej własną wystawę.,horror
my dinner with andre," Film jest dwugodzinną rozmową, jaką toczy między dwójką zaprzyjaźnionych artystów, Wallace Shawn i Andre Gregory. Bohaterowie spotykają się na eleganckim obiedzie, w... ",biography
crazy/beautiful,Córka kongresmena poznaje ubogiego chłopaka z latynoskiej rodziny. Ich znajomość nie podoba się rodzicom dziewczyny. ,romance
ford v ferrari,Na zlecenie Henry'ego Forda II amerykański projektant Carroll Shelby i brytyjski kierowca Ken Miles podejmują wyzwanie pokonania samochodów ekipy&nbsp;Ferrari w 24-godzinnym wyścigu Le Mans.,biography
the great hack,Po&nbsp;wyborach prezydenckich w&nbsp;USA w&nbsp;2016&nbsp;r. firma Cambridge Analytica stała się symbolem ciemnej strony mediów społecznościowych.,documentary
pearl jam twenty,Dokument przedstawia historię zespołu Pearl Jam ukazując wiele nieznanych do tej pory faktów.,documentary
los abrazos rotos,"Opętany miłością milioner zrobi wszystko, by zatrzymać przy sobie ukochaną. Kobieta czuje do niego jedynie wdzięczność i w tajemnicy spotyka się z innym mężczyzną.",thriller
2001: a space odyssey,"Film dzieli się na trzy epizody, których akcja ma miejsce w różnych okresach historycznych i zakątkach wszechświata. ",sci-fi
d.e.b.s.,"Cztery agentki obdarzone wyjątkowymi umiejętnościami otrzymują swoje pierwsze zadanie, jakim jest schwytanie przebiegłej szefowej mafii.",action
blue," Ostatni film Dereka Jarmana, zmarłego w 1994 roku, został uznany za jedno z najbardziej kontrowersyjnych dzieł w historii filmu. ""Blue"" jest filmem, który składa się z... ",documentary
man on wire,Philippe Petit w 1974 roku przechodzi po linie rozciągniętej między zbudowanymi wówczas bliźniaczymi wieżami World Trade Center. Po latach francuski artysta wspomina ryzykowne przedsięwzięcie. ,biography
dobermann,"Policja przygotowuje pułapkę na gangsterów, którzy obrabowali paryski bank. ",crime
saw ii,"FBI znajduje kryjówkę Jigsawa, jednak nowa gra już się rozpoczęła.",horror
heat,Zawodowy przestępca Neil McCauley organizuje zbrojny napad na opancerzoną furgonetkę. Śledztwo w tej sprawie prowadzi Vincent Hanna.,thriller
the golden compass,"Posiadaczka złotego kompasu - Lyra z pomocą Lorda Asriela, pancernego niedźwiedzia i grupki sprzymierzeńców stara się pokrzyżować diaboliczne plany Pani Coulter.",fantasy
9,"Szmaciana lalka walczy z potworem, aby pomścić swego towarzysza.&nbsp;",sci-fi
voyage of time,Historia wszechświata od narodzin do ostatecznego upadku. ,documentary
ninja: shadow of a tear,"Kiedy zamordowana zostaje ciężarna żona Caseya, mistrz ninjitsu poprzysięga zemstę i wyrusza do Tajlandii, by wytropić zabójcę ukochanej. ",action
free willy 2: the adventure home,"W pobliżu zatoki dochodzi do wycieku ropy z uszkodzonego tankowca, co stanowi zagrożenie dla żyjących tam zwierząt. Jesse zatroskany jest o los zaprzyjaźnionej orki.",family
popstar: never stop never stopping,"Po nieudanej premierze solowego albumu były członek boys bandu robi wszystko, aby utrzymać status celebryty.",comedy
a quiet place,"Pięcioosobowa rodzina stara się przetrwać w świecie pełnym potworów, które stanowią śmiertelne niebezpieczeństwo, a zwabia je najmniejszy hałas.",horror
look whos talking now,"Mollie zostaje zwolniona, a James zaczyna pracę jako prywatny pilot atrakcyjnej bizneswoman. Dodatkowo ich rodzina powiększa się o dwa psy.",family
thick as thieves,"Przed zakończeniem kariery nowojorski złodziej, Keith, planuje ostatni skok, aby spłacić dług u rosyjskiej mafii. ",crime
fantasia/2000,"Zbiór animacji ze studia Disneya ilustruje utwory Beethovena, Gershwina, Strawińskiego oraz innych wielkich kompozytorów.",animation
arctic blast,Grupa meteorologów próbuje zapobiec globalnej katastrofie wywołanej przez olbrzymią dziurę w warstwie ozonowej Ziemi.,sci-fi
sightless,"Po ataku niewidoma Ellen dostaje mieszkanie oraz prywatnego opiekuna, który ma pomóc z wdrożeniem do nowej rzeczywistości. Ta zaczyna ją niepokoić, gdy przyjaciółka i brat nie odbierają telefonów, a do apartamentu ktoś się włamuje.",thriller
ghost busters,Trzech doktorów parapsychologii zakłada firmę zajmującą się zwalczaniem duchów. Wkrótce będą musieli zmierzyć się z pradawną złą mocą opanowującą miasto.,horror
shi gan,"Obsesyjnie zazdrosna Seh-hee porzuca bez słowa swojego chłopaka. Po przeprowadzeniu operacji plastycznej ponownie zjawia się w życiu mężczyzny, ale jako inna osoba.",drama
divergent,"Przyszłość, w której społeczność składa się z pięciu frakcji na podstawie cech charakteru. Nastoletnia Tris zostaje przydzielona do kilku partii i uznana za zagrożenie. ",action
the funeral,"Gangster Johnny zostaje zastrzelony przez nieznanego sprawcę. Mimo braku pewności co do tożsamości zabójcy, jego dwaj starsi bracia poprzysięgają zemstę.",drama
the drop,"Barman znajduje w śmietniku pit bulla, którego postanawia przygarnąć. Wkrótce pojawia się właściciel psa. ",drama
escape room: tournament of champions,"Sześć osób nieświadomie zostaje zamknięte escape roomie, gdzie łączą siły z dwiema osobami, którym udało się wyjść wcześniej. ",horror
the last days on mars,Podczas zbierania próbek na Marsie członek załogi bazy Tantalus odkrywa dowód bakteryjnego życia. ,horror
eagle vs shark,Jarrod i Lily to osoby dość aspołeczne. Pewnego dnia spotykają się na imprezie przebrani za ulubione zwierzęta: orła oraz rekina.,comedy
maximum risk,"Francuski policjant szuka mordercy brata bliźniaka - członka rosyjskiej mafii. W tym celu przejmuje tożsamość zmarłego i rusza do Nowego Jorku, by wyjaśnić zagadkę jego śmierci. ",action
open season,Żyjący w mieście niedźwiedź Boguś zostaje wysłany do lasu. ,animation
breaking the waves,"Sparaliżowany Jan zwalnia swoją żonę Bess z przysięgi wierności i chce, by ta kochała się z innymi mężczyznami. Kobieta spełnia jego prośbę. ",drama
pinocchio,"Stolarz Gepetto, pewnego dnia, z kawałka drewna tworzy postać chłopca. Figurka ożywa, zaczyna ruszać się i mówić. ",fantasy
los ojos de julia,Julia stara się rozwikłać tajemnicę śmierci swojej siostry bliźniaczki. ,thriller
popek za zycia,"Dokument przedstawia polskiego rapera Pawła ""Popka"" Mikołajuwa, który jest bożyszczem nastolatków, jego życie prywatne, jak i również zawodowe. ",documentary
upgrade,"Sparaliżowany Grey poddaje się nowatorskiemu zabiegowi, aby o własnych siłach odnaleźć zabójców swojej żony. ",action
the disappeared,"Brat zaginionego chłopca próbuje wrócić do normalnego życia, jednak przeszłość nie daje mu spokoju. ",horror
blackhat,Amerykańskie oraz chińskie siły specjalne pracują wspólnie nad sprawą piractwa komputerowego na dużą skalę. ,crime
north country,Zatrudnione w kopalni kobiety są molestowane przez męską załogę. Josey kieruje sprawę do sądu. ,drama
kung fu panda 2,"Panda Po wreszcie został mistrzem sztuk walki. Ale zbliża się groźny wojownik, który planuje podbić Chiny i zniszczyć sztukę kung-fu.",animation
movie 43,"Uczniowie przeszukują Internet, by znaleźć tajemniczy film. W ten sposób odkrywają jedenaście krótkich, komediowych historii z różną fabułą.",comedy
sgt. bilko,"Sierżant Bilko dorabia do żołdu prowadząc gry hazardowe. Gdy na inspekcję do koszar przybywa jego dawny rywal, on i podwładni robią wszystko, by ich nielegalne występki nie ujrzały światła dziennego. ",comedy
before the flood,Dokument o wpływie zmian klimatycznych na środowisko.,documentary
paranormal activity,"Młoda para sądzi, że jest prześladowana przez demona. Kamera rejestrująca sytuację podczas ich snu ma im pomóc wyjaśnić tę zagadkę.",horror
sin noticias de dios,"Niebo i Piekło, przy pomocy swoich kuszących wysłanniczek, rywalizują o duszę boksera.",fantasy
sahara,Dirk Pitt trafia na ślad legendarnego skarbu z czasów wojny secesyjnej ukrytego gdzieś wśród piasków pustyni Sahary. W poszukiwaniach pomagają mu przyjaciel Al oraz doktor Eva Rojas.,adventure
excalibur,Artur zostaje królem Brytanii i staje na czele Rycerzy Okrągłego Stołu. Intrygi przeciwko nowemu władcy knuje jego własna siostra Morgana.,fantasy
harry potter and the deathly hallows: part 1,"Harry, Ron i Hermiona wyruszają odnaleźć horkruksy, dzięki którym Voldemort zapewnił sobie nieśmiertelność. Muszą je wszystkie zniszczyć, by go pokonać.&nbsp;",family
drive angry,"Milton ucieka z piekła, by uratować wnuczkę z rąk niebezpiecznej sekty odpowiedzialnej za śmierć jego córki. ",fantasy
"mcfarland, usa",Trener lekkoatletyki prowadzi sportowców z małej kalifornijskiej miejscowości do&nbsp; występów w krajowych mistrzostwach. ,biography
a hidden life,Podczas II wojny światowej Austriak Franz Jägerstätter odmawia walki w szeregach niemieckiej armii. ,biography
the theory of everything,"Film opowiada historię genialnego naukowca Stephena Hawkinga - rozwoju jego choroby, rodzącego się uczucia do Jane, a w końcu rozpadu ich małżeństwa. ",biography
horton hears a who!,"Słoń Horton jako jedyny słyszy mieszkańców mikroskopijnego miasta Ktosiowa. Jego przyjaciele są przekonani, że zwariował. ",animation
date and switch,Michael i Matty pragną stać się mężczyznami jeszcze przed studniówką. Jednak w oczach koleżanek nie są atrakcyjni. ,comedy
hotel rwanda,W 1994 roku dyrektor hotelu udziela schronienia uchodźcom podczas krwawych walk plemiennych o dominację w Ruandzie. ,biography
evita,"Historia życia Evy Peron, kobiety wywodzącej się z biedoty, która została pierwszą damą Argentyny u boku Juana Perona.",biography
prince of darkness,"Profesor i grupa studentów przyjeżdżają do starego kościoła, żeby zbadać tajemnicę starożytnego pojemnika z zieloną cieczą. Niebawem budzi się uwięzione w nim zło.",horror
real steel,"Charlie, zajmujący się organizowaniem nielegalnych bitew robotów, odkrywa, że ma 11-letniego syna. Chłopak przekonuje ojca do wzięcia udziału w mistrzostwach walk cyborgów. ",action
house of 1000 corpses," Grupa młodych ludzi podróżuje przez kraj. Gdy pośrodku pustkowia, w trakcie burzy, psuje się ich samochód, są zmuszeni do opuszczenia auta i szukania schronienia.... ",horror
six bullets,"Były najemnik zostaje wynajęty, by odnaleźć porwaną córkę mistrza mieszanych sztuk walki.",crime
youngblood,"Dean Youngblood, utalentowany, młody hokeista próbuje swoich sił w zawodowej lidze. ",drama
secret window,"Uznany pisarz przenosi się na prowincję, by w spokoju tworzyć kolejne książki. Wkrótce odwiedzi go tajemniczy mężczyzna, który oskarży Raineya o plagiat.",thriller
gerry,Gerry i Gerry wyruszają na wycieczkę. Zagubieni na pustyni walczą o przetrwanie. ,drama
colectiv,"Dziennikarze śledczy odkrywają masowe oszustwa w rumuńskim systemie opieki zdrowotnej, ujawniając tym samym skalę istniejącej korupcji.",documentary
kinematograf,"Szalony geniusz poświęca się konstruowaniu wynalazku, którym chce zmienić świat, ignorując schorowaną&nbsp;żonę.",animation
basn o ludziach stad," Film wyprodukowany przez niezależną zielonogórską Wytwórnię A'YoY. ""Baśń o ludziach stąd"", w reżyserii i według scenariusza Władysława Sikory, współzałożyciela i lidera... ",comedy
attack the block,"Na Londyn spada meteoryt, a wraz z nim drapieżni kosmici. Obrony swojej dzielnicy podejmuje się szajka młodocianych przestępców.&nbsp;",comedy
the longest ride,"Losy dwóch par, które dzielą lata doświadczeń. Ich historie zbiegają się w nieoczekiwanym momencie. ",drama
planes,Cierpiący na lęk wysokości mały samolot rolniczy marzy o wystartowaniu w największym w historii wyścigu powietrznym dookoła świata. ,animation
nuit et brouillard," ""Noc i mgła"" to jeden pierwszych filmów dokumentalnych poświęconych obozom śmierci w nazistowskich Niemczech. Alain Resnais łączy w nim archiwalne nagrania wykonane w... ",documentary
encanto,"Dziewczynka pochodzi z kolumbijskiej rodziny, która obdarzona jest magicznymi mocami. Niestety ona sama nie posiada tego daru. ",animation
yogi bear," Film opowiada o mieszkających w Parku Jellystone niedźwiedziach - Yogim i jego przyjacielu Boo Boo. Pewnego dnia do parku przybywa reporterka (Anna Faris), która staje... ",family
jurassic world: dominion,nr 2,adventure
the death and life of bobby z,"Pomagając agentowi DEA, więzień Tim Kearney przybiera tożsamość zmarłego bossa narkotykowej mafii, Bobbiego Z. ",thriller
goodbye christopher robin," A.A. Milne wraz z żoną i synem przeprowadza się na wieś, gdzie tworzy powieść o Kubusiu Puchatku. ",biography
red,"Emerytowani agenci specjalni CIA zostają wrobieni w zamach. By się ratować, muszą reaktywować stary zespół.",comedy
honeymoon,Nowożeńcy spędzają miesiąc miodowy nad jeziorem. W nocy mąż znajduje żonę zdezorientowaną i błąkającą się po lesie. ,horror
rush hour,Do Los Angeles przylatuje detektyw Lee. Wspólnie z miejscowym policjantem Carterem mają uwolnić porwaną córkę chińskiego konsula.,action
stealth,"Trójka pilotów ma przetestować najnowocześniejszy samolot, sterowany przez sztuczną inteligencję. W czasie próbnego lotu komputer ulega awarii i wymyka się spod kontroli. ",action
the proposition,"Kiedy bracia Charlie i Mike Burns zostają schwytani przez policję, kapitan Stanley składa starszemu z nich propozycję.",western
hit and run," Były przestępca, Charlie Bronson (Dax Shepard), objęty programem ochrony świadków postanawia zaryzykować wszystko i pomóc swojej dziewczynie Annie (Kristen Bell) w... ",action
max manus,"Po zajęciu Norwegii przez III Rzeszę, Max Manus wstępuje w szeregi ruchu oporu.",biography
the sword in the stone,"Mądry czarnoksiężnik uczy młodego Artura, jak być dobrym i sprawiedliwym królem. ",animation
rising sun,Dwaj detektywi prowadzą śledztwo dotyczące morderstwa prostytutki w jednej z japońskich firm. ,crime
enola holmes,"W dniu swych szesnastych urodzin Enola Holmes odkrywa, że jej matka zniknęła. Nastolatka trafia pod opiekę swoich starszych braci: Sherlocka i Mycrofta.",crime
facet potrzebny od zaraz,Młoda singielka postanawia odszukać swoich byłych partnerów i ponownie się z nimi spotkać.,comedy
julius caesar," Adaptacja sztuki Williama Szekspira. Opowiada o spisku jaki zawiązał Brutus i Cassius, który miał na celu zabicie Cezara i przejęcie władzy. Jednakże w swoich planach nie... ",drama
dance of the vampires,Znawca wampirów Abronsius i jego asystent Alfred muszą stawić czoła krwiopijczemu hrabiemu von Krolockowi.,horror
