title,description,genre
torque,"Motocyklista Cary powraca do miasta, by rozwiązać niedokończone sprawy. Zostaje wplątany w intrygę uknutą przez dawnego wroga.",action
insurgent,"Beatrice Prior konfrontuje się z wewnętrznymi demonami i kontynuuje walkę przeciwko ogromnemu sojuszowi, który może spowodować rozpad społeczeństwa.",action
divergent,"Przyszłość, w której społeczność składa się z pięciu frakcji na podstawie cech charakteru. Nastoletnia Tris zostaje przydzielona do kilku partii i uznana za zagrożenie. ",action
x-men: days of future past,"Bezlitośnie tropieni przez Strażników mutanci wysyłają Wolverina do 1973 roku. Aby próba zmiany historii się powiodła, skonfrontowani ze sobą młodzi Charles Xavier i Magneto muszą nawiązać współpracę. ",action
renegades,Siły specjalne amerykańskiej marynarki odkrywają skarb znajdujący się na dnie bośniackiego jeziora. ,action
elysium,"Garstka wybrańców żyje na luksusowej stacji orbitalnej, a reszta ludzi w przeludnionych miastach zdewastowanej Ziemi. Max, mieszkaniec planety, próbuje walczyć z niesprawiedliwym podziałem. ",action
sniper,Zawodowy snajper oraz niedoświadczony rekrut dostają zadanie zabicia panamskiego bossa narkotykowego.,action
hard target,"Bezrobotny marynarz, pomagając kobiecie w poszukiwaniu jej ojca, naraża się grupie przestępczej organizującej śmiertelne polowania na ludzi.&nbsp;",action
birds of prey (and the fantabulous emancipation of one harley quinn),"Harley Quinn, Czarny Kanarek, Łowczyni oraz Renee Montoya łączą siły w walce z Romanem Sionisem i Victorem Zsaszem. ",action
dragon ball z 9: ginga girigiri!! butchigiri no sugoi yatsu,"Gohan, Vegeta oraz Trunks w czasie nieobecności Goku, walczą z Bojackiem i jego pomocnikami.",action
pacific rim,Świat nie umie obronić się przed morskimi potworami z&nbsp;innego wymiaru. Ostatnią nadzieją naszej planety stają się wydalony ze&nbsp;służby pilot i&nbsp;niedoszkolona nowicjuszka.,action
bullet train,"Pięcioro zabójców, znajdujących się w szybkim pociągu jadącym z Tokio do Morioki, odkrywa, że ich zlecenia są ze sobą wzajemnie powiązane. Powstaje pytanie, kto wyjdzie z pociągu żywy i co ich czeka na stacji końcowej.",action
the suicide squad,"Oddział skazańców zostaje wysłany na wyspę Corto Maltese, gdzie mają wykonać samobójczą misję zniszczenia laboratorium Jötunheim.",action
machete kills in space,"Voz ucieka w przestrzeń kosmiczną po próbie rozpoczęcia wojny nuklearnej na Ziemi. Jest tylko jeden człowiek godny zaufania prezydenta, który może go zdjąć: Machete. ",action
soldier,"Po odniesieniu ciężkich ran w pojedynku z przedstawicielem nowej generacji super żołnierzy sierżant Todd zostaje wyrzucony na wysypisko śmieci na obcej planecie, gdzie przygarnia go grupa rozbitków. ",action
raising arizona,"Kiedy bezdzietne małżeństwo porywa dziecko, ich życie staje się bardziej skomplikowane, niż przewidywali.",action
rambo: first blood part ii,"John Rambo, w zamian za wyjście z więzienia, zgadza się na odszukanie amerykańskich jeńców wojennych przetrzymywanych na terenie Wietnamu.",action
skyline,"Kiedy nad Los Angeles pojawiają się dziwne niebieskie światła, zaczynają znikać mieszkańcy. Ocalałym pozostaje walka o życie z obcymi.",action
banlieue 13: ultimatum,Władze Paryża decydują się wysadzić w powietrze 13 dzielnicę zamieszkałą przez przestępców. Leito i Damien postanawiają temu zapobiec.,action
superman ii,"Na Ziemię przybywa troje złowrogo nastawionych Kryptonian, których celem jest podbój planety. Ich plany próbuje pokrzyżować Superman.",action
kiss kiss bang bang,Po nieudanym napadzie niezdarny złodziej Harry Lockhart trafia przez przypadek na casting do filmu sensacyjnego. Wkrótce zostaje wplątany w morderstwo młodej kobiety.,action
wanted,"Sfrustrowany pracownik biura dostaje szansę na lepsze życie. Decyduje się dołączyć do bractwa elitarnych zabójców, którego członkiem był jego zaginiony ojciec.",action
diablo. wyscig o wszystko,"Siostra Kuby zapada na ciężką chorobę. Chłopak, aby zdobyć pieniądze na jej leczenie, postanawia wziąć udział w nielegalnych wyścigach samochodowych. ",action
commando,"John Matrix, były żołnierz oddziałów specjalnych, rozpoczyna prywatną wojnę przeciwko ludziom, którzy porwali jego córkę.",action
the new mutants,"Pięcioro młodych mutantów, trzymanych w sekretnym ośrodku wbrew ich woli, przebudza swoje zdolności i walczy, by uciec od grzechów przeszłości. ",action
godzilla,"Najsłynniejszy potwór w historii mierzy się z wrogimi stworami, które, wzmocnione przez arogancję i nieświadomość naukowców, zagrażają ludzkości. ",action
the flash,W wyniku niezwykłego zdarzenia Barry Allen zyskuje zdolność przemieszczania się z niezwykłą szybkością i pod pseudonimem staje na straży Central City. ,action
the expendables 3,"Niezniszczalni mierzą się ze starym przyjacielem oraz założycielem ekipy, który zszedł na złą drogę. Teraz&nbsp;pragnie on zemsty&nbsp;oraz zniszczenia&nbsp;swoich byłych towarzyszy.",action
ninja,Trenujący ninjitsu Amerykanin dostaje od swojego mistrza zadanie ochrony skrzyni z legendarną bronią ninja.,action
sap ji sang ciu," Asian Hawn (Jackie Chan) jest najemnikiem i jednocześnie liderem grupy, której zadaniem jest odnalezienie artefaktów zagrabionych przez brytyjskich i francuskich... ",action
turbo kid,"Młody chłopiec transformuje się w superbohatera, aby odbić swoją przyjaciółkę Apple z rąk samozwańczego władcy Zeusa. ",action
godzilla,"Ogromny, zmutowany gad pojawia się u wybrzeży Nowego Jorku i sieje postrach na Manhattanie. ",action
hell ride,Wódz bezwzględnego gangu motocyklowego poprzysiągł zemstę przywódcy innej bandy.,action
power rangers,"Uczniowie szkoły średniej wykorzystują swoje unikalne zdolności, by uratować świat. ",action
the losers,Grupa komandosów sił specjalnych zostaje zdradzona przez mocodawców. Uznani za zmarłych żołnierze chcą za wszelką cenę dokonać zemsty i oczyścić dobre imię.,action
mr. &amp; mrs. smith,Para płatnych zabójców pracujących dla dwóch tajnych agencji wiedzie monotonne małżeńskie życie. Niespodziewanie dostają zlecenie na siebie nawzajem.,action
terminator genisys,"Rok 2029. Walczący z cyborgami John Connor wysyła w przeszłość Kyle'a Reese'a, by uratował jego matkę przed terminatorem.",action
battle: los angeles,"Dowodzony przez sierżanta Nantza oddział żołnierzy piechoty morskiej broni Los Angeles przed kosmicznymi najeźdźcami, którzy pragną unicestwić ludzkość. ",action
smokin aces,"Gdy artysta z Las Vegas postanawia zeznawać przeciwko mafii, pojawia się wielu wrogów, którzy gotowi są go uciszyć.",action
terminator 3: rise of the machines,"T-800 zostaje wysłany w przeszłość, by chronić Johna Connora i jego przyjaciółkę Kate Brewster. Ich przeciwnikiem jest cyborg T-X. ",action
sweet girl,"Mąż przysięga wymierzyć sprawiedliwość ludziom odpowiedzialnym za&nbsp;śmierć jego żony. Musi przy tym chronić córkę - jedyną bliską osobę, która mu pozostała.",action
the italian job," Charlie Croker to szykowny rabuś i uwodziciel, który dopiero co opuścił więzienie. Aby uniknąć kary za recydywę, swój nowy skok chce zorganizować za granicą, we Włoszech.... ",action
crank: high voltage,"Chev Chelios zostaje zoperowany w wyniku czego lekarze wszczepiają mu sztuczne serce. Aby przetrwać, mężczyzna musi doładowywać się prądem. ",action
the wolverine,"Logan zakochuje się w córce japońskiego mafiosa, który nasyła na niego armię bezwzględnych zabójców.",action
captain america: civil war,"ONZ wprowadza przymusowy rejestr bohaterów, który doprowadza do konfliktu pomiędzy Kapitanem Ameryką a Iron Manem. Sytuację komplikuje zamach na króla Wakandy.",action
aquaman,"Arthur Curry niechętnie stara się przejąć władzę w podwodnym królestwie Atlantydy, żeby zapobiec wojnie z ludźmi żyjącymi na powierzchni.",action
outcast,"Kiedy następca tronu staje się celem zamachu starszego brata, do pomocy rusza legendarny wojownik. ",action
batman returns,"Gotham zagraża obłąkany Pingwin, który łączy siły z potentatem przemysłowym Maxem Shreckiem oraz Kobietą-Kotem. Jedynie Batman może ich powstrzymać. ",action
terminator: dark fate,"Sarah Connor powraca, aby chronić dziewczynę imieniem Dani przed nowym Terminatorem Rev-9. ",action
6 underground,Szóstka niezastąpionych mistrzów swojego fachu została wybrana do wypełnienia ważnej misji – zmienienia świata na lepsze.,action
avp: alien vs. predator,Członkowie ekipy badawczej trafiają w środek wojny niebezpiecznych przedstawicieli dwóch wrogich ras. ,action
doomsday,"Kiedy śmiercionośny wirus pustoszy Wielką Brytanię, major Eden Sinclair wraz z załogą wyrusza na poszukiwanie lekarstwa.",action
gotham city sirens,"Trzy najbardziej znane przestępczynie w mieście Gotham - Harley Quinn, Kobieta-Kot i Trujący Bluszcz - łączą swoje siły, aby wykonać niebezpieczną misję.",action
street fighter: the legend of chun-li,"Chun-Li naraża swoje życie, by odbić ojca z rąk bezwzględnych bandytów. ",action
transformers: dark of the moon,"Autoboty muszą obronić Ziemię przed Decepticonami, którzy przygotowują się do podbicia planety. ",action
eraser,"Śledczy John Kruger musi chronić swoją klientkę, która odkryła poważny spisek w kręgach władzy. ",action
captain marvel,Ziemska kobieta po kontakcie z obcą rasą Kree otrzymuje nadludzkie moce.,action
the anomaly,"Były żołnierz Ryan budzi się na tyłach furgonetki obok porwanego chłopca. Mężczyzna ma zaledwie 9 minut i 47 sekund, by odkryć prawdę. ",action
bumblebee,"Autobot Bumblebee uciekając z Cybertronu dociera na Ziemię, gdzie poznaje nastoletnią Charlie. ",action
suicide squad,Amanda Waller na polecenie rządu USA tworzy drużynę składającą się z przestępców.,action
batman,"Tajemniczy mściciel pojawia się na ulicach Gotham, aby podjąć walkę z przestępcami. Pomaga mu w tym znana dziennikarka Vicki Vale.",action
the matrix reloaded,Maszyny chcą zniszczyć Syjon. Neo wyrusza z misją ocalenia ostatniego miasta ludzi. ,action
pacific rim: uprising,"Jake porzuca kryminalne podziemie i jedna się z siostrą, aby uratować Ziemię przed kolejną inwazją Kaiju.",action
upgrade,"Sparaliżowany Grey poddaje się nowatorskiemu zabiegowi, aby o własnych siłach odnaleźć zabójców swojej żony. ",action
bloodshot,Zmarły podczas akcji żołnierz powraca do życia jako Bloodshot.,action
dark phoenix,"Kiedy Jean Gray zostaje uderzona przez tajemniczą kosmiczną siłę, która przemienia ją w kultową Dark Pheonix, X-Men musi się zjednoczyć, aby stawić czoła swojemu najbardziej niszczycielskiemu wrogowi - jednemu z nich.",action
godzilla vs. kong,"Król Potworów z nieznanych przyczyn zaczyna siać spustoszenie na całym globie. W obliczu zagrożenia, grupa ludzi postanawia przeciwstawić mu mitycznego Konga.",action
avengers: endgame,"Po wymazaniu połowy życia we Wszechświecie przez Thanosa Avengersi starają się zrobić wszystko, co konieczne, aby pokonać szalonego tytana. ",action
the batman,Batman i James Gordon stawiają czoła nieobliczalnemu Człowiekowi-Zagadce w skorumpowanym Gotham City.,action
mile 22,Agent elitarnej jednostki CIA otrzymuje zadanie przejęcia ważnego informatora i przewiezienia go przez 22 mile niebezpiecznego terytorium. ,action
gemini man,"Elitarny zabójca zostaje zaatakowany przez młodego mężczyznę, który potrafi przewidzieć każdy jego ruch. ",action
metropolis,"Detektyw i jego bratanek muszą rozwikłać zagadkę tajemniczego robota, dziewczyny o imieniu Tima. ",action
fast five,"Grupa kierowców naraża się niebezpiecznemu gangsterowi, organizuje ryzykowny napad i musi wymknąć się ścigającemu ich nieustępliwemu agentowi.",action
the incredible hulk,"Od czasu napromieniowania Bruce szuka antidotum, które pozwoli mu zachować ludzkie ciało. Na jego drodze staje amerykański generał i brytyjski superżołnierz.",action
are we there yet?," Gdy Nick (Ice Cube) zakochuje się w Suzanne (Nia Long), która jest samotną matką, początkowo nie przejmuje się tym, co myślą o nim jej dzieci. Poza tym Suzanne uważa, że... ",family
charlie and the chocolate factory,"Ubogi Charlie Bucket znajduje jeden z pięciu złotych biletów, który umożliwia mu zwiedzenie ogromnej fabryki czekolady.",family
max,"Po powrocie z misji, pies służący pomocą żołnierzom w Afganistanie zostaje zaadoptowany przez rodzinę swojego tresera. ",family
stuart little,"Państwo Malutcy, pragnąc adoptować dziecko, odwiedzają sierociniec. Na miejscu spotykają małą mysz o imieniu Stuart, którą postanawiają zabrać do domu. ",family
the spy next door," Opowiedziana z wielkim rozmachem, pełna nieoczekiwanych zwrotów akcji komedia sensacyjna z szalonym Jackie Chanem to doskonała rozrywka dla całej rodziny. ",family
the flintstones in viva rock vegas,"Po zdaniu końcowego egzaminu Fred i Barney dostają dobrze płatną pracę w kamieniołomach. By uczcić sukces, udają się do Bedrock, gdzie poznają wymarzone dziewczyny.",family
my girl 2,"Nastoletnia Vada wyjeżdża do Los Angeles, by dowiedzieć się więcej o zmarłej matce, której nie zdążyła poznać.",family
harvey,"Elwood P. Dowd jest miłym, dobrze wychowanym człowiekiem, który spotyka się ze swoim niewidzialnym przyjacielem, wysokim na 6 stóp królikiem. Jego rodzina zaczyna się tym niepokoić. ",family
harry potter and the half-blood prince,"Harry, by ostatecznie pokonać Voldemorta, musi poznać jego przeszłość. ",family
mary poppins,Posiadająca magiczne moce guwernantka bierze pod swoje skrzydła dwójkę dzieci. ,family
beverly hills chihuahua,"Rozpieszczony piesek Chloe wyrusza w podróż do Meksyku. Gdy gubi swoją opiekunkę, zostaje zdany na siebie.",family
high school musical 2,"Rok szkolny dobiega końca i uczniowie East High udają się na wakacje. Część z nich podejmuje sezonową pracę w hotelu, gdzie rokrocznie odbywa się konkurs talentów.",family
sky high,Will rozpoczyna naukę w szkole dla superbohaterów. Z powodu nieprzejawiania żadnych mocy trafia do najsłabszej klasy.,family
muppets most wanted,Podczas światowego tournée Muppety zostają wplątane w międzynarodową aferę kryminalną. Stoi za nią Constantine – znany złodziej diamentów i sobowtór Kermita.,family
le petit nicolas,"Mikołajek podejrzewa narodziny młodszego braciszka. W obawie przed porzuceniem, postanawia opracować plan pozbycia się niemowlaka.",family
"belle et sebastien, laventure continue","Gdy Sebastian dowiaduje się, że awionetka z jego przyjaciółką zaginęła, wyrusza na poszukiwania. Towarzyszy mu nieodłączny pies - Bella. ",family
little manhattan,"Kiedy 11-letni Gabe zakochuje się w byłej koleżance z przedszkola, musi nie tylko poradzić sobie z nieznanym dotąd uczuciem, ale i rozwodem rodziców. ",family
asterix &amp; obelix: mission cleopatre,"Asterix, Obelix i Panoramix wyruszają do Egiptu, by pomóc architektowi Numernabisowi. Ma on zaledwie trzy miesiące na wybudowanie pałacu dla Kleopatry. ",family
7 zwerge,"W lesie, gdzie żyją tytułowe krasnoludki zjawia się Królewna Śnieżka. Gdy dziewczyna zostaje porwana, mężczyźni postanawiają ją odnaleźć. ",family
tomorrowland,"Rozczarowany życiem Frank oraz inteligentna nastolatka Casey wyruszają na niebezpieczną misję, której celem jest odkrycie tajemnicy miejsca zagubionego w czasie i przestrzeni.",family
the mighty ducks,Młody prawnik zostaje skazany za jazdę pod wpływem alkoholu na prace społeczne. W ramach kary ma prowadzić treningi dziecięcej drużyny hokeja. ,family
night at the museum,"Nowo zatrudniony strażnik w Muzeum Historii Naturalnej odkrywa, że starożytna klątwa przywraca każdej nocy eksponaty do życia.",family
paddington 2,"Pomyłkowo osadzony w areszcie, wśród zepsutych do szpiku kości typów spod ciemnej gwiazdy, Paddington zrobi wszystko, by złapać prawdziwego złodzieja tajemniczej książki.",family
herbie: fully loaded,"Nastolatka Maggie dostaje od ojca sportowe auto. Po pewnym czasie okazuje się, że samochód ma niezwykłe właściwości.",family
cats &amp; dogs,"Pod przywództwem Tinklesa, koty rozpoczynają wojnę mającą wyeliminować ich największych wrogów - psy. ",family
fantastic beasts: the secrets of dumbledore,Grindelwald wraz ze swoją armią dąży do przejęcia władzy na świecie. Dumbledore i Newt z pomocą przyjaciół chcą temu zapobiec. ,family
the chronicles of narnia: the silver chair,"Eustachy i Julia Pole zostają wezwani do Narnii, aby odnaleźć syna Kaspiana X, królewicza Riliana. W misji pomaga dzieciom błotowij,&nbsp;Błotosmętek.",family
harry potter and the chamber of secrets,Uczniom i nauczycielom słynnej szkoły magii grozi niebezpieczeństwo. Tylko młody czarodziej Harry może przywrócić dawny porządek. ,family
enchanted,"Zakochana dziewczyna zostaje wyrzucona ze swojej krainy. Ma nadzieję, że wkrótce pojawi się książę, który zabierze ją do domu.",family
rebound,Zawieszony trener drużyny uniwersyteckiej zostaje szkoleniowcem gimnazjalnego zespołu koszykówki. ,family
the benchwarmers,"Gus, Richie oraz Clark postanawiają nadrobić stracone lata i zakładają trzyosobową drużynę baseballową. ",family
seventh son,"Thomas zostaje uczniem stracharza Gregory'ego, ostatniego członka Zakonu Sokoła. Mistrz i jego podopieczny muszą powstrzymać potężną czarownicę - Mateczkę Malkin, która pragnie zemsty za doznane krzywdy.",family
pee-wees big adventure,"Kiedy ekscentryczny Pee Wee Herman odkrywa, że jego ukochany rower został skradziony, wyrusza w podróż swojego życia, aby go odnaleźć.&nbsp;",family
furry vengeance,Dan Sanders rozpoczyna budowę nowego osiedla na terenie lasu. Zamieszkujące tam zwierzęta wypowiadają mu wojnę.,family
tonari no totoro,Dwie dziewczynki wraz z ojcem przeprowadzają się na wieś. Poznają tam magiczne stworzenia zamieszkujące pobliski las. ,family
ice princess,"Casey chce studiować fizykę na Harvardzie i zostać łyżwiarką figurową. Postanawia więc zrealizować projekt, który pozwoli jej połączyć obie pasje.",family
alice through the looking glass,"Alicja powraca do Krainy Czarów, by cofnąć się w czasie i pomóc Szalonemu Kapelusznikowi ocalić rodzinę.",family
high school musical 3: senior year,"Troy, Gabriella i ich szkolni koledzy są już w trzeciej klasie liceum. Przed nimi trudne życiowe decyzje, z których najważniejsza to wybór kierunku studiów.",family
neko no ongaeshi,"Haru ratuje życie kotu, który w podzięce zabiera ją do swojego królestwa. Sprawy komplikują się, gdy władca krainy proponuje dziewczynie małżeństwo ze swoim synem. ",family
scooby-doo,"Scooby-Doo wraz z ekipą detektywów wyruszają na wyspę strachu, by rozwiązać zagadkę. ",family
a dogs journey,Bailey dostaje od swojego ukochanego Ethana nowy cel: ma opiekować się jego wnuczką – CJ. Z biegiem czasu dziewczynka dorasta i wyzwania dla psa stają się coraz większe.,family
the spiderwick chronicles,"Kiedy matka z trójką dzieci przeprowadza się do nowego domu, syn odnajduje tajemniczą książkę, która wpędza rodzinę w kłopoty.",family
the bfg,"Cierpiąca na bezsenność sierota Sophie pewnej nocy zauważa olbrzyma. Ten, dla bezpieczeństwa swojej rasy, postanawia ją porwać.",family
the muppets,"Muppety ponownie się jednoczą i dają na scenie popis swoich talentów, by uzbierać środki niezbędne do uratowania starego teatru.",family
are we done yet?," Nick Persons (Ice Cube), jego świeżo poślubiona małżonka (Nia Long), oraz dwójka jej dzieci (Allen i Bolden) przeprowadzają się do kupionego po okazyjnej cenie domu na... ",family
fantastic beasts: the crimes of grindelwald,Gellertowi Grindelwaldowi udaje się uciec z więzienia. Tylko Dumbledore z pomocą Newta Scamandera mogą go ponownie pokonać.,family
beethoven,"Mały bernardyn przypadkowo trafia pod dach państwa Newtonów. Dzieciaki zauroczone szczeniakiem nadają mu imię Beethoven i przekonują niechętnego ojca, by pozwolił im go zatrzymać.",family
cheaper by the dozen 2,"Tom z żoną i dziećmi wyjeżdża na wakacje nad jezioro, gdzie spotyka swojego dawnego rywala.",family
the witches,Przezorna babcia stara się uchronić swojego osieroconego wnuka przed diabolicznymi wiedźmami.,family
percy jackson: sea of monsters,"Percy Jackson, wraz ze swoimi przyjaciółmi Annabeth Chase, Clarisse i Tysonem udają się w podróż do Morza Potworów, aby odnaleźć Złote Runo. ",family
confessions of a teenage drama queen,"Młoda dziewczyna po przeprowadzce z Nowego Jorku do małego miasteczka usiłuje zrobić wszystko, by tytuł najpopularniejszej dziewczyny w szkole należał do niej.",family
george of the jungle,Mężczyzna wychowany w dżungli przez małpy zakochuje się w bogatej amerykańskiej dziedziczce.,family
the adventures of sharkboy and lavagirl 3-d,"Max często ucieka w świat marzeń, które wkrótce stają się realne.",family
the game plan," Joe Kingman jest wielką gwiazdą amerykańskiego footballu. Jego życie jest usłane wiecznymi imprezami i sukcesami. Bajecznie bogaty, uwielbiany przez wszystkich pewnego... ",family
a dogs way home,"Pies wyrusza w długą, pełną przygód drogę, aby odnaleźć swojego właściciela.",family
the parent trap,"Rozdzielone przed laty bliźniaczki po przypadkowym spotkaniu wpadają na pomysł, by zamienić się miejscami.",family
the war with grandpa,"Peter zmuszony jest dzielić swoją sypialnię z Dziadkiem, który wprowadza się do jego domu po śmierci żony. Chłopak postanawia zrobić wszystko by się go pozbyć.",family
lassie,"Z powodu kłopotów finansowych rodzina Carracloughów&nbsp;sprzedaje suczkę Lassie. Jednakże pies zaczyna tęsknić za swoim ukochanym właścicielem Joem, którego próbuje odnaleźć. ",family
babe: pig in the city," Dalszy ciąg ""Świnki z klasą"". Słynna świnka farmerska - Babe przypadkowo powoduje wypadek, którego ofiarą pada jej ukochany pan Hogget. Z powodu choroby gospodarza farma... ",family
agent cody banks,"Rządowa agencja&nbsp;rekrutuje typowego nastolatka, Cody Banksa, do specjalnego programu szpiegowskiego z udziałem młodocianych.",family
the princess bride,"Wesley pragnie uratować ukochaną z dzieciństwa, która jest narzeczoną złego księcia Humperdincka.",family
le ballon rouge,Chłopiec i balonik zostają nierozłączną parą przyjaciół. ,family
big,Dwunastoletni chłopiec wypowiada życzenie w wesołym miasteczku. Następnego dnia budzi się jako mężczyzna.,family
belle et sebastien,"Alpejska wioska, rok 1943. Kiedy bezpański pies zabija owce, lokalny chłopiec postanawia ochronić zwierzaka przed zemstą mieszkańców. ",family
snow dogs,"Ceniony dentysta dowiaduje się, że otrzymał w spadku zaprzęg ośmiu psów. Zwierzaki sprawiają nowemu panu wiele kłopotów. ",family
the shaggy dog,Zastępca prokuratora zostaje ugryziony przez psa. Mężczyzna pod wpływem emocji zaczyna zmieniać się w czworonoga.,family
willy wonka &amp; the chocolate factory,"Charlie Bucket odnajduje złoty bilet w batoniku, który pozwala mu zwiedzić tajemniczą fabrykę słodyczy Willy'ego Wonki.",family
miracle on 34th street,"Święty Mikołaj z centrum handlowego sprawia, że mała Susan znów zaczyna wierzyć w magię świąt.",family
tini: el gran cambio de violetta,"Nastoletnia gwiazda serialu telewizyjnego przeprowadza się na wieś, gdzie przeżyje nową, wspaniałą przygodę. ",family
paddington,Niedźwiadek szuka szczęścia w wielkim mieście.,family
cool runnings,"Historia jamajskiej drużyny bobslejowej, która uczestniczy w igrzyskach zimowych.&nbsp;",family
mary poppins returns,"Niania powraca, gdy w rodzinie Banksów znowu pojawiają się kłopoty. ",family
karigurashi no arrietty,"Japońska adaptacja ""Pożyczalskich"", którzy starają się spokojnie żyć pod podłogą ludzkiego domu.",family
dora and the lost city of gold,"Dora usiłuje rozwikłać tajemnicę zaginionej inkaskiej cywilizacji, aby uratować swoich rodziców.",family
w pustyni i w puszczy,"Staś i Nel zostają porwani. Gdy dzieciom udaje się uciec, rozpoczynają pełną przygód drogę do domu.",family
awantura o basie,"Piętnastolatka dowiaduje się, że państwo Olszowscy nie są jej prawdziwymi rodzicami. Postanawia poznać swoją przeszłość. ",family
"the karate kid, part iii","Młody chłopak&nbsp;zostaje zmuszony do udziału w turnieju karate. Ponieważ nie może liczyć na pomoc swojego mistrza, wstępuje do konkurencyjnej szkoły walk.",family
look whos talking,Historia opowiadana z perspektywy nowo narodzonego dziecka. Jego matka zaszła w ciążę ze swoim żonatym pracodawcą. Niespodziewanie w jej życiu pojawia się sympatyczny taksówkarz.,family
peter pan,"Piotruś Pan zabiera Wendy Darling do Nibylandii, by opowiadała mu i zaginionym chłopcom bajki. W baśniowej krainie na życie chłopca nieustannie czyha Kapitan Hak.",family
elf,Wychowany wśród elfów Świętego Mikołaja Buddy wyrusza do Nowego Jorku w poszukiwaniu biologicznego ojca. ,family
mr. magoriums wonder emporium," Molly Mahoney (Natalie Portman) jest niezdarną i niepewną siebie asystentką w najbardziej dziwacznym, fantastycznym i niesamowitym sklepie z zabawkami, sklepie Pana... ",family
harry potter and the deathly hallows: part 2,"Młody czarodziej musi zniszczyć wszystkie horkruksy, aby ostatecznie pokonać Voldemorta. ",family
nine lives,"Zarozumiały biznesmen, uwięziony w ciele domowego kota, stara się z niego wydostać. ",family
ghost dad,"Owdowiały biznesmen ginie w wypadku samochodowym. Jego duch powraca do domu, by zaopiekować się rodziną. ",family
