title,description,genre
harry potter and the order of the phoenix,"Harry i jego przyjaciele zakładają tajne stowarzyszenie ""Gwardię Dumbledore'a"", aby przygotować się do starcia z Voldemortem.",family
the mummy returns,Mumia ponownie ożywa i podejmuje walkę o władzę. Rodzina O'Connellów stara się powstrzymać potwora. ,fantasy
kill bill: vol. 2,"Czarna Mamba kontynuuje swoją krwawą zemstę na byłym szefie Billu i jego współpracownikach, którzy zniszczyli jej życie.",thriller
romper stomper,"Opowieść o grupie skinheadów, którzy są zaniepokojeni zmianami zachodzącymi w ich okolicy.",drama
a hidden life,Podczas II wojny światowej Austriak Franz Jägerstätter odmawia walki w szeregach niemieckiej armii. ,biography
new york minute," Bliźniaczki&nbsp; wyjeżdżają do Nowego Jorku. Jane chce dostać się na uniwersytet, a Roxy marzy, by zobaczyć swoją ulubioną kapelę.",family
the fly,Naukowiec Seth Brundle wskutek nieudolnie przeprowadzonego eksperymentu zaczyna przemieniać się w człowieka-muchę. ,horror
whats love got to do with it,"Królowa rocka, Tina Turner, pnie się po szczeblach muzycznej kariery, tkwiąc jednocześnie w skomplikowanym związku.",biography
ninja assassin,"Raizo od najmłodszych lat był szkolony na bezwzględnego zabójcę przez klan ninja, który zaopiekował się nim w dzieciństwie. Po latach postanawia zerwać z przeszłością i zniknąć. ",action
trolls world tour,"Poppy i Mruk z przyjaciółmi wyruszają w wielką podróż, by dokonać niemożliwego: pogodzić ze sobą wszystkie Trolle i połączyć się przeciw wrogowi.",animation
el bar,Grupa nieznajomych sobie ludzi zostaje uwięziona w barze.,horror
ferdinand,Przyjacielski młody byczek przez pomyłkę zostaje zwerbowany do walk na arenie. ,animation
tinker tailor soldier spy,"Ekranizacja powieści Johna le Carré. Trwa zimna wojna, emerytowany agent zostaje przywrócony do służby i dostaje zadanie zdemaskowania sowieckiego szpiega w szeregach MI6.",thriller
offret sacrificatio,"Gdy zostaje nadany alarm zwiastujący atak atomowy, ateista zwraca się o pomoc do Boga. Gotów jest poświęcić samego siebie, by zapewnić bliskim bezpieczeństwo. ",drama
subway,Fred kradnie cenne dokumenty z domu zamożnej kobiety. Schronienie znajduje w paryskim metrze.,drama
what lies beneath,Po wyjeździe córki na studia Norman i Claire wyprowadzają się z miasta. Wkrótce w nowym domu zaczyna straszyć. ,thriller
miles ahead,"Podróż przez życie i muzykę Milesa Davisa, który stał się światową ikoną jazzu.",biography
the half of it,"Grzeczna i&nbsp;wzorowa licealistka pomaga znajomemu futboliście oczarować dziewczynę, w&nbsp;której oboje się kochają. Współczesna wersja opowieści o&nbsp;Cyranie de Bergeracu.",comedy
i come with the rain,"Prywatny detektyw, niegdyś policjant z Los Angeles, udaje się do Hongkongu w poszukiwaniu zaginionego syna miliardera.",crime
earth: one amazing day,Dokument ukazujący jeden dzień z życia naszej ojczystej planety. ,documentary
mr. &amp; mrs. smith,Para płatnych zabójców pracujących dla dwóch tajnych agencji wiedzie monotonne małżeńskie życie. Niespodziewanie dostają zlecenie na siebie nawzajem.,action
jestes bogiem,"Trzej przyjaciele, Magik, Rahim i Fokus, zakładają grupę Paktofonika. Nie podejrzewają, że ich utwory zmienią oblicze polskiego hip-hopu, stając się głosem młodego pokolenia.",biography
deep water,"Zamożny mężczyzna, który pozwala żonie mieć romanse, aby uniknąć rozwodu, staje się głównym podejrzanym o zniknięcie jej kochanków.",thriller
beasts of the southern wild,Kilkuletnia Hushpuppy i jej ojciec mimo powodzi postanawiają nie opuszczać domostwa i stawić czoła żywiołowi. Dziewczynka nawiązuje kontakt z magicznym światem natury.,drama
the next karate kid,"Po śmierci rodziców zbuntowana Julie trafia pod opiekę mistrza sztuk walki, który zaczyna uczyć ją karate.",family
the man who knew too much,Przebywający z rodziną na wakacjach lekarz zostaje wplątany w aferę szpiegowską.,thriller
les douze travaux dasterix,"Juliusz Cezar zadaje Galom 12 prac podobnych do tych, które kiedyś były zadaniami Herkulesa. Od ich wykonania zależy rezultat wojny z rzymską potęgą. ",animation
the golden compass,"Posiadaczka złotego kompasu - Lyra z pomocą Lorda Asriela, pancernego niedźwiedzia i grupki sprzymierzeńców stara się pokrzyżować diaboliczne plany Pani Coulter.",fantasy
amy,"Prawdziwa historia&nbsp;gwiazdy muzyki&nbsp;Amy Winehouse, która zmarła na skutek zatrucia alkoholowego w wieku 27 lat.",biography
halloween 4: the return of michael myers,"Podczas transportu ambulansem Michael Myers budzi się ze śpiączki i wraca do Haddonfield, aby zabić swoją siostrzenicę. Jego tropem rusza doktor Loomis. ",horror
rocky v,Rocky traci majątek i ze względów zdrowotnych rezygnuje z boksu. Postanawia zostać trenerem dobrze zapowiadającego się Tommy'ego Gunna. ,drama
jing wu men,Chen pragnie pomścić swojego mistrza otrutego przez członków japońskiej szkoły sztuk walki. ,action
the children of leningradsky,"Historia moskiewskich sierot, które tułają się po rosyjskim dworcu. Każdego dnia walczą o przetrwanie, licząc na czyjąś pomoc.&nbsp;",documentary
space jam: a new legacy,LeBron James i drużyna animków muszą pokonać w meczu koszykówki złośliwą sztuczną inteligencję. Stawką pojedynku są losy świata. ,animation
a beautiful mind,"Geniusz matematyczny John Nash za wszelką cenę pragnie opracować teorię, dzięki której zostanie cenionym naukowcem. Przeszkodą staje się jego stopniowo rozwijająca choroba.",biography
bedeviled,Po pobraniu tajemniczej telefonicznej aplikacji pięcioro przyjaciół staje się ofiarami nadnaturalnej siły. ,horror
sur la piste du marsupilami,Dziennikarz Dan dostaje zlecenie przeprowadzenia wywiadu z wodzem dzikiego plemienia. Na miejscu odkryje istnienie mitycznego stworzenia – Marsupilami.,family
la marche de lempereur,"Każdego roku pingwiny rozpoczynają swój marsz w jedno miejsce, by odnaleźć miłość i założyć rodzinę.",family
agent cody banks,"Rządowa agencja&nbsp;rekrutuje typowego nastolatka, Cody Banksa, do specjalnego programu szpiegowskiego z udziałem młodocianych.",family
gake no ue no ponyo,Pięcioletni chłopiec zaprzyjaźnia się z rybią księżniczką. ,family
frequently asked questions about time travel,Trójka znajomych postanawia rozwiązać problem podróży w czasie.,comedy
london has fallen,Terroryści planują największy w historii zamach. O losach zachodniej cywilizacji mogą zadecydować umiejętności jednego człowieka. ,thriller
le gamin au velo,"Porzucony przez ojca Cyryl nie może zaakceptować jego nieobecności i nieustannie ucieka z domu dziecka, by go szukać. Wkrótce chłopiec poznaje fryzjerkę, Samantę, która zaczyna mu pomagać.",drama
la tortue rouge,"Rozbitek trafia na bezludną wyspę. Mężczyzna pragnie z niej uciec, lecz zmienia swoje nastawienie, gdy odkrywa jej tajemnice.",animation
banlieue 13: ultimatum,Władze Paryża decydują się wysadzić w powietrze 13 dzielnicę zamieszkałą przez przestępców. Leito i Damien postanawiają temu zapobiec.,action
el angel,"Carlito, niewinnie wyglądający chłopak o twarzy anioła, popełnia drobne przestępstwa na ulicach Buenos Aires. Wkrótce po tym, gdy poznaje Ramona, staje się brutalnym mordercą.",biography
il conformista," Faszystowskie Włochy. Marcello (Jean-Louis Trintignant) jest pracownikiem tajnych służb, który zgłasza swój akces do faszyzmu i żeni się z drobnomieszczanką Giulią, by... ",drama
what dreams may come,"Po tragicznej śmierci dzieci Annie popełnia samobójstwo, za co trafia do Piekła. Po śmierci jej mąż budzi się w Niebie, skąd wyrusza w podróż, by ją odnaleźć. ",fantasy
hardcore,"Cyborg Henry musi uratować swoją żonę, a zarazem twórcę, pojmaną przez psychopatycznego tyrana o telekinetycznych mocach i jego armię najemników. ",action
smokin aces,"Gdy artysta z Las Vegas postanawia zeznawać przeciwko mafii, pojawia się wielu wrogów, którzy gotowi są go uciszyć.",action
only god forgives,Gangster chce się zemścić na poruczniku policji za&nbsp;śmierć swojego brata.,crime
baise-moi, Gwałt to historia podróży przez Francję dwóch kobiet - Manu i Nadine (w tych rolach gwiazdy filmów dla dorosłych). Obie bohaterki są po ciężkich przejściach: Manu została... ,thriller
drillbit taylor,"Troje uczniów zatrudnia ochroniarza, aby chronił ich przed znęcającymi się nad nimi kolegami ze szkoły. ",comedy
house of games,"Psychiatra wnika do środowiska nielegalnych rozgrywek, by pomóc uzależnionemu od hazardu pacjentowi. ",crime
timecop,Agent z Urzędu Ochrony Czasu prowadzi śledztwo przeciwko skorumpowanemu politykowi wykorzystującemu nielegalne podróże w czasie do gromadzenia środków na własną kampanię prezydencką. ,action
vidocq,Znany paryski detektyw ginie podczas prowadzenia śledztwa. Jego młody biograf postanawia doprowadzić sprawę do końca.,fantasy
the expendables,Grupa najemników otrzymuje zadanie obalenia dyktatora jednego z południowoamerykańskich państw. Wyruszają więc na samobójczą misję. ,action
eight legged freaks,W wyniku nieszczęśliwego zbiegu okoliczności małe górnicze miasteczko zostaje zaatakowane przez gigantyczne pająki.,horror
the killing,Grupa mężczyzn układa plan zrabowania dwóch milionów dolarów podczas wyścigów konnych. ,crime
the expendables 2,"Gdy podczas akcji ""Niezniszczalnych"" ginie jeden z członków grupy, pozostali postanawiają wyrównać rachunki i ukarać winnego. ",action
herbie: fully loaded,"Nastolatka Maggie dostaje od ojca sportowe auto. Po pewnym czasie okazuje się, że samochód ma niezwykłe właściwości.",family
marys land,"Dokument opowiada o ludziach, którzy twierdzą, że doświadczyli bezpośredniego kontaktu z Maryją. ",documentary
time bandits,Uciekające przed swoim panem karły trafiają do mieszkania Kevina.,family
the third man,"Pisarz podrzędnych kryminałów przyjeżdża do powojennego Wiednia, gdzie ma rozwiązać zagadkę śmierci przyjaciela.",crime
fast &amp; furious,"Przestępca oraz tropiący go agent łączą swoje siły i przenikają do narkotykowego gangu, by dopaść jego przywódcę.",action
paperman,"Pracownik biura poznaje na stacji kolejowej piękną dziewczynę. Gdy spotyka ją po raz kolejny, stara się zwrócić na siebie uwagę, rzucając w nią samolotami z papieru. ",animation
d-war,"Ethan Kendrick, dowiadując się, iż jest kolejnym wcieleniem wielkiego wojownika, rozpoczyna badanie tajemniczej, koreańskiej legendy. ",fantasy
cheaper by the dozen 2,"Tom z żoną i dziećmi wyjeżdża na wakacje nad jezioro, gdzie spotyka swojego dawnego rywala.",family
maximum risk,"Francuski policjant szuka mordercy brata bliźniaka - członka rosyjskiej mafii. W tym celu przejmuje tożsamość zmarłego i rusza do Nowego Jorku, by wyjaśnić zagadkę jego śmierci. ",action
the trust,Para przeciętnych policjantów postanawia obrabować bankowy skarbiec.,crime
the santa clause,"Mężczyzna nieumyślnie doprowadza do wypadku z udziałem Świętego Mikołaja, po czym&nbsp;przejmuje jego&nbsp;obowiązki.",family
frenzy,Z Tamizy zostaje wyłowiona kobieta uduszona krawatem. Posądzony niesłusznie o zabójstwo Richard Blaney musi udowodnić swą niewinność.,crime
work it,"Quinn Ackerman ubiega się o przyjęcie do wymarzonego koledżu. Sukces zależy od udziału w konkursie tanecznym jej grupy, którą dopiero usiłuje stworzyć.",comedy
the brood,"Żona Franka Carvetha trafia pod opiekę ekscentrycznego psychologa,&nbsp;który wykorzystuje innowacyjne techniki, aby przełamać psychologiczne blokady u pacjentów.",horror
garfield: a tail of two kitties,"Garfield wyrusza wraz z Jonem w podróż do Wielkiej Brytanii, gdzie omyłkowo zostaje wzięty za spadkobiercę ogromnego majątku. ",family
drogowka,"Historia siedmiu policjantów, których poza pracą łączy przyjaźń, imprezy, samochody i interesy. Wszystko się zmienia, gdy ginie jeden z nich.",crime
true romance,"Wiodący dotychczas spokojny tryb życia fan kina i komiksów zostaje uwikłany w zabójstwo, handel narkotykami oraz śledztwo FBI.",crime
the bfg,"Cierpiąca na bezsenność sierota Sophie pewnej nocy zauważa olbrzyma. Ten, dla bezpieczeństwa swojej rasy, postanawia ją porwać.",family
chico &amp; rita,"W hawańskim klubie spotyka się dwoje ludzi, ona wokalistka, on pianista. Łącząca ich miłość, mimo przeciwności losu, trwa przez wiele lat.",animation
les saveurs du palais,"Prawdziwa historia Hortense Laborie, mistrzyni kuchni, która zostaje osobistą kucharką prezydenta. Na szczytach władzy czeka na nią wiele pułapek.",biography
immortal beloved," W burzliwy wieczór 26 marca 1827 r., chory na zapalenie płuc Ludwig van Beethoven umiera w swoim wiedeńskim mieszkaniu. Trzy dni póżniej zostaje pochowany na cmentarzu... ",biography
"greystoke: the legend of tarzan, lord of the apes",Para angielskich podróżników umiera w środku afrykańskiej dżungli. Ich nowo narodzone dziecko biorą pod opiekę małpy.,drama
oceans,"Dokument ukazuje piękno życia w oceanach, oraz zwraca uwagę na zagrażające Ziemi niebezpieczeństwa.",documentary
serendipity,"Kiedy Sara i Jonathan zakochują się w sobie od pierwszego wejrzenia, postanawiają sprawdzić, czy są sobie przeznaczeni.",comedy
bak-jwi,"Podczas badań nad śmiertelnym wirusem ksiądz zostaje zarażony wampiryzmem, co też budzi w nim ludzkie pragnienia. Wkrótce duchowny spotyka piękną mężatkę, która sprowadza go na drogę grzechu. ",drama
blood red sky,"Cierpiąca na&nbsp;tajemniczą chorobę kobieta musi ujawnić swój mroczny sekret, gdy terroryści próbują przejąć samolot, którym podróżuje ona ze&nbsp;swoim synkiem.",horror
the son of no one,"Jonathan to młody policjant, który zostaje skierowany do pracy w Queens, gdzie dorastał. Anonimowe listy dotyczące zamkniętej sprawy sprzed lat stanowią zagrożenie dla jego dobrze zapowiadającej się kariery.",drama
no-do,"Małżeństwo z dziećmi przeprowadza się&nbsp;do nowego domu. Wkrótce kobieta odkrywa, że ma on mroczną przeszłość.",horror
la sortie des usines lumiere,"Po skończonej pracy w fabryce robotnicy wychodzą przez bramę, rozmawiając ze sobą i spiesząc się do domów. ",documentary
veronica,"Madryt, 1991 rok. Nastolatka po zabawie z planszą ouija odkrywa, że wokół niej zaczynają się dziać dziwne rzeczy.",horror
hot fuzz,Policjant z Londynu zostaje przeniesiony do małego miasta. Wraz ze swoim nowym partnerem próbują wyjaśnić serię podejrzanych wypadków i zdarzeń. ,comedy
upgrade,"Sparaliżowany Grey poddaje się nowatorskiemu zabiegowi, aby o własnych siłach odnaleźć zabójców swojej żony. ",action
blue streak," Po wyjściu z więzienia złodziej, Miles Logan, przenika do policji, aby odzyskać skradzione przed laty diamenty. ",comedy
whiteout,"Po dwóch latach spędzonych na Antarktydzie znudzona policjantka, Carrie Stetko, dowiaduje się o zabójstwie naukowca. Chociaż cała załoga instytutu badawczego wraca do domu, ona postanawia zostać i rozwikłać zagadkę.",crime
pacific rim,Świat nie umie obronić się przed morskimi potworami z&nbsp;innego wymiaru. Ostatnią nadzieją naszej planety stają się wydalony ze&nbsp;służby pilot i&nbsp;niedoszkolona nowicjuszka.,action
onibaba,"Kobieta z synową mordują wędrownego samuraja i sprzedają jego ekwipunek, aby przetrwać.",horror
brave,"Księżniczka Merida, by uniknąć zamążpójścia, wyrusza w podróż. Spotyka wiedźmę, która za odpowiednią opłatą obiecuje jej pomóc.",animation
intimacy,"Muzyk po przejściach próbuje poznać bliżej tajemniczą nieznajomą, która odwiedza go raz w tygodniu.",drama
serbuan maut,Elitarny oddział SWAT wkracza do siedziby kartelu narkotykowego. Podczas akcji policjanci wpadają w pułapkę.,action
confessions of a teenage drama queen,"Młoda dziewczyna po przeprowadzce z Nowego Jorku do małego miasteczka usiłuje zrobić wszystko, by tytuł najpopularniejszej dziewczyny w szkole należał do niej.",family
religulous,"Bill Maher spotyka się z wieloma przedstawicielami różnych religii, aby poznać istotę Boga.",documentary
the ringer," Pełen uroku, życiowy nieudacznik Steve Barker (Johnny Knoxville), zmuszony przez długi i swego chciwego wuja (Brian Cox) wpada na nieprawdopodobny, zasługujący na... ",comedy
"job, czyli ostatnia szara komorka",Trzech przyjaciół-nieudaczników zmaga się z trudnościami życiowymi. Ukojenie w ciężkich chwilach przynosi im oglądanie ulubionych programów TV. ,comedy
hunt for the wilderpeople,"Ricky trafia do rodziny zastępczej. Po śmierci przybranej ciotki, chłopak ucieka. ",drama
the woman in black,"Młody adwokat przyjeżdża do rezydencji zmarłej klientki, by uporządkować jej dokumenty i przekonać się, że okolica nawiedzana jest przez ducha.",drama
mirrors,"Ben rozpoczyna pracę jako stróż w opuszczonym centrum handlowym. Mężczyzna zauważa, że lustra, które się tam znajdują, nie są zwyczajne.",horror
yes day,Zmęczeni ciągłymi odmowami rodzice pozwalają swoim dzieciom dyktować zasady przez jeden dzień. Zaczyna się niesamowita rodzinna przygoda.,family
captain marvel,Ziemska kobieta po kontakcie z obcą rasą Kree otrzymuje nadludzkie moce.,action
enter the dragon,"Agent Lee decyduje się wziąć udział w&nbsp;turnieju sztuk walki, by znaleźć dowody nielegalnej działalności organizatora imprezy. ",action
"masculin, feminin: 15 faits precis", Film jest jednym z najważniejszych dokonań czołowego prekursora francuskiej nowej fali - Jean-Luc Godarda. Obraz powstał na podstawie dwóch opowiadań Guy'a de... ,drama
vampire academy,"Rosemarie Hathaway uczy się sztuk walk w akademii wampirów. Podczas treningów poznaje nauczyciela, który chroni ją przed siłami zła.",fantasy
paranormal activity,"Młoda para sądzi, że jest prześladowana przez demona. Kamera rejestrująca sytuację podczas ich snu ma im pomóc wyjaśnić tę zagadkę.",horror
the flash,W wyniku niezwykłego zdarzenia Barry Allen zyskuje zdolność przemieszczania się z niezwykłą szybkością i pod pseudonimem staje na straży Central City. ,action
chicago,"Chicago, 1929&nbsp;rok. Roxie Hart, piosenkarka wodewilowa zamknięta za zabójstwo swojego kochanka, staje się obiektem podziwu oraz uwielbienia mediów.",crime
traffic,"Trzy historie opowiadające o walce z narkotykami przedstawione oczami ojca, żony i policjanta. ",drama
22 jump street,"Policjanci, Schmidt i Jenko, trafiają pod przykrywką do lokalnego college'u, gdzie czeka na nich kolejne zadanie.",action
"they shoot horses, dont they?",Ofiary kryzysu finansowego tańczą w maratońskim konkursie tanecznym. Główną nagrodą jest duża suma pieniędzy. ,drama
konopielka,"Uporządkowane życie chłopa Kaziuka burzy młoda nauczycielka, która zostaje przydzielona do niego na kwaterę. ",comedy
the social dilemma,Ukazanie groźnych skutków ludzkiego wpływu na&nbsp;sieci społecznościowe. Ten problem najlepiej zauważają ich twórcy — eksperci ds. technologii.,documentary
les saisons,"W pełnym tajemnic lesie rozgrywa się niesamowita opowieść o przyrodzie, tej najdzikszej i nietkniętej jeszcze ludzką ręką.",documentary
art of freedom,"Dokument przedstawia historię polskiego himalaizmu, a także sukcesy jakie odnosili jego przedstawiciele w latach 70. i 80. XX wieku. ",documentary
bai she chuan shuo," W odległych czasach obok ludzi zamieszkały hordy goblinów, potworów i złych duchów.&nbsp;Wśród nich były dwa węże, biały i zielony. Pewnego dnia młody zielarz Xu Xian (Raymond... ",fantasy
the shape of water,"Niema Elisa Esposito pracuje jako woźna w tajnym rządowym laboratorium. Jej życie ulega nagłej zmianie, gdy odkrywa pilnie strzeżony sekret.",fantasy
catfish,"Nev, 24-letni fotograf z Nowego Jorku, nie ma pojęcia, w co się pakuje, gdy kontaktuje się z nim przez Facebooka pewna ośmiolatka, by uzyskać pozwolenie na namalowanie jednego z jego zdjęć.",documentary
"runner, runner","Student zostaje oszukany, grając w internetowego pokera. Postanawia odzyskać utracone pieniądze i odnaleźć właściciela witryny. ",crime
damien: omen ii,Trzynastoletni Damien stopniowo odkrywa swoją tożsamość oraz przeznaczenie. ,horror
dead man down,"Żądna zemsty kobieta uwodzi Victora, będącego prawą ręką nieuchwytnego, nowojorskiego kryminalisty.",thriller
james and the giant peach," Szczęśliwe życie Jakubka na angielskim wybrzeżu zostaje brutalnie przerwane, gdy jego rodzice zostają zabici przez nosorożca i chłopiec zostaje oddany pod opiekę dwóch... ",animation
belzebuth,"Detektyw, który w tragicznych okolicznościach stracił rodzinę, prowadzi śledztwo w sprawie szkolnej strzelaniny.&nbsp;",horror
cave of forgotten dreams,"Dokument opowiada o&nbsp;jaskini Chauveta&nbsp;w południowej&nbsp;Francji, w której latem 1994 roku odkryto prehistoryczne malowidła sprzed ponad 30 tys. lat.",documentary
wolf creek,Podczas wyprawy bezdrożami Australii do największego krateru grupie przyjaciół odmawia posłuszeństwa samochód. Bezsilni cieszą się na widok mężczyzny oferującego pomoc.,horror
hoodwinked too! hood vs. evil,"Kiedy Czerwony Kapturek odbywa szkolenie przygotowujące do specjalnej misji, zła czarownica uprowadza Jasia i Małgosię. Dziewczynka z pomocą swojego partnera Wilka postanawia rozwikłać tę sprawę. ",animation
the theory of everything,"Film opowiada historię genialnego naukowca Stephena Hawkinga - rozwoju jego choroby, rodzącego się uczucia do Jane, a w końcu rozpadu ich małżeństwa. ",biography
saphirblau,"Gwendolyna Shepherd i Gideon de Villiers wspólnie wypełniają misję dla zakonu, do którego przynależą ich rodziny, lecz Gwen zaczyna mieć wątpliwości, komu powinna zaufać.",fantasy
to live and die in l.a.,Policjant Richard Chance chce pomścić śmierć swojego partnera. ,crime
blade ii,"Blade zawiera przymierze z wampirami, by pokonać nową, zmutowaną rasę potworów. ",horror
dredd,"Miasto przyszłości. Władzę absolutną sprawują w nim sędziowie. Wśród nich jest Sędzia Dredd, który staje do walki z dilerami zabójczego narkotyku.",action
clue,"Sześć osób otrzymuje zaproszenie na uroczystą kolację. Gdy nieoczekiwanie pan domu zostaje zamordowany, goście łączą siły, by rozwiązać zagadkę. ",thriller
kinematograf,"Szalony geniusz poświęca się konstruowaniu wynalazku, którym chce zmienić świat, ignorując schorowaną&nbsp;żonę.",animation
reality bites,"Portret pokolenia lat 90. na przykładzie grupy przyjaciół, którzy po ukończeniu studiów próbują odnaleźć się w dorosłym świecie.",drama
dangerous minds,Była oficer marines zatrudnia się jako nauczycielka w jednej ze szkół Los Angeles. Jej niekonwencjonalne metody zmieniają życie wyjątkowo trudnych uczniów.,biography
villmark 2,"Specjalnie przygotowana grupa ma za zadanie oczyszczenie starego ośrodka dla obłąkanych ze szkodliwych substancji. Okazuje się jednak, że szpital nie jest całkiem opuszczony. ",horror
holes,Niesłusznie oskarżony Stanley trafia do zakładu poprawczego Camp Green Lake.,family
the living daylights,"Agent 007 jedzie do Bratysławy celem ochrony radzieckiego generała Koskowa. Gdy przekonuje się o jego prawdziwych planach, podejmuje z nim niebezpieczną grę.",thriller
dumbo,"Dumbo to mały słonik o nienaturalnie wielkich uszach, który przy pomocy zaprzyjaźnionej myszki uczy się wiary w siebie.",animation
"jamon, jamon",Życiem młodego chłopaka rządzą dwie obsesje: seks i jedzenie.,drama
chalte chalte,"Pochodząca z bogatego domu Priya poznaje kierowcę ciężarówki, dla którego zrywa zaaranżowane narzeczeństwo. Wkrótce biorą ślub.",drama
monster trucks,"Zafascynowany motoryzacją chłopak konstruuje własną wersję Monster Trucka. Gdy z podziemnych głębin w pobliskiej rafinerii wydostaje się niezwykłe stworzenie, Tripp znajduje sposób na zmianę dotychczasowego życia.",comedy
godzilla,"Najsłynniejszy potwór w historii mierzy się z wrogimi stworami, które, wzmocnione przez arogancję i nieświadomość naukowców, zagrażają ludzkości. ",action
superman ii,"Na Ziemię przybywa troje złowrogo nastawionych Kryptonian, których celem jest podbój planety. Ich plany próbuje pokrzyżować Superman.",action
the spiderwick chronicles,"Kiedy matka z trójką dzieci przeprowadza się do nowego domu, syn odnajduje tajemniczą książkę, która wpędza rodzinę w kłopoty.",family
pride and prejudice and zombies,"Siostry Bennett przeżywają miłosne perypetie, gdy w Hertfordshire wylęgają się zombie.",horror
doodlebug,"Młody mężczyzna próbuje zabić za pomocą buta tajemnicze ""coś"", przemieszczające się po jego pokoju. ",fantasy
paris is burning,Pełna brokatu i kiczu podróż wgłąb świata queerowych klubów nocnych lat 80-tych,documentary
collide,Młody Amerykanin podejmuje się przemytu narkotyków na terenie Niemiec.,thriller
shazam!,"Chłopiec otrzymuje moce, dzięki którym&nbsp;staje się dorosłym superbohaterem,&nbsp;wypowiadając jedno magiczne słowo.",fantasy
i am david," Film opowiada historię dwunastoletniego chłopca, Davida, który ucieka z komunistycznego obozu koncentracyjnego mając przy sobie jedynie kompas, bochenek chleba, list i... ",drama
tron: legacy,"Sam Flynn zostaje wciągnięty do wirtualnego świata, stworzonego przed laty przez swojego zaginionego ojca. Odtąd musi walczyć o przetrwanie w cyfrowej rzeczywistości. ",action
poranek kojota,"Kuba poznaje młodą piosenkarkę i jest nią zauroczony. Nie podoba się to ojcu dziewczyny, jak również jej chłopakowi. ",comedy
