title,description,genre
the last unicorn, Ostatni jednorożec wyrusza w świat by odkryć co się stało z resztą jego gatunku. Podczas drogi spotyka wiele różnorodnych i interesujących postaci - głupiego magika... ,animation
red sonja,"Wojowniczka Sonja pragnie pomścić masakrę swojego ludu, której sprawczynią jest zła królowa Gedren. ",fantasy
jackie brown,"Stewardessa przyłapana na nielegalnym przewożeniu pieniędzy z Meksyku do Los Angeles rozpoczyna grę między agentami FBI a handlarzem broni, dla którego pracowała.",crime
hannibal,"Dr Hannibal Lecter wraca do Ameryki, by odnowić kontakt z agentką Starling. Jego śladem podąża okaleczony przez niego i pałający żądzą zemsty Mason Verger. ",thriller
thor: love and thunder,nr 1 (polskie napisy),fantasy
i spit on your grave," Młoda pisarka wyjeżdża na weekend do domku w lesie, gdzie zostaje brutalnie zgwałcona. Kobieta postanawia dokonać krwawej zemsty. ",thriller
resident evil: the final chapter,"Alice wraz z innymi wyrusza do Ula, aby zniszczyć Czerwoną Królową, która ma na celu wyeliminowanie rasy ludzkiej. ",horror
out of time,"Szef policji z Florydy musi rozwiązać sprawę morderstwa, zanim sam zostanie o nie oskarżony. ",crime
the war of the roses,"Barbara i Oliver chcą się rozwieść, jednak każde z nich pragnie zatrzymać dla siebie luksusową posiadłość, którą zamieszkują. Walcząc o dom, małżonkowie nie przebierają w środkach.",comedy
the kid,"Nieszczęśliwy i nielubiany doradca wizerunkowy dostaje drugą szansę w życiu, gdy spotyka tajemniczego chłopca będącego ośmioletnią wersją jego samego.",family
primos,"Kuzyni porzuconego na kilka dni przed ślubem Diega postanawiają odnaleźć jego pierwszą miłość w miasteczku, gdzie jako dzieci spędzali wakacje.",comedy
una pura formalita,W deszczową noc komisarz policji przesłuchuje znanego pisarza. ,crime
spy kids: all the time in the world in 4d,Planecie zagraża Strażnik Czasu. Mali agenci postanawiają powstrzymać przestępcę. ,family
kurt cobain about a son," Film złożony jest z fragmentów 25 - godzinnego wywiadu przeprowadzonego z Kurtem Cobainem przez dziennikarza muzycznego Michaela Azerrada do jego książki ""Come As You... ",documentary
fyre,"Festiwal Fyre był reklamowany jako luksusowe wydarzenie muzyczne na prywatnej wyspie, ale zbytnia pewność siebie organizatora doprowadziła do wielkiego fiaska.",documentary
feast,"Gdy w okolicy pojawiają się agresywne potwory, klienci położonego na odludziu baru walczą o przetrwanie. ",horror
furious 6,Grupa świetnie wyszkolonych kierowców porywa transport wojskowej broni.&nbsp;W zamian&nbsp;za całkowitą abolicję Dom z przyjaciółmi zgadzają się pomóc agentowi Hobbsowi przy powstrzymaniu najemników.,action
the trials of cate mccall,"Niesłusznie posądzona o morderstwo kobieta postanawia oczyścić się z zarzutów i odzyskać opiekę nad córką. Pomaga jej prawniczka, która właśnie powróciła do zawodu na okres próbny.",drama
in the blood,"Kiedy podczas wakacji na Karaibach znika mąż Avy, kobieta postanawia wytropić ludzi, których podejrzewa o jego zaginięcie. ",thriller
halo 4: forward unto dawn,"Przyszłość, rok 2525. Młody żołnierz Thomas konfrontuje się z obcymi, aby ocalić ludzkość. ",action
the babysitters,"Studentka Shirley dorabia jako niania. Gdy idzie do łóżka z ojcem swojego podopiecznego, postanawia zostać dziewczyną na telefon.",drama
the mechanic,"Płatny morderca, Arthur Bishop, uczy fachu syna swojego mentora, którego wcześniej zlikwidował.",thriller
the mercy," Clare i Donald Crowhurst to szczęśliwe i zakochane w sobie małżeństwo z trójką dzieci. Gdy rodzinny biznes plajtuje Donald decyduje się na ryzykowny krok, by zapewnić byt... ",biography
11.6,"Tuni Musolin pracownik firmy ochroniarskiej, planuje przejąć furgonetkę przeznaczoną do konwoju pieniędzy.",thriller
elizabethtown,"Po druzgocącej klęsce na gruncie zawodowym, Drew Baylor dowiaduje się o śmierci ojca. Mężczyzna miał atak serca podczas wizyty u krewnych w Elizabethtown, więc syn musi tam pojechać, by sprowadzić jego ciało do domu. ",comedy
flatliners,"Grupa studentów medycyny prowadzi niebezpieczne eksperymenty ze śmiercią kliniczną. Nie wiedzą, że ich działania będą miały o wiele większe konsekwencje, zagrażające ich życiu.",horror
the colony,Rok 2045. Poprzez wychłodzenie klimatu na Ziemi ludzie wegetują w stworzonych przez siebie koloniach. Niebawem jedna z nich odbiera wezwanie pomocy. ,thriller
the brave little toaster,"Grupa domowych sprzętów pod wodzą małego tostera postanawia odnaleźć swoich właścicieli, którzy wyprowadzili się i nie zabrali ich ze sobą.",animation
minding the gap," Zack, Keire i Bing spędzają wolny czas na jeżdżeniu na deskorolce po mieście i imprezowaniu.",documentary
dapres une histoire vraie,"Sławna pisarka poznaje swą uroczą wielbicielkę, z którą szybko się zaprzyjaźnia.",thriller
layer cake,Handlarz narkotykami postanawia skończyć z przestępczym procederem. Musi najpierw wykonać ostatnie zlecenie. ,crime
the pyramid,Zespół amerykańskich archeologów gubi się w ciemnych korytarzach starożytnej piramidy egipskiej.,horror
planeta singli 3,Ania i Tomek planują wesele na wsi u rodziny mężczyzny. Niespodziewany przyjazd ojca pana młodego jeszcze bardziej wszystko komplikuje. ,comedy
loving vincent,Bohaterowie obrazów Vincenta van Gogha przedstawiają historię życia oraz tajemniczej śmierci artysty. ,animation
la grande illusion," Jeden z najgłośniejszych filmów Jeana Renoira (1894-1979), wybitnego twórcy impresjonistycznej awangardy. Fabuła opiera się na autentycznych wydarzeniach, a jej akcja... ",drama
the eyes of tammy faye," Film ""Oczy Tammy Faye"" przybliża niezwykłą historię sukcesów i niepowodzeń telewizyjnej ewangelistki Tammy Faye Bakker. W latach 70. i 80. ubiegłego stulecia Tammy Faye i... ",biography
wonder woman 1984,Księżniczka Diana Prince podczas zimnej wojny stawia czoło niebezpiecznym przeciwnikom takim jak Cheetah i Max Lord.,action
bumblebee,"Autobot Bumblebee uciekając z Cybertronu dociera na Ziemię, gdzie poznaje nastoletnią Charlie. ",action
powidoki,Charyzmatyczny malarz Władysław Strzemiński nie godzi się z socrealizmem i pozostaje wierny swojej drodze artystycznej. ,biography
larnacoeur,"Zawodowy uwodziciel Alex zostaje wynajęty, aby zapobiec ślubowi&nbsp;angielskiego milionera z francuską dziewczyną.&nbsp;",comedy
the golden compass,"Posiadaczka złotego kompasu - Lyra z pomocą Lorda Asriela, pancernego niedźwiedzia i grupki sprzymierzeńców stara się pokrzyżować diaboliczne plany Pani Coulter.",fantasy
bok-su-neun na-ui geot,"Głuchoniemy mężczyzna, chcąc zebrać pieniądze na operację siostry, w akcie desperacji porywa córkę bogatego fabrykanta.",thriller
"lo and behold, reveries of the connected world","Podróż przez Internet, sztuczną inteligencję, robotykę oraz sposób, w jaki wpływają na nasze życia.",documentary
around the world in 80 days,Ekscentryczny angielski gentleman podejmuje zakład okrążenia świata w 80 dni. ,comedy
middle men,"Prowadzący dostatnie życie Jack przyjmuje ofertę kolegi, aby ratować upadający interes.",drama
reality bites,"Portret pokolenia lat 90. na przykładzie grupy przyjaciół, którzy po ukończeniu studiów próbują odnaleźć się w dorosłym świecie.",drama
the green knight,"Sir Gawain, lekkomyślny i&nbsp;uparty siostrzeniec króla Artura, podejmuje misję zmierzenia się z Zielonym Rycerzem.",fantasy
paranorman,"Norman potrafi rozmawiać ze zmarłymi, ale nikt mu nie wierzy. Mimo tego jego niezwykłe umiejętności uchronią miasteczko przez klątwą sprzed kilkuset lat.",animation
teenage dirtbag," Teenage Dirtbag opowiada historię popularnej cheerleaderki (Noa Hegesh) dręczonej przez przestepczego kolegę z klasy (Scott M. Foster) do momentu, gdy zostają oni... ",drama
the ward,"Kristen zostaje zamknięta w szpitalu psychiatrycznym, który skrywa mroczną tajemnicę. ",horror
four christmases,Para usiłuje odwiedzić każdego z czwórki swoich rozwiedzionych rodziców w dzień Bożego Narodzenia. ,drama
the naked gun: from the files of police squad!,Do USA przylatuje Królowa Elżbieta II. Porucznik Frank Drebin ma za zadanie zapewnić jej bezpieczeństwo. ,comedy
rush hour,Do Los Angeles przylatuje detektyw Lee. Wspólnie z miejscowym policjantem Carterem mają uwolnić porwaną córkę chińskiego konsula.,action
down periscope,Komandor Tom Dodge zostaje dowódcą okrętu podwodnego podczas gry wojennej. Wraz z załogą nieudaczników ma zniszczyć strategiczny cel.,comedy
free willy,"Zbuntowany chłopiec, który pewnej nocy dopuścił się aktu wandalizmu na terenie oceanarium, w ramach kary musi naprawić szkody. Daje to początek wielkiej przyjaźni z przebywającą tam orką.",family
hercules,"Narodzinom Herkulesa, syna Zeusa i Hery, towarzyszy radość rodziców, oraz zazdrość stryja, Hadesa. Podstępny bóg Podziemi dołoży wszelkich starań, by pozbyć się bratanka.",animation
gosford park,Beztroską zabawę na przyjęciu w Gosford Park zakłóca nagła śmierć gospodarza. Któryś z gości go zamordował - każdy jest podejrzany. ,drama
the matrix reloaded,Maszyny chcą zniszczyć Syjon. Neo wyrusza z misją ocalenia ostatniego miasta ludzi. ,action
kedi,"Stambuł to miasto z sięgającą tysięcy lat historią i jedyne najprawdziwsze kocie imperium. Spryciara, Przylepa, Sułtan, Flirciarz, Bestia, Szajba i Cwaniak to indywidualności, które są przewodnikami po mieście. ",documentary
uncle buck,"Buck jest starym kawalerem o złotym sercu, ale opinii nieudacznika. Przez kilka dni będzie musiał opiekować się trójką dzieci swojego brata. ",family
pret-a-porter," Dwa razy w roku świat mody zbiera się w Paryżu na Pret-a-Porter. Wydawcy magazynów, dziennikarze, fotografowie, sławni i bogaci przybywają, aby obejrzeć najnowsze oferty... ",comedy
yves saint laurent,"Paryż, rok 1957. 21-letni Yves Saint Laurent projektuje swoją pierwszą kolekcję dla domu mody Diora. Na pokazie poznaje miłość swojego życia. ",biography
coneheads,"Para stożkogłowych kosmitów przybywa na Ziemię. Planują szybko wrócić do domu, jednak rodzi im się potomek. ",comedy
monster trucks,"Zafascynowany motoryzacją chłopak konstruuje własną wersję Monster Trucka. Gdy z podziemnych głębin w pobliskiej rafinerii wydostaje się niezwykłe stworzenie, Tripp znajduje sposób na zmianę dotychczasowego życia.",comedy
sing 2,"Aby wystąpić w teatrze Crystal, Buster Moon i jego ekipa muszą odnaleźć i przekonać legendę rocka do powrotu na scenę.",animation
le cercle rouge,"Złodziej, uciekinier i były snajper planują kradzież biżuterii. Ich zamiary chce udaremnić bezwzględny komisarz Mattei.",crime
home,"Podróż przez wszystkie kontynenty, której celem jest zwrócenie uwagi świata na problemy oraz zagrożenia środowiska naturalnego: globalne ocieplenie, umierające lasy, wymieranie gatunków zwierząt, a także roślin oraz kończące się zasoby naturalne.",documentary
mothers day,"Kiedy trójka braci napada na bank, jeden z nich zostaje postrzelony. Mężczyźni wracają do rodzinnego domu, który zamieszkują nowi właściciele.",thriller
split,"Mężczyzna o mnogiej osobowości porywa trzy nastolatki. Okazuje się, że jedna z jaźni zaczyna dominować nad innymi.",thriller
the road to el dorado,"Dwóch drobnych oszustów wygrywa w nieuczciwy sposób mapę prowadzącą do legendarnego miasta El Dorado, pełnego niezwykłych bogactw.",animation
the brass teapot,"Para odkrywa, że niedawno znaleziony mosiężny czajnik ma magiczne moce - dostarcza pieniędzy za każdym razem, gdy któremuś z małżonków stanie się krzywda.",fantasy
spider-man: into the spider-verse,Miles Morales po ukąszeniu przez radioaktywnego pająka staje do walki z nikczemnym Kingpinem. Pomogą mu w tym Spider-Manowie z innych wymiarów.,animation
the third man,"Pisarz podrzędnych kryminałów przyjeżdża do powojennego Wiednia, gdzie ma rozwiązać zagadkę śmierci przyjaciela.",crime
love potion no. 9,"Niemający powodzenia u płci przeciwnej biochemik dostaje od Cyganki eliksir, który ma zapewnić miłość dowolnie wybranej kobiety. Sprawy wymykają się jednak spod kontroli.",fantasy
la dolce vita,"Marcello Rubini pracuje jako dziennikarz w Rzymie, próbując odnaleźć miłość i szczęście, które dawno temu utracił.",drama
beowulf &amp; grendel,"Beowulf przybywa do kraju króla Hrothgara, aby stawić czoła nękającemu jego poddanych trollowi Grendelowi. ",fantasy
baczynski,"Opowieść o legendarnym poecie oraz bezsensie wojny i sztuce, która jest ponadczasowa, a także nieśmiertelna.",biography
bande a part," Węsząc okazję do zdobycia łatwych pieniędzy, Arthur przekonuje swego przyjaciela, Franza, by przedstawił mu swoją dziewczynę, Odile. Odile bowiem powiedziała Franzowi o... ",drama
paranormal activity,"Młoda para sądzi, że jest prześladowana przez demona. Kamera rejestrująca sytuację podczas ich snu ma im pomóc wyjaśnić tę zagadkę.",horror
menace ii society,Młody uliczny naciągacz próbuje uciec od rygorów i pokus getta w poszukiwaniu lepszego życia.,crime
trick,Doskonały fałszerz pieniędzy Marek odsiaduje wyrok w więzieniu. Niebawem agenci służb specjalnych składają mu propozycję pozwalającą wcześniej wyjść na wolność. ,thriller
godzilla,"Najsłynniejszy potwór w historii mierzy się z wrogimi stworami, które, wzmocnione przez arogancję i nieświadomość naukowców, zagrażają ludzkości. ",action
star trek beyond,"Kapitan Kirk wraz z załogą USS Enterprise odbywa pięcioletnią misję, podczas której natyka się na złowrogą kosmiczną rasę dowodzoną przez demonicznego Kralla. ",action
nomis,"Porucznik Marshall przeżywa trudne chwile w życiu osobistym, kiedy dostaje sprawę śmierci nastolatki. Odkrywając i aresztując jej oprawcę, podejmuje współpracę z emerytowanym sędzią, który na własną rękę eliminuje pedofilów.",thriller
cidade de deus,"Oparta na faktach historia dwóch chłopców ze slumsów Rio de Janeiro. Jeden z nich dołączył do gangu, drugi wybrał sztukę i został fotografem.",drama
patrick,Mały mops zmienia poukładane życie Sary nie do poznania. ,family
31,Tuż przed Halloween pięć osób zostaje porwanych i zmuszonych do wzięcia udziału w grze.,horror
paranormal activity: the marked ones,"Rodzina i przyjaciele próbują uratować Jessego przed tajemniczymi siłami, które go nawiedzają. ",horror
"extremely wicked, shockingly evil and vile","Kronika zbrodni Teda Bundy'ego z perspektywy jego długoletniej dziewczyny Liz Kendall, która nie wierzyła w prawdę o nim.",biography
finding neverland,"Historia przyjaźni pisarza Jamesa Barriego z wdową i jej czterema synami, którzy zainspirowali go do napisania ""Piotrusia Pana"".",drama
ford v ferrari,Na zlecenie Henry'ego Forda II amerykański projektant Carroll Shelby i brytyjski kierowca Ken Miles podejmują wyzwanie pokonania samochodów ekipy&nbsp;Ferrari w 24-godzinnym wyścigu Le Mans.,biography
"7 rzeczy, ktorych nie wiecie o facetach","Kilku mężczyzn w klubie fitness prowadzi rozmowę na temat swojego życia i zastanawia się, jak je zmienić. ",comedy
ucastnici zajezdu,"Grupa czeskich wczasowiczów wyjeżdża na tygodniowe wakacje nad Adriatyk. Komplikacje, przeszkody, drobne przygody - wszystko to powoduje, że wakacje stają się dla ich uczestników momentem przełomowym.",comedy
cool world," Gangster-rysownik Jack Deebs (Gabriel Byrne) siedząc w więzieniu, uciekał od smutnej rzeczywistości wymyślając Wspaniały świat - komiks z udziałem uwodzicielskiego wampa... ",animation
patient zero,"Po epidemii zombie mężczyzna stara się odszukać pacjenta zero, który jest ostatnią nadzieją ludzkości. ",horror
the basketball diaries,"Skłócony z całym światem chłopak popada w kłopoty, z których jedyną odskocznią jest pisanie wierszy. ",biography
dark shadows,"Ukarany przez mściwą wiedźmę Barnabas wstaje z grobu po dwustu latach i trafia w szalone lata 70., których zupełnie nie rozumie.",fantasy
hell,"Apokaliptyczna wizja niedalekiej przyszłości, w której Ziemia zamieniła się w jałową pustynię.",thriller
mamma mia! here we go again,"Sophie zachodzi w ciążę i poznaje historie z młodości swojej matki – szczególnie o czasie, w którym była ona w ciąży. ",comedy
the forbidden kingdom,"Nastoletni Jason za pomocą tajemniczej laski przenosi się do baśniowej krainy w starożytnych Chinach, gdzie otrzymuje misję ratowania świata. ",fantasy
universal soldier: regeneration,"Terroryści opanowują elektrownię atomową, grożąc nuklearną katastrofą. Powstrzymać ich może tylko niezwyciężony Uniwersalny Żołnierz - Luc Deveraux.",action
le violon rouge," Historia skrzypiec wykonanych przed kilkuset laty. Instrument przynosi nieszczęście swoim kolejnym właścicielom, wreszcie zostaje wystawiony na aukcji we współczesnej Kanadzie.&nbsp; ",crime
my dinner with andre," Film jest dwugodzinną rozmową, jaką toczy między dwójką zaprzyjaźnionych artystów, Wallace Shawn i Andre Gregory. Bohaterowie spotykają się na eleganckim obiedzie, w... ",biography
robinson crusoe,Robinson Crusoe i zwierzęta zamieszkujące bezludną wyspę łączą siły w walce z dwoma złymi kotami. ,animation
onward,"Dwóch braci próbuje sprowadzić na ziemię drugą połowę ciała swojego ojca, gdyż nieudane czary powodują, że pojawia się tylko od pasa w dół. ",animation
hellraiser,"Frank Cotton nabywa tajemniczą kostkę, za pomocą której można przywołać demony z piekła.",horror
escape from planet earth,"Scorch Supernova z planety Baab wybiera się w podróż na Ziemię. Gdy mieszkańcy nie zareagują na niego przyjaźnie, wróci z całą rodziną. ",animation
a night at the opera,Przebiegły menedżer oraz dwaj szaleni przyjaciele pomagają odnieść sukces parze wokalistów operowych. ,family
big,Dwunastoletni chłopiec wypowiada życzenie w wesołym miasteczku. Następnego dnia budzi się jako mężczyzna.,family
battle of the bulge,"Rekonstrukcja jednej z największych bitew podczas drugiej wojny światowej, w której&nbsp;starły&nbsp;się armie nazistów i aliantów.",drama
thelma,"Żyjąca w środowisku fanatyków religijnych Thelma odkrywa, że posiada nadprzyrodzone moce.",drama
look whos talking,Historia opowiadana z perspektywy nowo narodzonego dziecka. Jego matka zaszła w ciążę ze swoim żonatym pracodawcą. Niespodziewanie w jej życiu pojawia się sympatyczny taksówkarz.,family
anne of the thousand days,"Henryk VIII zrywa kontakty z Kościołem, aby unieważnić swoje małżeństwo i móc ponownie wziąć ślub.",biography
oculus,"Kaylie Russell&nbsp;stara się oczyścić z zarzutów skazanego za morderstwo brata. Chce dowieść, że przestępstwo zostało popełnione przez istoty nadprzyrodzone.",horror
velvet buzzsaw,"Budzący respekt krytyk, wyrachowana właścicielka galerii i&nbsp;jej asystentka przejmują obrazy niedawno zmarłego artysty.&nbsp;",horror
another day of life,"Historia trzymiesięcznej wyprawy wybitnego reportera Ryszarda Kapuścińskiego do ogarniętej wojną i chaosem Angoli, gdzie linia frontu zmienia się jak w kalejdoskopie. ",documentary
chelovek s kinoapparatom,Dżiga Wiertow rejestruje okiem kamery życie w Moskwie pod koniec lat dwudziestych XX wieku. ,documentary
jai tue ma mere,"Nastoletni chłopak jest wychowywany przez samotną matkę, z którą nie może znaleźć wspólnego języka.",biography
species,"Naukowcy tworzą kombinację ludzkiego i pozaziemskiego DNA. Sil, będąc efektem tego eksperymentu, ucieka z laboratorium. ",thriller
the goonies,"Grupa dzieciaków znajduje mapę, która wskazuje drogę do ukrytego skarbu legendarnego pirata. ",family
mollys game,"Była narciarka Molly Bloom zakłada najbardziej ekskluzywny, nielegalny klub pokerowy w USA. Pewnego dnia do drzwi bohaterki pukają agenci FBI. ",biography
twisted,"Policjantka, której ojciec był seryjnym mordercą odkrywa, że ktoś zabija jej byłych kochanków.",crime
szczesliwego nowego jorku,"Losy szóstki polskich emigrantów w Nowym Jorku, którzy różnymi sposobami starają się przeżyć i sprostać trudnej amerykańskiej rzeczywistości.",drama
network,Stacja telewizyjna wykorzystuje rewelacje głoszone przez obłąkanego prezentera wiadomości dla własnych korzyści.,drama
green book,Drobny cwaniaczek z Bronksu zostaje szoferem ekstrawaganckiego muzyka z wyższych sfer i razem wyruszają na wielotygodniowe tournée.,drama
midsommar,Młoda para w czasie wakacji odwiedza odizolowaną od świata szwedzką wioskę. Wkrótce dowiaduje się o ekscentrycznych miejscowych tradycjach.,horror
terminator: dark fate,"Sarah Connor powraca, aby chronić dziewczynę imieniem Dani przed nowym Terminatorem Rev-9. ",action
hercules in new york,"Mityczny Herkules przybywa do Nowego Jorku, gdzie radzi sobie z trudami życia zwykłego człowieka. ",fantasy
striptease,Była agentka FBI pracuje w klubie jako striptizerka.,thriller
doragon boru z: fukkatsu no fyushon!! goku to bejita,"Bramy piekieł zostają otworzone, a uwolnione zło kumuluje się w jednej istocie. Son Goku i Vegeta planują pokonać przeciwnika, by uratować świat.",action
the lego movie 2: the second part," Minęło pięć lat od czasu, kiedy wszystko było czadowe. Mieszkańcy Klocburga stoją w&nbsp;obliczu nowego, ogromnego zagrożenia. Pochodzący z&nbsp;kosmosu najeźdźcy LEGO... ",animation
legend,"Lata 50. i 60. Londyńscy gangsterzy-bliźniacy, Ronald oraz Reginald Kray, terroryzują miasto. ",biography
penthouse north,"Niewidoma kobieta zostaje napadnięta przez mężczyznę sądzącego, że w jej mieszkaniu znajdują się drogocenne diamenty.",thriller
g.i. joe: retaliation,"Podczas rutynowej misji oddział Joe zostaje zdradzony i prawie całkowicie wymordowany. Ocaleli członkowie ekipy postanawiają dowiedzieć się, kto stoi za atakiem oraz wymierzyć sprawiedliwość.",action
wonder woman,"Amazońska księżniczka Diana przybywa do cywilizowanego świata, aby pokonać boga wojny dążącego do zniszczenia ludzkości. ",action
the chronicles of riddick,"Armia okrutnych Necromongerów najeżdża galaktykę. Jedyną istotą, która może im się przeciwstawić, jest awanturnik i ścigany więzień Riddick, mający dar widzenia w ciemności.",action
against the ropes,Podczas ulicznej bójki Jakie Kellen dostrzega Luthera Shawa. Kobieta zostaje jego menedżerką i postanawia uczynić z niego mistrza boksu.,comedy
the return of the texas chainsaw massacre,"Czworo nastolatków&nbsp;uczestniczy w stłuczce.&nbsp;Szukając pomocy, trafiają do domu rodziny kanibali.",horror
serbuan maut,Elitarny oddział SWAT wkracza do siedziby kartelu narkotykowego. Podczas akcji policjanci wpadają w pułapkę.,action
hyde park on hudson,"Rok 1939. Brytyjski król Jerzy VI jedzie z oficjalną wizytą do USA, aby przekonać prezydenta Roosevelta do zaangażowania się w wojnę w Europie.",biography
the witches of eastwick,Trzy niemłode już kobiety marzą o poznaniu mężczyzny. Wkrótce w miasteczku pojawia się tajemniczy nieznajomy. ,fantasy
tatarak,"Kobieta, która straciła synów na wojnie, odnajduje ukojenie w przyjaźni z młodym mężczyzną. Tymczasem jej mąż skrywa przed nią sekret, który może odmienić jej życie.",drama
linstinct de mort,"Opowieść o życiu największego przestępcy minionego wieku - Jacquesa Mesrine'a, który dwukrotnie uciekał z więzienia. ",biography
hua mulan,"Młoda dziewczyna przebiera się za mężczyznę i wyrusza na wojnę, by uchronić od tego obowiązku schorowanego ojca.",drama
krampus,"Starożytny demon Krampus przybywa zza światów, aby ukarać rodzinę, która nie czuję magii Bożego Narodzenia.",fantasy
the to do list,"Nastoletnia Brandy Clarke postanawia doświadczyć przed pójściem na studia wszystkiego z listy ""do zaliczenia"". ",comedy
ghost busters,Trzech doktorów parapsychologii zakłada firmę zajmującą się zwalczaniem duchów. Wkrótce będą musieli zmierzyć się z pradawną złą mocą opanowującą miasto.,horror
immortal beloved," W burzliwy wieczór 26 marca 1827 r., chory na zapalenie płuc Ludwig van Beethoven umiera w swoim wiedeńskim mieszkaniu. Trzy dni póżniej zostaje pochowany na cmentarzu... ",biography
neko no ongaeshi,"Haru ratuje życie kotu, który w podzięce zabiera ją do swojego królestwa. Sprawy komplikują się, gdy władca krainy proponuje dziewczynie małżeństwo ze swoim synem. ",family
"you, me and dupree",Beztroski Randolph zamieszkuje tymczasowo u żonatego przyjaciela. Pani domu nie jest zachwycona jego obecnością.,comedy
j. edgar,"J. Edgar Hoover, dyrektor FBI w latach 1924-1972, wspomina swoje życie prywatne i zawodowe. ",biography
heartbreakers,"Matka z córką tworzą nietypowy duet oszustek. Max wychodzi za bogatych mężczyzn, a Page uwodzi ich, doprowadzając do rozwodu i podziału majątku. ",crime
koyaanisqatsi,Film przedstawia zbiór&nbsp;niezwykłych&nbsp;obrazów z życia Ziemi i ludzi.,documentary
kokowaah,"Życie scenarzysty Henry'ego zostaje wywrócone do góry nogami, kiedy poznaje małą Magdalenę.",comedy
the hunt for red october,"Radziecki atomowy okręt podwodny wypływa w swój pierwszy rejs. Jego dowódca ogłasza, że zamierza zdezerterować, co nie podoba się władzom ZSRR, które wysyłają za nim pościg.",thriller
night will fall,Dokument&nbsp;przedstawia historię wyzwolenia hitlerowskich obozów koncentracyjnych powstałych w trakcie drugiej wojny światowej.,documentary
the imaginarium of doctor parnassus,Doktor Parnassus wystawiający w różnych częściach Londynu przedstawienie umożliwiające wnikanie do świata wyobraźni zostaje wezwany przez Diabła do spłaty długu.,fantasy
